2Mc	7:23	"But the Creator of the world, that formed the nativity of man, and that found out the origin of all, he will restore to you again in his mercy both breath and life, as now you despise these for the sake of his laws." Lapide comments that here the mother grounds her exhortation to martyrdom in the explicit doctrine of bodily resurrection, which is to be effected by the Creator who first formed these bodies; this is a most clear Old Testament testimony to the resurrection of the flesh. # GEM
2Mc	7:24	"Now Antiochus, thinking himself despised, and withal despising the voice of the upbraider, when the youngest was yet alive, did not only exhort him by words, but also assured him with an oath, that he would make him a rich and a happy man, and, if he would turn from the laws of his fathers, would take him for a friend, and furnish him with things necessary." Lapide observes that when violence fails, the tyrant turns to flattery, promises, and oaths, showing that persecution employs both cruelty and seduction; he warns that the temptations of pleasure and wealth are often more dangerous to the soul than open torments.
2Mc	7:25	"But when the young man was not moved with these things, the king called the mother, and counselled her to deal with the young man to save himself." Lapide notes that Antiochus here makes use of maternal affection as an instrument of temptation, calculating that love of a mother for her youngest and last remaining child would succeed where threats and promises had failed.
2Mc	7:26	Lapide begins his commentary on verse 26, where the mother is urged by the king to counsel her son to apostatize, noting that this represents the supreme test of her virtue, in which maternal love and divine love are placed in direct opposition.
2MC	9:1	The satellites brought forward into the midst the eldest of them, as commanded, and tearing his tunic, bound his hands and arms on both sides. Then after they had beaten him with scourges to the point of exhaustion, achieving nothing, they fastened him to a wheel: stretched upon which, the young man was dismembered, all his limbs broken, and he cursed the tyrant in this manner: "Most wicked tyrant, enemy of heavenly justice and cruel one, you torture me in this way not for any murder or impious deed, but for the defense of the divine Law." When the satellites urged him to promise that he would eat, that he might be freed from tortures, he said: "Your wheel is not so powerful, O impure ministers, as to destroy my reason. Cut my limbs, burn my flesh, and rack my joints; for through all these torments I will persuade you that the Hebrews alone are unconquered in virtue." As he spoke these words they applied fire beneath him, and stretched the wheel ever more and more, so that it was wholly drenched with blood, and the pile of the pyre was extinguished by drops of gore, and the axles of the machine overflowed with flesh. But that magnanimous youth, descended from Abraham, though now stripped of the framework of his bones, did not groan, but as though being transformed in the fire into immortality, bore his sufferings bravely. "Imitate me, brothers," he said, "and do not abandon the manner of my life, nor renounce the eager spirit of your brother. Fight the sacred and noble warfare for piety: by which may that just and ancestral providence of our God, made propitious to our people, inflict punishment upon the wicked tyrant." Having spoken thus, that holy young man breathed his last.
2MC	9:2	THE REST TOGETHER WITH THEIR MOTHER EXHORTED ONE ANOTHER TO DIE BRAVELY, saying to one another,
2Mc	13:1	[General introduction to ch. 13] Lapide here transitions to commentary on the Maccabean martyrs' mutual exhortation: "Brothers, let us die for the Law; let us imitate those three young men in Assyria who despised that vast furnace; let us not grow soft in displaying our piety." One said to another: "Be of good courage, brother." Another: "Endure nobly." Another, reminding the rest of their forebears, said: "Remember whence you come, and by whose father's hand Isaac suffered himself to be sacrificed for piety." Finally all, looking upon one another joyfully and very eagerly, said: "Let us consecrate ourselves with whole heart to God who gave us our souls, and let us spend our bodies in keeping the law." And shortly after: "Thus shall Abraham, Isaac, and Jacob receive us when we are dead, and all the fathers shall praise us." Then each of those brothers who remained, as they were being torn away, exhorted thus: "Do not disgrace us, brother, nor degenerate from our brothers who have already died."
2Mc	13:2	[On "God will look upon the truth" (v. 6)] "God will look upon the truth" means God will consider and render what is just — namely, that we are innocent and just, and are unjustly tormented by you, O tyrant, and therefore He will crown us with the laurel of martyrdom. "He will comfort in us" means He will be our aid and consolation, pouring His consolations into us, that we may nobly overcome you and your torments, as Moses sang in the Canticle of Deuteronomy 32:36, promising that God would do this.
2Mc	13:3	[On the second martyr, v. 8 — "with a paternal voice"] "Answering with a paternal (that is, manly) voice" means he responded not with a child's thin voice but with the strong, full voice of a father and man, as described in v. 21. He said (the second, named Aber): "I will not do this, I will not eat swine's flesh. This is my firm purpose, this my steadfast will." Hear Josephus adding much and adorning the martyr with his eloquence — perhaps also, as is his custom, adding and embellishing some things from his own invention: "The guards bring forward the second in age and, fastening iron hands with sharp claws upon him, bind him to a catapult (which is a machine). Then, having asked him before torturing whether he wished to escape, when they heard his noble reply, beginning from the soles of his feet, they tore all his flesh with those iron hands up to his chin, and lacerated the skin of his head with leopard-like savagery. He, enduring that most grievous pain, said: 'Every kind of death is sweet for the religion of our fatherland. Do you not think, O most cruel of all tyrants, that you are tormented more than I, when you see this cruel system of tyranny overcome by our patience for piety? For I ease pain with the pleasures of virtue; you are tormented in the threats of your impiety. Nor will you escape, most impure tyrant, the punishments of divine wrath.'" Following Josephus, St. Ambrose (De Jacob et Vita Beata, bk. 2, ch. 11) says: "The second came forward and, not unworthy of his brother, fulfilled the duties of holy confession. And when the membrane of his head was being stripped off, he answered: 'You take away the membrane indeed, but I have a spiritual helmet which you cannot take away.'" # GEM And truly no one can take away this helmet, as the Apostle afterward taught in the Church of the Lord, because Christ is the head of man and we are His members. Rightly did this boy, taught by the divine Spirit, foresee this Apostolic doctrine. The savage beasts stripped the skin of his head and raged with leopard-like ferocity. And he, at the point of death, said: "How sweet it is to die for religion! How pleasant is every bitterness of death for piety! because the reward of these labors remains. Your torments, O king, are the more grievous; you are vehemently tormented by your own punishments, because you see yourself overcome in power."
2Mc	13:4	[On the third martyr, v. 10 — "the third is mocked"] "After this the third is mocked, and being asked, quickly put out his tongue and steadfastly extended his hands" — that with the tongue which had despised the king, and the hands might be cut off and fried in the pan. St. Cyprian (De Exhortatione Martyrii) presses upon "he extended his hands" and says: "Most blessed in this kind of punishment, he steadfastly extended his hands to be cut off — he to whom it fell, with hands extended for punishment, to imitate after a fashion the suffering of the Lord." # GEM
2Mc	13:5	[On the third martyr's confession, v. 11 — "from heaven I possess these"] "And with confidence he said: 'From heaven I possess these, but for the laws of God I now despise these very things, since I hope to receive them back from Him.'" Josephus (ch. 10) adds: "But he cried out: 'Do you not know that I was begotten by the same father and born of the same mother as these who are dead, and that we were reared in the same household? I will not renounce so noble a brotherhood.' Then they, indignant at the man's liberty, disjointed his hands and feet with tearing machines, and loosening his joints, tore him limb from limb and broke his fingers and arms and legs and elbows. And when they could in no way destroy him, they tore away the skin together with the tips of his fingers. Then they led him immediately to the wheel; fastened upon it, as he was being disjointed joint by joint, he saw his flesh being rent and drops of blood dripping from his entrails, and now about to die he said: 'We indeed, O most impure tyrant, suffer these things for the discipline and virtue of God; but you for your impiety and unspeakable murders will bear immense tortures.'" Following Josephus, St. Ambrose (De Jacob et Vita Beata, ch. 11) says that this third, while being tortured, said: "I will not do your will, I will not yield to your command. By the blessed passion of my brothers and their noble life I will not deny our holy brotherhood. Apply whatever punishments you will, press harder — you will gain this much by the harshness of your penalties: that you receive greater testimonies of our brotherhood." He ordered therefore that his tongue be cut off. And he cried out: "You are defeated, Antiochus, who command the instrument of voice to be cut off. You have confessed that you cannot answer reason, and you prove the scourges of our tongue greater than your blows. For we do not fear your blows; you cannot endure the scourging of our voice. But these are the scourges of piety; your scourges are those of faithlessness. But even when removed, it will scourge you the more heavily with its falling murmur. Do you think you escape, Antiochus, if you take away the voice? God hears those who are silent, and hears them more. Behold I have opened my mouth, I have loosed my tongue — cut off the tongue; but you will not cut off constancy, you will not take away virtue, you will not blot out reason, you will not wrest away the testimony of truth, you will not wrest away the cry of the heart. If the tongue is cut off, the blood will cry out, and it will be said to you: 'The voice of your brother's blood cries to me.' And shortly after: wounds are more eloquent; even if wounds are covered, even if the scar is hidden, faith is not hidden. Yet do not applaud yourself that by removing the tongue you take away the confession of praise. For I have sufficiently praised God with speech; now let us praise Him with suffering." # GEM
2Mc	13:6	[On the fourth martyr, v. 13] "And when he had thus died, they vexed the fourth." These later brothers suffered more than the earlier ones: First, because the king's anger boiled more fiercely against them on account of the many sharp reproaches the earlier ones had hurled at the king. Second, because these were younger in age, and therefore weaker in body and spirit. Third, because in watching their brothers so cruelly tortured they suffered the same things through compassion. Fourth, because they saw themselves about to suffer the same things shortly. Thus they were tormented more grievously by the harsh torture of their brothers and the prolonged anticipation and expectation of their own torture. Hence St. Leo, in his sermon on the Nativity of the Seven Maccabees, says: "The king's impiety devised this, that he might promise himself victory even from the first."
2Mc	6:1	The reasons why the Maccabean martyrs are celebrated with such devotion are many: first, because they were the first to fight openly and publicly for the true faith and worship of God; second, because they did so in the Old Testament, when faith and knowledge of God, Christ, and the future life and resurrection were obscure; third, because they suffered in tender and youthful age, when life is most pleasant and death most bitter; fourth, because their persecutor and torturer was Antiochus Epiphanes, the most savage and cruel tyrant; fifth, because they resisted him most bravely, and each one rebuked him sharply and called him most wicked; sixth, because they endured torments of every kind.
2Mc	6:1	Learn from these Jews, O Christian, what you must do in any temptation, persecution, or affliction—which is far less than theirs—and how nobly you ought to overcome it: "You have not yet resisted unto blood" (Heb. 12). Who stretched you on the tympanum and beat you? Who boiled you in a pot? Who fried you in a pan? as happened to these seven brothers, who nevertheless endured all things with brave and cheerful spirit, so that you in your lesser trials might do the same in hope of blessed eternity.
2Mc	6:1	The spurs to enduring and overcoming all these things nobly were, for the Maccabees: first, faith and hope in Christ soon to come, from whose foreseen merits God gave them abundant grace, fortitude, and constancy; second, hope of a better life and of blessed resurrection, namely that the members they exposed to torments would be restored to them by God in the resurrection, splendid and glorious; third, that the suffering would be brief and moderate, while the reward in heaven would be immense and eternal.
2Mc	6:1	This animated all martyrs in even the most bitter torments; whence St. Sebastian strengthened St. Mark and Marcellian, wavering at the weeping of their parents, with this dilemma: The torments to be inflicted on you are either severe or light. If severe, they will quickly bring death and send you to heaven. If light, they will be easy to bear. Therefore endure either bravely, for brief pain prepares eternal joy for you. For the moment that tortures is brief; the joy that delights is eternal.
2Mc	6:1	Fourth, because their mother bravely encouraged each one and sharply spurred them to persevere in their ancestral religion; fifth, the example of the old man Eleazar, shown in the dreadful torments of the tympanum in the preceding chapter.
2Mc	7:20	The mother is called Salome in the Greek Calendar; Salomona by Josephus; Anna, meaning grace, by Gorionides and Genebrard; Machabaea by St. Thomas, because she was the mother of the Maccabees. Again by Josephus (ch. 14) she is called Abraa, because, he says, she was mindful of holy Abraham's endurance, and as Abraham offered his Isaac, so she offered her seven sons to God. Josephus celebrates her with wonderful praises: "Not so does the moon stand beautiful among the stars in heaven, as you, who illumined seven stars—namely your seven sons—to the glory of God, stand glorious before God, and are fixed in heaven together with them."
2Mc	7:20	Whence in ch. 15, admiring her strength, he exclaims: "O mother of the nation, champion of the Law, defender of piety, and victress of the contest fought through your very bowels! O more noble in continence than men, and stronger in patience than warriors. For as the ark of Noah in that universal flood of the whole world, bearing the pure, steadfastly endured the waves: so you also, that guardian of the law, when overwhelmed on all sides by the flood of affections and beaten as by violent winds of torments, bore admirably the contest undertaken for piety." # GEM
2Mc	7:20	Wherefore St. Cyprian (De exhortatione ad martyrium): "She offered to God as great a martyrdom by the virtue of her eyes as her sons offered by the torments and suffering of their members." And St. Chrysostom (Hom. 14 on the words of Isaiah): "The mother of the martyrs herself performed martyrdom seven times; for while they were being tortured, she was receiving the blow." # GEM
2Mc	7:20	St. Ambrose (De Officiis, bk. 1, ch. 41): "She looked joyfully upon as many funerals of her sons as there were trophies, and was more delighted by the voices of the dying than by the chanting of psalms; beholding the most beautiful harp of her womb—strung, as it were, with seven strings—in her sons, and the harmony of piety sweeter than all the music of the lyre." # GEM
2Mc	7:20	St. Gregory Nazianzen (Orat. 22), admiring this virtue beyond measure: "O truly a man's soul in a woman's body! O sacrifice greater and more excellent than Abraham's sacrifice! For he offered one with ready spirit, but she consecrated to God a whole people of sons." # GEM
2Mc	7:21	She encouraged each of them in their ancestral tongue—that is, Hebrew, says Josephus. Salianus prefers to interpret "ancestral voice" as brave and manly, such as is customary for a father's voice; as if to say, she encouraged them not with a maternal and feminine voice, but with a paternal and virile one. Hence the Greek πατρίδος is derived not from "country" but from "father," meaning "paternal"; she spoke manfully, as a father, not effeminately, as a mother.
2Mc	7:21	Wherefore the text adds in explanation: "filled with fortitude" (in Greek, with nobility), "and stirring up her womanly thought with a manly spirit." Hear Nazianzen (Orat. 22) painting graphically the feelings and gestures of this heroine: "That vigorous mother, truly the parent of men endowed with such great virtue, was affected at once with joy and fear, and stood on the border of two emotions: for as she took joy from their fortitude and what she saw, so again when she pondered the uncertain outcome of the fight and the incredible magnitude of the torments, she was tormented by fear." # GEM
2Mc	7:21	"And so she hovered around them like a little bird when a serpent or some other treacherous beast seizes her chicks, crying out, beseeching, striving together with them, leaving nothing unsaid or undone to make them readier and more eager for victory. She caught drops of blood, received fragments of limbs, venerated the relics, gathered one, offered another, prepared a third, cried out to all: 'Well done, my sons, well done, my brave soldiers, well done, almost incorporeal in your bodies, well done, defence and bulwark of the law and of my aged years and of the city that nourished you. A little longer and we have conquered; the executioners grow weary. This one thing I fear. A little longer, and I shall be blessed among women, and you blessed among the young. But perhaps longing for your mother troubles you? I will not abandon you. This I promise you, I do not hate my children so...'" # GEM
2Mc	7:24	Antiochus was tormented by the such great constancy of the martyrs, because he could not overcome them but was defeated by each one in turn.
2Mc	11:1	Lysias, the king's guardian and kinsman, who had charge of the affairs of state, was greatly displeased at what had happened.
2Mc	11:2	He gathered about eighty thousand infantry and all his cavalry and came against the Jews, intending to make Jerusalem a Greek settlement.
2Mc	11:3	He also intended to levy tribute on the temple, as he did on the other sacred places of the Gentiles, and to put the high priesthood up for sale every year.
2Mc	11:4	He took no account whatever of the power of God, but was elated with his ten thousands of infantry, his thousands of cavalry, and his eighty elephants.
2Mc	11:5	So he invaded Judea, approached Beth-zur, which was a fortified place about five leagues from Jerusalem, and pressed it hard.
2Mc	11:6	When Maccabeus and his men got word that Lysias was besieging the strongholds, they and all the people, with lamentations and tears, besought the Lord to send a good angel to save Israel.
2Mc	11:7	Maccabeus himself was the first to take up arms, and he urged the others to risk their lives with him to aid their kindred. Then they eagerly rushed off together.
2Mc	11:8	And there, while they were still near Jerusalem, a horseman appeared at their head, clothed in white and brandishing weapons of gold.
2Mc	11:9	And together they all praised the merciful God, and were strengthened in heart, ready to assail not only humans but the most savage beasts or even walls of iron.
2Mc	11:10	They advanced in battle order, having their heavenly ally, for the Lord had mercy on them.
2Mc	11:11	They hurled themselves like lions against the enemy, and laid low eleven thousand infantry and sixteen hundred cavalry, and forced all the rest to flee.
2Mc	11:12	Most of them got away stripped and wounded, and Lysias himself escaped only by shameful flight.
2Mc	11:13	As he was not without intelligence, he pondered over the defeat that had befallen him, and realized that the Hebrews were invincible because the mighty God fought on their side. So he sent to them
2Mc	11:14	and persuaded them to settle everything on just terms, promising that he would persuade the king, constraining him to be their friend.
2Mc	11:15	Maccabeus, having regard for the common good, agreed to all that Lysias urged. For the king granted every request that Maccabeus delivered to Lysias in writing concerning the Jews.
2Mc	11:16	The letter written to the Jews by Lysias was to this effect: "Lysias to the people of the Jews, greetings.
2Mc	11:17	John and Absalom, who were sent by you, have delivered your signed communication and have asked about the matters indicated therein.
2Mc	11:18	I have informed the king of everything that needed to be brought before him, and he has agreed to what was possible.
2Mc	11:19	If you will maintain your goodwill toward the government, I will endeavor in the future to help promote your welfare.
2Mc	11:20	And concerning these matters and their details, I have ordered these men and my representatives to confer with you.
2Mc	11:21	Farewell. The one hundred forty-eighth year, Dioscorinthius twenty-fourth."
2Mc	11:22	The king's letter ran thus: "King Antiochus to his brother Lysias, greetings.
2Mc	11:23	Now that our father has gone on to the gods, we desire that the subjects of the kingdom be undisturbed in caring for their own affairs.
2Mc	11:24	We have heard that the Jews do not consent to our father's policy concerning Greek customs but prefer their own way of living and ask that their own customs be allowed them.
2Mc	11:25	Accordingly, since we choose that this nation also should be free from disturbance, our decision is that their temple be restored to them and that they shall live according to the customs of their ancestors.
2Mc	11:26	You will do well, therefore, to send word to them and give them pledges of friendship, so that they may know our policy and be of good cheer and go on happily in the conduct of their own affairs."
2Mc	11:27	To the Jews the king sent the following communication: "King Antiochus to the council of the Jews and to the other Jews, greetings.
2Mc	11:28	If you are in good health, it is as we desire. We also are in good health.
2Mc	11:29	Menelaus has informed us that you wish to return home and look after your own affairs.
2Mc	11:30	Therefore those who go home by the thirtieth day of Xanthicus will have our pledge of friendship and full permission
2Mc	11:31	for the Jews to enjoy their own food and laws, just as formerly, and none of them shall be molested in any way for what may have been done in ignorance.
2Mc	11:32	And I have also sent Menelaus to encourage you.
2Mc	11:33	Farewell. The one hundred forty-eighth year, Xanthicus fifteenth."
2Mc	11:34	The Romans also sent them a letter, which read thus: "Quintus Memmius and Titus Manius, envoys of the Romans, to the people of the Jews, greetings.
2Mc	11:35	With regard to what Lysias the kinsman of the king has granted you, we also give our consent.
2Mc	11:36	But as for the matters that he decided are to be referred to the king, as soon as you have considered them, send someone promptly, so that we may make proposals appropriate for you. For we are on our way to Antioch.
2Mc	11:37	Therefore make haste and send some people, so that we may make known what is your preference.
2Mc	11:38	Farewell. The one hundred forty-eighth year, Xanthicus fifteenth."
2Mc	7:41	Finally, after her sons, the mother also perished. The Greek has ἐτελεύτησε, that is, she died. But by what kind of death? First, some think she died from immense joy, seeing all her sons triumph so gloriously over the tyrant. So Marius Victorinus in his poem on the Maccabees: "While she endured these things," he says, "joy dissolved the mother; and now, as she was already weakened by her woes, now with voice denied, sighing, and collapsing into the hands of her own people, she fell lifeless, and her loosened limbs found rest; thus the very mother of the Saints was received into her portion." Similarly, certain Roman mothers were struck dead by joy when they suddenly saw sons whom they had heard had fallen in battle against Hannibal, as the witness records.
2Mc	7:1	The martyrs surpassed men in their fortitude and alacrity; for as has been rightly said: "Greater virtue reigned in their small bodies, and divine virtue is perfected in human weakness." In the small, the great Christ conquers and triumphs; and therefore He Himself chose the weak things of the world to confound the strong, so that he who glories should glory not in himself but in the Lord (1 Cor. 1). # GEM
