2Mc	1:1	The contrary opinion, however, as it is more common, so also is it more true: namely, that the ark, the tabernacle, and the altar of incense were not found together with the sacred fire under Nehemiah and Darius, but are to be revealed at the end of the world, when God through Elijah and Enoch will convert His people, that is, the Jews, to Christ, and will gather them together with the Gentiles into one Church. For then Elijah, in order to confirm them in the faith of Christ, will show them the ark promised by Jeremiah for that age. This is proved first, because if these things had been found along with the fire, the author here would certainly have narrated that same fact here, just as he narrated concerning the fire; for this would have pertained plainly to the present matter. But now he narrates nothing of the sort here. Second, because under Nehemiah no complete
2Mc	2:1	Many Jews indeed remained in Babylon; others were dispersed into various regions. Thirdly, if the ark had been found, at the time of the spoliation of the second temple which was carried out by Titus, it would have been placed among the spoils. But it is not placed [among them] according to Jose[phus].
2Mc	6:1	Josephus relates what Pompey saw when he entered the Holy of Holies, enumerating that there was absolutely nothing of the sacred things in the Holy of Holies. When Pompey entered into that same Holy of Holies, Josephus recounts what he saw in the temple.
2MC	8:1	Judas Maccabaeus, with about six thousand men, called upon the Lord to look upon the people who were trodden down by all, and to have pity on the temple that had been profaned by ungodly men.
2MC	8:1	The ark of the covenant was hidden by Jeremiah, as noted above; it was never restored to the second temple. This is confirmed four ways: first, from 2 Maccabees 2; second, from Josephus; third, because on the triumphal arch of Titus in Rome we see depicted the golden candlestick and the table of showbread, but no ark is depicted; fourth, because this is the common opinion of the Hebrews, who constantly assert that these vessels were absent from the second temple. The same is asserted by Latin and Greek writers, as St. Epiphanius and Dorotheus, already cited in the life of Jeremiah, St. Thomas, Lyranus, and others.	# GEM
2Mc	9:0	Some add that the Hebrews, when the ark, the tabernacle, and the altar of incense made by Moses were lacking, fabricated similar ones and placed them in the second temple (for the temple required this adornment as proper to itself); and this is sufficiently gathered from 1 Macc. 1:23, where it is said that Antiochus Epiphanes took from the temple the golden altar and the lampstand of light, and the table of the showbread.
2Mc	9:0	Nebr., Chronol. anno mundi 3730, Bellarmine de verbo Dei c. 15, Abulensis on Exod. c. 15, q. 1, assert that these vessels were hidden in the same place where the body of Moses was laid, and that they will appear when the body of Moses rises again and appears, which will be at the end of the world. So also Dorotheus in the Life of Jeremiah says that he hid the ark in the tomb of Moses and Aaron. Cosmas Magallanes, preface to Joshua, section 6, holds the same view.
2Mc	11:0	The argument of the second book was the same as that of the first, namely the deeds of Judas Maccabaeus and his brothers: for these things, written briefly in the first book, are narrated more fully here; and many things are also added which were omitted in the first book.
2Mc	11:0	[Antiochus the Noble] that is, Antiochus Epiphanes: for ἐπιφανής in Greek means the same as illustrious, noble; he was so called by the Gentiles on account of his illustrious deeds, although more truly he was surnamed ἐπιμανής by Polybius and others, that is, mad and insane, as I said in book 1.
2Mc	11:0	[AND OF THE ILLUMINATIONS WHICH WERE MADE FROM HEAVEN FOR THOSE WHO FOUGHT BRAVELY FOR THE JEWS.] By illuminations from heaven he means the signs sent from heaven on behalf of Judas and his companions, who, aided by the help of Angels and fighting bravely for the Jews, overthrew the great armies of Antiochus. Hence Angels appeared to Judas, and went before his camp as leaders of war, as we shall hear in what follows.
2Mc	11:0	[THE LORD HAVING BEEN MADE PROPITIOUS TO THEM WITH ALL TRANQUILITY,] as if to say: the Lord calming and settling the disturbances, tumults and battles launched against the Jews by Antiochus, and restoring to them their former peace. For the tranquil God tranquilizes all things, and to look upon tranquilly is to rest, as one of the Saints says.
2Mc	11:0	[And likewise what was contained by Jason of Cyrene in five books, we have attempted to abridge into one volume,] that is, to reduce into this brief volume. Calvin and the Innovators object that this Jason was a Cyrenean, and therefore a Gentile, and accordingly this book, which is an abridgment of Jason, is not sacred and canonical. The reply is that this Jason was a Jew, not a Gentile: for Jews were scattered throughout the whole world, and therefore dwelt also in Cyrene, as is clear from Acts 2 and 6. For Gentiles were enemies of the Jews, and mocked, belittled, and distorted their law, rites, and deeds. But this Jason extols and celebrates all these things, as is clear from what follows. Therefore he was himself a true worshipper of God, an upright and pious man, and a zealot for the worship of God.
2Mc	11:0	But even granting that Jason had been a Gentile, Judas nonetheless, who selected, arranged, ordered, composed, and made his own the writings of Jason, and reduced them into this book, with the Holy Spirit always assisting him lest he err anywhere, made this book canonical. Wherefore he accomplished the same effect as if whatever was false, impious, or obscene in the books of Jason, Judas would omit or correct. Note here the canon: When a canonical author cites and approves the sayings of some profane author, by this very act he makes them canonical. Thus St. Paul in Titus 1:12 cites that saying of Epimenides: "Cretans are always liars, evil beasts, lazy gluttons"; and adding: "This testimony is true," by this very act he attributes to it canonical and infallible authority. Similarly that saying of Job 5:13: "He catches the wise in their craftiness," as it was said by Epiphar the Gentile, does not have canonical authority; yet it acquired it when cited and praised by Paul in 1 Cor. 3:19. In like manner Judas, this canonical author, by citing and praising the words of Jason, made them canonical. So again Paul in Acts 17:28, citing and approving those words of Aratus: "For we are indeed his offspring," attributes to them canonical authority. So Sanchez, Serarius, Bellarmine and others. # GEM
2Mc	11:0	[We have undertaken a task full of watchfulness and toil.] For it is a work of great labor and industry to read very many things, and to compress and comprise all of them methodically, elegantly, clearly, and fully in few words. Thus labored he who transcribed the Iliad of Homer in such minute letters that he enclosed the whole of it within the shell of a nut, as Pliny testifies in book 7, chapter 21; and Archimedes, who, as Cicero says in the Tusculans, bound the motions of the moon, sun, and five wandering stars into a sphere, and that with divine genius. And because few know how to do this, hence compilations are often deficient. To embrace many things in few words is therefore the mark of a great man and of a profound intellect, which perceives and grasps the point of manifold truth in a single glance of the mind. This Laconism, that is, brevity of speech, is the sign of a silent, meditative, and wise mind, and therefore it was used by the seven sages of Greece, whose sayings are these: "Know thyself," "Nothing in excess," "Be surety, harm is at hand," etc. Hear Plutarch in his treatise On Garrulity: "The praises of silence and taciturnity must always be heard, and their majesty, sanctity, and likeness to sacred mysteries, and how those who are more admired, more beloved, and accounted wiser, are those who are restrained and brief in speech, and in whose brief utterance there is great meaning. For Plato also praises these men, teaching that they are like skilled javelin-throwers, when they release words that are crisp, dense, and intertwined with one another. And Lycurgus, restraining his citizens from boyhood in silence, trained them in this skill of speaking concisely and compactly. For just as the Celtiberians strengthen and solidify iron by burying it in the earth, purging away the thick and earthy parts, so Laconic speech was stripped of its bark, and sharpened into effectiveness by the removal of superfluities: for that skillful brevity of speaking, and versatile sharpness in replies, was the fruit of much silence."
2Mc	11:0	[CONCEDING THE TRUTH INDEED TO THE INDIVIDUAL AUTHORS (in Greek: to the author, namely Jason of Cyrene), BUT OURSELVES ACCORDING TO THE GIVEN (already stated) FORM STRIVING FOR BREVITY,] as if to say: I, Judas, the writer of this book, did only this: to abridge the writings of Jason; wherefore I did not wish to scrutinize carefully the truth of individual matters, even the most minute, as written by him, but I attribute the praise of this truthfulness to Jason, as a writer who is upright, truthful, and exact, who first diligently investigated all these things and wrote down only what was certainly established. Thus he thinks modestly of himself, and
2Mc	11:1	SICUT ENIM NOVAE DOMUS ARCHITECTO.] From the same modesty, Judas here compares Jason to the architect of a great building, upon whom falls the arrangement and construction of the entire structure; but himself to the painter who adorns an already completed building with his painting, as if to say: it belongs to the historian to construct the framework of history; but it belongs to the abbreviator to adorn it with his own brief and elegant style.
2Mc	11:2	ETENDI INTELLECTUM COLLIGERE.] He calls 'intellectum' the argument, or rather the subject matter which the historian gathers together and sets before the reader to be read and understood.
2Mc	11:3	EXSECUTIONES RERUM VITARE HI BREVIANT CONCEDENDUM EST.] In Greek: to omit curiosity of detail must be conceded to one making an abbreviation. As if to say: it belongs to the historical author to investigate and narrate each individual detail with care; but it belongs to the abbreviator to cut away many of these things and to encompass much in few words. For in Greek ἐξεργασίαν signifies work done with great diligence and care, that is, what is treated with curiosity, exactness, fullness and completeness. And this our author calls 'exsecutiones': nor should you consider this word un-Latin. For 'exsequi' means to complete and perfect something, and therefore to do it carefully; whence that saying of Tully in the Orator: 'He follows through all things divinely.' And that of the same in De Universitate: 'There is therefore no doubt that he preferred to follow through eternity, since nothing is more beautiful than the world, nor more excellent than its builder.' And that of the same in De Senectute: 'To follow through all the duties and functions of a king.' Again, and more to the point at hand, 'exsequi' means to expound a matter in minute detail and at length, and to pursue it in narration. Thus Livy, book 5: 'He then followed through what the customary derivation was.' And Cicero in Marius, book 1.27: 'I have,' he says, 'many more obscure matters which I can scarcely follow through in words.' And Pliny, book 35, chapter 8: 'Now I shall run through the celebrated matters with the greatest brevity; for such a following-through, that is, a more extended and fuller narration, is not in keeping with the plan of the work.' Thus here 'exsecutiones' are opposed to the abbreviation which our Author here proposed to himself to follow.
2Mc	11:4	[Chapter 3 Synopsis] The prosperous state of Jerusalem is reviewed under the high priest Onias, which the contentiousness and treachery of Simon the temple prefect disturbed: for he himself betrayed the temple treasures to King Seleucus, who sent Heliodorus to plunder them; but he was sharply beaten by angels, and restored to health by the prayers of Onias, and began to celebrate everywhere the power of God and the sanctity of the temple.
2Mc	11:5	IGITUR CUM SANCTA CIVITAS HABITARETUR IN OMNI PACE.] Therefore when the holy city was inhabited in complete peace, and the laws were still being kept in the best manner, on account of the piety of the high priest Onias, and minds having hatred of evil.
2Mc	11:6	FIEBAT UT ET IPSI REGES ET PRINCIPES LOCUM SUMMO HONORE DIGNUM DUCERENT.] It came about that even the kings and princes themselves considered the place worthy of the highest honor, and adorned the temple with the greatest gifts.
2Mc	11:7	ITA UT SELEUCUS ASIAE REX DE REDDITIBUS SUIS PRAESTARET OMNES SUMPTUS AD MINISTERIUM SACRIFICIORUM PERTINENTES.] So that Seleucus king of Asia provided from his own revenues all expenses pertaining to the ministry of sacrifices.
2Mc	11:8	SIMON AUTEM DE TRIBU BENJAMIN PRAEPOSITUS TEMPLI CONSTITUTUS CONTENDEBAT.] Simon of the tribe of Benjamin, appointed prefect of the temple, was striving, with the high priest opposing him, to bring about something wicked in the city.
2Mc	11:9	SED CUM VINCERE ONIAM NON POSSET VENIT AD APOLLONIUM.] But when he could not overcome Onias, he went to Apollonius the son of Tharseas, who at that time was commander of Coelesyria and Phoenicia.
2Mc	11:10	ET NUNTIAVIT EI PECUNIIS INNUMERABILIBUS PLENUM ESSE SERARIUM JEROSOLYMIS.] And he reported to him that the treasury at Jerusalem was full of countless sums of money, and that the common stores were immense, which did not pertain to the account of the sacrifices; and that it was possible for all of it to fall under the power of the king.
2Mc	11:11	CUMQUE RETULISSET AD REGEM APOLLONIUS DE PECUNIIS.] And when Apollonius had reported to the king concerning the money that had been revealed, the king summoned Heliodorus, who was over his affairs, and sent him with instructions to transport the aforesaid money.
2Mc	11:12	STATIMQUE HELIODORUS ITER EST AGGRESSUS.] And immediately Heliodorus set out on his journey, under the pretense indeed of touring the cities of Coelesyria and Phoenicia, but in reality to carry out the king's purpose.
2Mc	11:13	SED CUM VENISSET JEROSOLYMAM ET BENIGNE A SUMMO SACERDOTE IN CIVITATE ESSET EXCEPTUS.] But when he had come to Jerusalem and had been kindly received by the high priest in the city, he reported concerning the information given about the money, and revealed for what reason he was present; and he asked whether these things were really so.
2Mc	11:14	TUNC SUMMUS SACERDOS OSTENDIT DEPOSITA ESSE HAEC ET VICTUALIA VIDUARUM ET PUPILLORUM.] Then the high priest showed that these were deposits, and provisions for widows and orphans.
2Mc	11:15	QUAEDAM VERO ESSE HIRCANI TOBIAE VIRI VALDE EMINENTIS.] But that some belonged to Hyrcanus son of Tobias, a man of very great distinction, in what the impious Simon had reported; and that the whole amounted to four hundred talents of silver and two hundred of gold.
2Mc	11:16	DECIPI VERO EOS QUI CREDIDISSENT LOCO ET TEMPLO.] But that those who had trusted in the place and the temple, which is honored throughout the whole world, would be deceived, since on account of its reverence and sanctity it was altogether impossible.
2Mc	11:17	AT ILLE PRO HIS QUAE HABEBAT IN MANDATIS A REGE DICEBAT OMNI GENERE REGI EA ESSE DEFERENDA.] But he, on account of those things which he had in instructions from the king, said that by every means these things were to be brought to the king.
2Mc	11:18	CONSTITUTA AUTEM DIE INTRABAT DE HIS HELIODORUS ORDINATURUS.] And when the appointed day had come, Heliodorus entered to make his arrangements concerning these matters. And there was no small fear throughout the whole city.
2Mc	11:19	SACERDOTES AUTEM ANTE ALTARE CUM STOLIS SACERDOTALIBUS JACTAVERUNT SE.] But the priests cast themselves before the altar in their priestly vestments, and called upon from heaven Him who had made the law concerning deposits, that He would keep them safe for those who had deposited them. # GEM
2Mc	11:20	JAM VERO QUI VIDEBAT SUMMI SACERDOTIS VULTUM MENTE VULNERABATUR.] Now indeed whoever looked upon the face of the high priest was wounded in his mind: for his changed face and color declared the inner grief of his soul.
2Mc	11:21	CIRCUMFUSA ENIM ERAT MOESTITIA QUAEDAM VIRO ET HORROR CORPORIS.] For a certain sadness was spread over the man, and a trembling of the body, through which the grief of his heart was made manifest to those who looked upon him.
2Mc	11:22	ALII ETIAM GREGATIM DE DOMIBUS CONFLUEBANT.] Others also came together in crowds from their houses, making public supplication, because the place was about to come into contempt.
2Mc	11:23	ACCINCTAEQUE MULIERES CILICIIS PECTUS PER PLATEAS CONFLUEBANT.] And women girded with sackcloth on their breasts came together through the streets; and even virgins who had been shut in ran forward, some to Onias, others to the walls, and some looked out through the windows.
2Mc	11:24	UNIVERSAE AUTEM PROTENDENTES MANUS IN COELUM DEPRECABANTUR.] And all stretching forth their hands to heaven made supplication.
2Mc	11:25	ERAT ENIM MISERA COMMISTAE MULTITUDINIS ET MAGNI SACERDOTIS IN AGONE CONSTITUTI EXSPECTATIO.] For pitiable was the expectation of the mingled multitude and of the high priest placed in agony.
2Mc	11:26	ET HI QUIDEM INVOCABANT OMNIPOTENTEM DEUM UT CREDITA SIBI HIS QUI CREDIDERANT CUM OMNI INTEGRITATE CONSERVARENTUR.] And these indeed called upon almighty God, that the things entrusted to Him might be preserved with complete integrity for those who had entrusted them.
2Mc	11:27	HELIODORUS AUTEM QUOD DECREVERAT PERFICIEBAT EODEM LOCO IPSE CUM SATELLITIBUS CIRCA SERARIUM PRAESENS.] But Heliodorus was carrying out what he had decreed, himself present in that same place with his attendants around the treasury.
2Mc	11:28	SED SPIRITUS OMNIPOTENTIS DEI MAGNAM FECIT SUAE OSTENSIONIS EVIDENTIAM.] But the spirit of almighty God made great and evident his manifestation, so that all who had dared to obey him, falling by the power of God, were turned to dissolution and terror.
2Mc	11:29	APPARUIT ENIM ILLIS QUIDAM EQUUS.] For there appeared to them a certain horse.
2Mc	3:25	Apparuit enim illis quidam equus — This was an Angel who assumed the form of a horse and rider, so as to oppose Heliodorus as a horseman and, as it were, prostrate him in single combat. "Smote Heliodorus with his forefeet" (Greek: concussit in Heliodorum priores ungulas): for horses fight by kicking. The Greek reads: "rushing forward with great impetus he struck Heliodorus with his front hooves," which serve as armed hands. Thus the Angel's horse struck Heliodorus, cast him down, afflicted him, and nearly killed him. In like manner angels at war appeared to Zechariah (ch. 1) in the form of horses and horsemen, and to St. John (Apoc. 5:2). Livy (Decade 1) writes similarly of Castor and Pollux fighting on white horses for the Romans — things much embellished by the Gentiles.
2Mc	3:25	Moreover this was not an imaginary vision appearing to Heliodorus alone, but a real action — the prostration and scourging of Heliodorus before the entire people. For the text says "appeared" (Greek: ὤφθη, i.e., "was seen") to them — namely to all who were present. Hence what follows:
2Mc	3:26	Alii etiam apparuerunt duo juvenes — Two other Angels appeared, bearing the beauty of virtue and heavenly character. They stood around Heliodorus and scourged him from both sides without ceasing, with many blows (holding whips or scourges in their hands, as Gorionides says). The first angelic horseman was as a praetor; these two Angels were as his apparitors and executors of sentence, who therefore scourged the sacrilegious Heliodorus most severely. # GEM Hence it is clear that God punishes sins and sinners not always through demons but also sometimes through good Angels.
2Mc	3:26	Josephus son of Gorion (bk. 3, ch. 1) adds: "Heliodorus entered with all his satellites, walking through the midst of the sanctuary and entering into the Holy of Holies; the Lord caused him and those with him to hear voices of uproar and most violent commotion that broke mountains and split rocks, so that all his satellites began to flee and hide wherever they could, and Heliodorus was left alone; when he lifted his eyes he saw a man of most terrible aspect clothed in a golden garment from which precious gems flashed, advancing and blocking him, leaping and running against Heliodorus," etc.
2Mc	3:26	If God thus punished Heliodorus for merely attempting to remove deposits from the Temple, how will He punish those who plunder the goods of temples, monasteries and holy places and convert them to profane and secular uses? Let them consider how God punished Antiochus Epiphanes for despoiling the Temple; let them read his horrible death recounted in ch. 9. Let them also remember the vengeance inflicted by God on the sacrilegious Alcimus (bk. 1, ch. 9, v. 55). Indeed all histories are full of such examples.
2Mc	3:26	Furthermore this scourging by Angels — who are most powerful and avenge injuries to God and His Temple most keenly — was far more severe and harsh than any scourging by men; especially because they wished to make of Heliodorus an example of sharp divine vengeance upon the sacrilegious, to deter others from similar plundering of the Temple. Hence when asked by King Seleucus, he said: "If you have an enemy, send him there, and you will receive him back scourged."
2Mc	3:32	Obtulit pro salute viri hostiam salutarem — That is, a peace-offering (victima pacifica), which was offered by law for the peace and health of any person, according to the law of Leviticus 3.
2Mc	3:35	Et omni gratias agens — For this the Angels themselves had commanded, v. 33. Gorionides adds that at the Angels' prompting Heliodorus fell at the feet of Onias and thus gave thanks in supplication. For he was moved to this by the health received and the life given through Onias — indeed Heliodorus owed his very life to Onias.
2Mc	3:36	Testabatur autem omnibus — From this it appears that Heliodorus acknowledged the true God of Israel and gave testimony to all.
2MC	4:1	Simon, the aforesaid informer against the money and his country, spoke ill of Onias, as though he himself had incited Heliodorus to these things, and had himself been the instigator of evils.
2MC	4:2	And he dared to call a provisor of the city, and a defender of his nation, and a zealot of the law of God, a plotter against the kingdom.
2MC	4:3	But when the enmities had proceeded so far that even homicides were committed by certain associates of Simon,
2MC	4:4	Onias, considering the danger of the contention, and that Apollonius was raging, as being governor of Coelesyria and Phoenicia, to augment the malice of Simon, betook himself to the king,
2MC	4:5	not as an accuser of the citizens, but considering in himself the common utility of all the multitude.
2MC	4:6	For he saw that without the king's providence it was impossible that peace should be given to affairs, nor that Simon could cease from his folly.
2MC	4:7	But after the decease of Seleucus, when Antiochus, who was called Nobilis, had taken the kingdom, Jason the brother of Onias ambitiously sought the high priesthood.
2MC	4:8	Having approached the king, he promised him three hundred and sixty talents of silver, and out of other revenues eighty talents.
2MC	4:9	Besides this, he promised also a hundred and fifty more, if power were granted him to set up a place of exercise and a school for youth, and to enrol those who were at Jerusalem as citizens of Antioch.
2MC	4:10	Which when the king had granted, and he had obtained the chief rule, he immediately began to turn his countrymen to the manner of the Gentiles.
2MC	4:11	And abolishing those things which had been established by the kings for the benefit of the Jews, through John the father of Eupolemus, who performed a lawful embassy to the Romans for friendship and alliance, he annulled the lawful privileges of the citizens and introduced practices contrary to the law.
2MC	4:12	For he ventured to establish a place of exercise under the very citadel, and to put the most vigorous of the youths in brothels.
2MC	4:13	Now this was not the beginning, but a certain increase and progress of heathen and foreign manner of life, because of the wickedness of the impious and not high
2Mc	4:1	Simon, who had informed against the temple treasury and the people, made false accusations against Onias, as if he had been the one who stirred up trouble and incited the plot against Heliodorus, and as the contriver of evils.
2Mc	4:2	And he dared to call the benefactor of the city, the protector of his countrymen, and the zealot for the laws, a traitor against the state.
2Mc	4:3	But when the enmity had reached such a point that murders were being committed through one of Simon's trusted associates,
2Mc	4:4	Onias recognized the danger of the contention and that Apollonius, son of Menestheus, the governor of Coele-Syria and Phoenicia, was intensifying the malice of Simon,
2Mc	4:5	he betook himself to the king, not to be an accuser of his fellow citizens, but looking to the good of all the people, both public and private.
2Mc	4:6	For he saw that without royal providence it was impossible for the state to be settled in peace, and that Simon would not cease from his folly.
2Mc	4:7	But after Seleucus died and Antiochus, called Epiphanes, succeeded to the kingdom, Jason the brother of Onias obtained the high priesthood by corrupt means,
2Mc	4:8	promising the king in a petition three hundred and sixty talents of silver and from another revenue eighty talents.
