2Mc	12:21	The stronghold (a fortress or fortified place) which is called Carnion, and therefore distinct from the city called Carnaim, meaning "of two horns" or "two-horned," concerning which see Book 1, ch. 5. Therefore the battle narrated here is different from that narrated there. If anyone should wish them to be the same, I shall not drag a contentious rope with him; indeed, all things duly considered, this opinion seems to me as probable as it does to Salianus.
2Mc	12:22	Terror was struck into the enemies by the presence [of God]...
2Mc	10:1	Judas Maccabaeus and his men, under God's leadership, recovered the temple and the city of Jerusalem.
2Mc	10:2	They demolished the altars erected by foreigners in the public square, and likewise the sacred enclosures.
2Mc	10:3	Having purified the temple, they made another altar; and striking fire from flints, they offered sacrifices for the first time after two years, burning incense, lighting lamps, and setting out the showbread.
2Mc	10:4	When this was done, they fell prostrate and implored the Lord that they might no longer incur such great evils, but that if they ever sinned again, they might be chastened by Him with forbearance and not handed over to blaspheming and barbarous nations.
2Mc	10:5	On the same day on which the temple had been profaned by foreigners, the purification of the temple came to pass, on the twenty-fifth day of the same month, which is Chislev.
2Mc	10:6	They celebrated eight joyful days in the manner of the Feast of Tabernacles, remembering that not long before they had kept the feast of Tabernacles while living like wild animals in the mountains and in the caves.
2Mc	10:7	Therefore bearing wands wreathed with leaves and fair boughs and palms, they offered hymns of praise to Him who had prospered the cleansing of His own place.
2Mc	10:8	They also decreed by public ordinance and vote that the whole Jewish nation should celebrate these days every year.
2Mc	10:9	Such was the end of Antiochus called Epiphanes.
2Mc	10:10	Now we will describe the acts of Antiochus Eupator, the son of that wicked man, briefly summarizing the calamities of the wars.
2Mc	10:11	For when he took over the kingdom, he appointed one Lysias as regent, the chief governor of Coele-Syria and Phoenicia.
2Mc	10:12	Ptolemy, who was called Macron, took the lead in maintaining justice for the Jews, and especially because of the wrong that had been done to them, attempted to treat them peaceably.
2Mc	10:13	On this account he was accused before Eupator by the king's friends; and as he heard himself called a traitor at every turn, because he had abandoned Cyprus which Philometor had entrusted to him, and had gone over to Antiochus Epiphanes, and, failing to maintain honorable conduct, had departed from that province, he took poison and ended his life.
2Mc	10:14	But Gorgias, when he had become general of the district, maintained an army of foreign soldiers, and at every turn kept waging war against the Jews.
2Mc	10:15	Along with him the Idumeans also, in control of important fortresses, were harassing the Jews; and receiving those who had been expelled from Jerusalem, they attempted to keep up the war.
2Mc	10:16	But Maccabaeus and his men, having made solemn supplication and prayed God to fight on their side, moved against the strongholds of the Idumeans;
2Mc	10:17	and assaulting them vigorously, they gained possession of the positions, and beat off all who fought upon the walls, and slew those whom they encountered, killing no fewer than twenty thousand.
2Mc	10:18	Since not fewer than nine thousand had fled into two towers well fortified and with all supplies needed for a siege,
2Mc	10:19	Maccabaeus left Simon and Joseph, and also Zacchaeus and his men, a force sufficient for the siege; and he himself set out for places where he was more urgently needed.
2Mc	10:20	But the men with Simon, being avaricious, were bribed by certain of those who were in the towers, and on receiving seventy thousand drachmas let some of them slip away.
2Mc	10:21	When word of what had happened came to Maccabaeus, he gathered the leaders of the people, and accused those men of having sold their kindred for money by setting their enemies free to fight against them.
2Mc	10:22	Then he slew those who had turned traitor, and immediately captured the two towers.
2Mc	10:23	Having success at arms in everything he undertook, he destroyed more than twenty thousand in the two strongholds. # GEM Lapide notes that by the angel's aid Judas slew thirty thousand from Timothy's camp (v.23), twenty-five thousand at Carnion (v.26), and twenty-five thousand at Ephron (v.28), all within roughly one month from Xanthicus to Pentecost—an astonishing demonstration of divine power working through human arms.
2Mc	10:24	Now Timothy, who had been defeated by the Jews before, gathered a tremendous force of foreign troops and collected the cavalry from Asia in no small number, and came on as though he would take Judea by storm.
2Mc	10:25	As he drew near, Maccabaeus and his men sprinkled dust upon their heads and girded their loins with sackcloth, in supplication to God.
2Mc	10:26	Falling upon the steps before the altar, they besought Him to be gracious to them and to be an enemy to their enemies and an adversary to their adversaries, as the law declares.
2Mc	10:27	And rising from their prayer they took up their arms and advanced a considerable distance from the city; and when they came near to the enemy they halted.
2Mc	10:28	Just as dawn was breaking, the two armies joined battle, the one having as pledge of success and victory not only their valor but also their reliance upon the Lord, and the other making rage their leader in the fight.
2Mc	10:29	When the battle became fierce, there appeared to the enemy from heaven five resplendent men on horses with golden bridles, and they were leading the Jews. # GEM Lapide, following Salianus, identifies the leader of these five heavenly horsemen as Michael, protector of the Synagogue and guardian of the Jews, appearing visibly with a terrible and threatening countenance against Timothy's forces, rushing upon them with horrifying onset, bringing terror, flight, madness and destruction upon them.
2Mc	10:30	Two of them took Maccabaeus between them, and shielding him with their own armor, kept him from being wounded; and they showered arrows and thunderbolts upon the enemy, so that, confused and blinded, they were thrown into disorder and were cut to pieces.
2Mc	10:31	Twenty thousand five hundred were slaughtered, together with six hundred horsemen.
2Mc	10:32	Timothy himself fled to a stronghold called Gazara, an especially strong fortress, where Chaereas was in command.
2Mc	10:33	Then Maccabaeus and his men were glad and besieged the fortress for four days.
2Mc	10:34	And those within, relying on the strength of the place, blasphemed exceedingly, and hurled out wicked words.
2Mc	10:35	But at dawn of the fifth day, twenty young men in the army of Maccabaeus, inflamed with anger because of the blasphemies, bravely stormed the wall and with savage fury cut down every one they met.
2Mc	10:36	Others who came up in the same way turned upon the defenders and set fire to the towers; they kindled fires and burned the blasphemers alive. Others broke open the gates and let in the rest of the force, and they occupied the city.
2Mc	10:37	And they killed Timothy, who was hiding in a cistern, and his brother Chaereas, and Apollophanes.
2Mc	10:38	When they had accomplished these things, they blessed the Lord with hymns and thanksgivings, who does great good to Israel and gives them the victory. # GEM Lapide notes they first purified themselves from the bloodshed and contact with corpses before offering praise, showing that even in legitimate holy war external legal purity was to accompany interior devotion.
2MC	7:32	They prayed that what had been done as a sin might be consigned to oblivion. The Greek has: that it might be perfectly blotted out. They supposed therefore that those slain had repented of the theft before death, and had deleted the chief part thereof, namely the guilt, by contrition; wherefore the other part, namely the debt of punishment to be expiated after this life in Purgatory, alone remained, which was to be expiated by sacrifices, so that the sin might be perfectly blotted out, and thus their souls, freed from the pains of Purgatory, might be transferred to the limbo of the fathers, or to the bosom of Abraham.
2MC	7:32	Add that the sin of some was not mortal but venial: both because some, being unlearned and soldiers, were ignorant of the law forbidding such thefts of idols' things, or at least thought it bound only under venial sin; and because some were in grave or extreme necessity, in which they thought it lawful for them to steal in order to preserve life; and because some had taken very little, whom the lightness of the matter excused from mortal sin. For expressly at verse 45 he says they received their sleep (that is, death) with piety. They were therefore in a state of grace. Finally it was just and pious that Judas and his men should judge and hope that some among them had sinned only venially, or if mortally, had repented before they expired; and therefore applied to them the prayers and suffrages customarily offered for the dead, as the Church even now applies them to sinners. For by every reason and in every way it can, the Church strives to aid the souls of the faithful and free them from punishments. For piety and charity and the very communion of saints demands this. # GEM
2MC	7:32	But the most valiant (Greek: generous) Judas exhorted the people to keep themselves without sin, for the reason that their strength consisted in innocence and justice; for God preserved the innocent and just in battles and made them victors, but permitted the guilty and rapacious to be conquered and slain, as they had seen with their own eyes had happened here, as follows.
2MC	7:43	He sent twelve thousand drachmas of silver (which amount to a thousand gold coins if the drachmas were Attic; if Hebrew, to two thousand gold coins, with which many sin-offerings could be bought and offered) to Jerusalem to be offered for the sins of the dead. Hence it is clear that Judas, acting as a Pontiff, believed in Purgatory, in which souls after this life are cleansed from their sins.
2Mc	12:1	This was the faith of the Synagogue and of the ancient Jews as well as the moderns, as is clear from their Rituals, Commentaries and writings, which Serarius here, Genebrard, Bellarmine and others writing on Purgatory cite.
2Mc	12:1	The same is clearly evident from that passage of Tobias 4:18: "Place your bread and wine upon the burial of the just." See what is said there.
2Mc	12:44	WELL AND RELIGIOUSLY (in Greek εὐσχήμως, that is, urbanely, elegantly, beautifully, wisely, uprightly) THINKING OF THE RESURRECTION.] For it is urbane, civil, honest and upright to help one's fellow citizens who have departed this life with prayers, that they may rise to the blessed resurrection, which is most full of all elegance, beauty and glory.
2Mc	12:44	FOR IF HE HAD NOT HOPED THAT THEY WHO HAD FALLEN SHOULD RISE AGAIN, IT WOULD HAVE SEEMED SUPERFLUOUS AND VAIN TO PRAY FOR THE DEAD.] One might say: This would not be vain, because the soul, which is immortal, would be freed from punishments through prayers, even if the body should not rise again.
2Mc	12:44	The answer is: because the soul is immortal, this very fact demands the resurrection of the body. For the soul by nature inclines toward the body, just as form inclines toward matter. Wherefore the state of the soul would be more violent if it endured for eternity without the body.
2Mc	12:44	Therefore these two things, namely the immortality of the soul and the resurrection of the body, are so connected that whoever posits and believes the one, posits and believes the other also; and whoever removes and denies the one, removes and denies the other also. # GEM
2Mc	12:45	WHO WITH PIETY (that is, contending and fighting in the state of grace for the true faith, piety and worship of God) HAVE TAKEN THEIR SLEEP,] that is, have received it. For death in Scripture is called sleep by analogy and likeness; for death is as it were a long sleep, and sleep is as it were a brief death; but most especially death is called sleep on account of the hope of resurrection, in which we shall as it were awake from sleep to eternal life.
2Mc	12:46	THEREFORE IT IS A HOLY AND WHOLESOME THOUGHT TO PRAY FOR THE DEAD (in Greek εὐσεβής, that is, pious) THAT THEY MAY BE LOOSED FROM SINS (that is, from the punishments of sins).] This is the epiphonema of the Canonical Writer, which clearly establishes the belief of the ancient Synagogue concerning Purgatory and suffrages for souls detained therein.
2Mc	12:46	This therefore has been the certain and undoubted faith of the Church in every age.
2Mc	12:46	The sacrifice for the dead is therefore holy, because it is holily offered to the holy God. It is likewise pious: both toward souls, which it frees from the horrible torments and fires of Purgatory; and toward the blessed inhabitants of heaven, whose number, and thereby joy and glory, it increases; and toward the Church, for which it procures new patrons and advocates before God; and toward the sacrificing priest himself, for whom the souls freed by him repay vicarious grace, praying to God continually for his salvation.
2Mc	12:46	Therefore it is very pious and profitable to pray frequently for the dead, and this procures many goods for the one who prays: as our Martín de Roa learnedly shows in a fine work published on this subject.
2Mc	12:46	Hear St. Augustine, Book 1: "In the books of the Maccabees," he says, "we read that sacrifice was offered for the dead; but even if it were read nowhere in the old Scriptures, the authority of the universal Church which shines forth in this custom is not small, where in the prayers of the priest poured out to the Lord God at his altar, the commendation of the dead also has its place." # GEM
2Mc	12:46	And Damascene in his Oration for the Dead says: "Consider what Sacred Scripture has handed down to memory concerning Judas Maccabaeus, how when he saw the people over whom he presided cut down and maimed by foreign enemies in the city of the great King of Zion, and searching their garments found idols hidden upon them, he at once, as cause for expiation of this sin, made the Lord propitious and ready to show mercy, and offered gifts for each of them, and in that act fulfilled a supreme office of piety and charity. Whence it also came about that Divine Scripture, just as with all other names, so also with this name raised him to the highest praises and wonderfully commended him."
2Mc	13:1	SYNOPSIS OF CHAPTER 13: Antiochus Eupator, with Lysias as commander, renews war against Judas with 110,000 infantry and 5,000 cavalry, and casts down Menelaus the pseudo-pontiff from a height. At v. 10, Judas opposes Eupator, and having invoked God, enters his camp by night and slays many. Then at v. 18, Eupator besieges Bethsura and takes it by surrender. Finally at v. 22, fighting with Judas he is defeated: whereupon hearing that Philip was rebelling, he sought peace from Judas and obtained it.
2Mc	13:1	IN THE YEAR ONE HUNDRED AND FORTY-NINE, JUDAS LEARNED THAT ANTIOCHUS EUPATOR WAS COMING WITH A GREAT FORCE AGAINST JUDAEA.
2Mc	13:2	AND WITH HIM LYSIAS, HIS GUARDIAN AND REGENT, EACH HAVING A HUNDRED AND TEN THOUSAND FOOTMEN, FIVE THOUSAND HORSEMEN, TWENTY-TWO ELEPHANTS, AND THREE HUNDRED CHARIOTS ARMED WITH SCYTHES.
2Mc	13:3	MENELAUS ALSO JOINED HIMSELF TO THEM, AND WITH GREAT DISSIMULATION ENCOURAGED ANTIOCHUS, NOT FOR THE WELFARE OF HIS COUNTRY, BUT HOPING TO BE SET IN THE PRINCIPALITY.
2Mc	13:4	BUT THE KING OF KINGS STIRRED UP THE MIND OF ANTIOCHUS AGAINST THE SINNER: AND LYSIAS SUGGESTING THAT HE WAS THE CAUSE OF ALL THE EVILS, THE KING COMMANDED HIM TO BE APPREHENDED AND PUT TO DEATH IN THE SAME PLACE, AS IS THE CUSTOM OF THAT COUNTRY.
2Mc	13:5	NOW THERE WAS IN THAT PLACE A TOWER OF FIFTY CUBITS HIGH, HAVING A HEAP OF ASHES ON EVERY SIDE: THIS HAD A PROSPECT STEEP DOWN.
2Mc	13:6	FROM THENCE HE COMMANDED THE SACRILEGIOUS WRETCH TO BE THROWN DOWN INTO THE ASHES, ALL MEN PUSHING HIM FORWARD UNTO DEATH.
2Mc	13:7	AND BY SUCH A LAW IT HAPPENED THAT MENELAUS THE TRANSGRESSOR OF THE LAW DIED, NOT HAVING SO MUCH AS BURIAL IN THE EARTH.
2Mc	13:8	AND INDEED MOST JUSTLY: FOR INSOMUCH AS HE HAD COMMITTED MANY SINS AGAINST THE ALTAR OF GOD, WHOSE FIRE AND ASHES WERE HOLY, HE WAS CONDEMNED TO DIE IN ASHES.
2Mc	13:9	BUT THE KING, WITH HIS MIND FULL OF RAGE, WAS COMING TO SHOW HIMSELF FAR WORSE TO THE JEWS THAN HIS FATHER WAS.
2Mc	13:10	WHICH WHEN JUDAS UNDERSTOOD, HE COMMANDED THE PEOPLE TO CALL UPON THE LORD DAY AND NIGHT, THAT AS HE ALWAYS HAD DONE, SO NOW ALSO HE WOULD HELP THEM.
2Mc	13:11	SINCE THEY WERE AFRAID OF BEING DEPRIVED OF THE LAW, AND THEIR COUNTRY, AND THE HOLY TEMPLE: AND THAT HE WOULD NOT SUFFER THE PEOPLE THAT HAD OF LATE TAKEN A LITTLE BREATH TO BE AGAIN SUBJECT TO BLASPHEMOUS NATIONS.
2Mc	13:12	SO WHEN THEY HAD ALL DONE THIS TOGETHER, AND WERE BESEECHING THE MERCIFUL LORD WITH WEEPING AND FASTING, LYING PROSTRATE THREE DAYS CONTINUALLY, JUDAS EXHORTED THEM TO MAKE THEMSELVES READY.
2Mc	13:13	AND HE, BEING APART WITH THE ANCIENTS, DETERMINED BEFORE THE KING SHOULD BRING HIS ARMY INTO JUDAEA AND GET POSSESSION OF THE CITY, TO GO OUT AND COMMIT THE EVENT OF THE THING TO THE JUDGMENT OF GOD.
2Mc	13:14	SO COMMITTING ALL TO GOD THE CREATOR OF THE WORLD, AND HAVING EXHORTED HIS PEOPLE TO FIGHT MANFULLY AND TO STAND UP EVEN TO DEATH FOR THE LAWS, THE TEMPLE, THE CITY, THEIR COUNTRY AND THEIR CITIZENS, HE PLACED HIS ARMY ABOUT MODIN.
2Mc	13:15	AND HAVING GIVEN HIS MEN THE WATCHWORD OF VICTORY OF GOD, WITH MOST VALIANT CHOSEN YOUNG MEN, HE ATTACKED THE KING'S QUARTERS IN THE NIGHT AND SLEW FOUR THOUSAND MEN IN THE CAMP, AND THE GREATEST OF THE ELEPHANTS, WITH THEM THAT HAD BEEN UPON HIM.
2Mc	13:16	AND HAVING FILLED THE CAMP OF THE ENEMIES WITH VERY GREAT FEAR AND TUMULT, THEY DEPARTED WITH GOOD SUCCESS.
2Mc	13:17	NOW THIS WAS DONE WHEN THE DAY WAS BEGINNING TO DAWN, BY THE PROTECTION OF THE LORD THAT HELPED HIM.
2Mc	13:18	BUT THE KING, HAVING HAD A TASTE OF THE BOLDNESS OF THE JEWS, ATTEMPTED TO TAKE THE STRONG PLACES BY POLICY.
2Mc	13:19	AND HE MARCHED TOWARDS BETHSURA, WHICH WAS A STRONG GARRISON OF THE JEWS: BUT HE WAS REPULSED, HE FAILED, HE LOST HIS MEN.
2Mc	13:20	NOW JUDAS SENT NECESSARIES TO THEM THAT WERE WITHIN.
2Mc	13:21	BUT RHODOCUS, ONE OF THE JEWISH ARMY, DISCLOSED THE SECRETS TO THE ENEMIES.
2Mc	6:1	Lapide notes that the number of infantry (100,000) and cavalry (20,000) and elephants (32) varied on different days, as new troops arrived and old ones were sent elsewhere.
2Mc	6:3	Menelaus, appointed pseudo-pontiff of the Jews by Antiochus Epiphanes, joined with them, seeking from Eupator, son of Epiphanes, confirmation of his pontificate and, consequently, his principate (for at that time the pontiff was simultaneously the prince). See what was said at ch. 4, vv. 23 and last.
2Mc	6:4	But the King of kings (God) stirred the mind of Antiochus against the sinner (that is, against the apostate and betrayer of his country, Menelaus, to punish him with indignation as his deeds deserved), when Lysias suggested that he was the cause of all evils — that is, of all the seditions and wars which the Jews stirred up against Antiochus, because they could not endure the insolent and sacrilegious pseudo-pontiff Menelaus. So Josephus.
2Mc	6:4	He commanded that the man, when seized, be killed in the same place (as was their custom) — namely, to be hurled headlong from a high tower. For thus the Syrians were accustomed to punish traitors, the sacrilegious, and the wicked, concerning which more in the following verse.
2Mc	6:5	There was in that place a tower of 50 cubits having heaped ash on all sides. Our interpreter appears to have had a different Greek exemplar, for the modern text reads: "There is in that place a tower of 50 cubits, full of ash, having a heap of ash at the bottom. This device had a rounded instrument precipitous on all sides into the ash; into this they all thrust the guilty of sacrilege and the instigator of certain other evils, or one having transgressed, to their destruction." The Tigurinus version has: "In that place was a tower of 50 cubits full of dust, which had a revolving mechanism sloping down on all sides into the dust. Into it they all thrust whoever had been condemned for sacrilege or had committed any other notable evil, to their destruction."
2Mc	6:5	This type of punishment was devised by Darius Ochus, king of the Persians, so that he might punish the authors of a conspiracy against whom he had sworn not to kill them with the sword.
2MC	2:1	Lapide notes that the same author (Ovid in Ibis) teaches concerning punishment by ash/cinders: "And as the second Darius slain by fraud, so may his own burning ash devour his bones."
2MC	2:6	"THEN HE ORDERED THE SACRILEGIOUS MAN TO BE CAST INTO ASHES." Here observe the just and fitting punishment of retaliation inflicted by God the avenger upon Menelaus: for God caused him to be overwhelmed and buried in profane ashes, because he himself had scattered the ashes of God's altar and defiled them with his sacrileges, as is expressly stated in verse 8.
2MC	2:9	"But the king (Antiochus Eupator), with unbridled mind (indignant and raging against the Jews who had rebelled against him), came to show himself more wicked (more savage) than his father (Antiochus Epiphanes, most cruel) to the Jews."
2MC	2:10	"WHICH WHEN JUDAS KNEW, HE COMMANDED THE PEOPLE TO CALL UPON THE LORD DAY AND NIGHT." For three days, as follows. Behold here is the prelude and as it were the origin of public litanies, or continuous prayer, as much by night as by day, for forty, indeed seventy-two hours. These were the spiritual weapons of Judas, with which he always triumphed over his enemies.
2MC	2:11	"THEREFORE GIVING ALL POWER TO GOD." That is to say, Judas committing himself and his men, and resigning them to the good pleasure of God as Lord of all, invaded the camp of Antiochus by night, so that he might either conquer or fall for God and country, as God should will.
2MC	2:15	"AND HAVING GIVEN TO HIS MEN THE WATCHWORD OF GOD'S VICTORY." That is, Judas gave to his men this military watchword or password, namely 'God the victor,' or 'the victory of God,' or 'God the helper.' For he was accustomed to give this watchword as a kind of omen of victory to his men, as is clear from chapter 8 verse 23. Wherefore Judas, with God as leader, presently slew four thousand of the enemy and struck down the rest so that they thought of flight.
2MC	2:18	"BUT THE KING, HAVING TASTED THE BOLDNESS OF THE JEWS." That is, when he had tasted, i.e. felt and actually experienced, the boldness of Judas, by which he had dared with a few men to break into his camp and slaughter four thousand, fearing lest he might attempt more and greater things, turning from force to cunning, "HE ATTEMPTED BY CRAFT THE DIFFICULTY OF THE PLACES." That is, he attempted through skill, treachery and betrayal to occupy the more difficult positions of Judea for assault.
2MC	2:19	"HE MOVED HIS CAMP AGAINST BETHSURA, ETC., BUT WAS PUT TO FLIGHT, WAS REPULSED, WAS DIMINISHED." Vatablus: he was worn down, both by famine and by disease and by the arms of the besieged, as well as by Judas rushing upon him unexpectedly. Bethsura was a most strongly fortified citadel situated upon rock and cliff (for Bethsur in Hebrew means the same as 'house of rock'), whence Jo[sephus records...]
2Mc	9:1	[On Beth-zur] Beth-zur was the most strongly fortified place in all Judaea. It lay to the south of Jerusalem, distant from it five stadia, that is 624 paces, so as to defend it against the incursions of the Idumeans and other enemies. Wherefore Antiochus could not take Beth-zur by force, especially since Judas was present and continually supplied the besieged with food and reinforcements, as follows.
2Mc	9:21	[On Rhodocus] Rhodocus disclosed to the enemies the mysteries (that is, the secrets): Salianus probably thinks that these mysteries were certain secret paths and means by which food was being supplied to the people of Beth-zur, which the treacherous Rhodocus had revealed to the enemies, intending to desert to them; but when the matter was exposed, he was investigated and found out and thrown into prison. That this is so is gathered from the following verse.
2Mc	9:22	[On the king's second parley with Beth-zur] The king again spoke to those who were in Beth-zur, gave his right hand, received theirs, and departed: that is to say, the king first addressed the soldiers of Beth-zur that they should surrender, but was repulsed by them, because Judas was supplying food to the besieged through hidden paths. But when Antiochus learned of these paths through the traitor Rhodocus and blocked them, he addressed the soldiers again and, now that they were suffering from hunger, persuaded them to surrender.
