BookAbbrev	Chapter:Verse	Annotation	Source
Gn	2:3	The seuenth day ] Al creatures being made in their kinds in six dayes, complete & perfect, God not needing (as men often doe in their workes) to perfect, polish, or amend the same, rested the seuenth day: & therfore the natural perfection of Gods workes is attributed to the seuenth day, and the supernatural perfecting of men in eternal life, after the Resurrection, is attributed to the eight day, as S. Augustin and other fathers teach. And for this cause God blessed and sanctified the seuenth day: and after we haue in the Decalogue or ten commandements, that this day al should rest and abstaine from workes, yea and keep it festiual, occupying themselues in spiritual exercifes, seruice, and special worship of God, as the Iewes did euen til Christs and his Apostles time, praying & hearing the word of God read & expounded in the Sabboath day. Wherby we see that distinction of dayes pertaineth to Religion the people of God thus obseruing the Sabboth in memorie of the Creation, and diuers other feasts in memorie of other benefits. And we now keep the Sunday holy in memorie of Christs Resurrection, & other feasts in grateful remembrance of other Mysteries of Christs Natiuitie, the coming of the Holy Ghost, & the like. Yea also feasts of his Blessed Mother, & other Saints, for the benefits receiued from Christ by them, & for more honour to Christ in them. So this Catholike obseruation of feasts is neither Iudaical (which also in the law was good, but now is abrogated) nor heathnish, for we honour not Iupiter, nor Inno, nor anie false God or Goddesse, but our Lord God Creatour & Redeemer, & for his sake his best seruants. Whereof see the Annotations in the English new Testament, chap. to the Galathians. Where we here only adde these words of S. Basil: Honor seruorum redoundat in communem Dominum: the honour of the seruants redoundeth to their Lord and ours. So the honour of Saints is the honour of Christ.	scan-pdf
Gn	2:17	Of the tree of knowledge.] Besides the law of nature, by which Man was bound to direct al his actions according to the rule of reason; & besides the supernatural diuine law, by which he was bound to belieue & trust in God, & to loue him aboue al things, hauing receiued the guifts of faith, hope, and charitie; God gaue him another particular law, that he should not eate of the tree of knowledge of good and euil. And that for two special reasons, which S. Augustin noteth vpon this place. First, that God might declare himselfe to be Lord of man. Which was absolutely necessarie to man, for man, & nothing at al profitable to God, who needeth not our seruice, but we without his dominion should vtterly fal to nothing. Nec enim ipso non creante existere, etc. For he not creating vs, neither could we haue been, nor he not consenting vs could we haue been, nor he not gouerning vs, could we liue rightly. Wherfore he only is our true Lord, not for his, but for our owne profit or saluation we serue. The other reason was, that God might giue man matter wherin to exercise the vertue of obedience, and to shew himselfe a subiect of God. Which could not be so proprely & effectually declared by keeping other lawes, nor the enormitie of disobedience appeare so euidently, as by fulfilling of Gods wil commanding him, or by doing his owne wil, moued to the contrarie, in a thing of it-selfe indifferent, & only made vnlawful, because it was forbid. But let vs heare S. Augustines owne words. Nec potuit melius aut diligentius commendari quantum malum sit sola inobedientia, etc. Neither could it (faith this great Doctour) be better, nor more exactly signified how bad a thing sole disobedience is, when where a man became guiltie of iniquitie because he touched that thing contrarie to prohibition.	scan-pdf
Gn	3:1	Why hath God ] Here we may see how sinne came first among men. For the diuel envying mans happie state tempted Eue the weaker person, beginning with a question, therby to allure her into conference, and by such a question as might bring her into suspicion of Gods affection towards man, saying: Why hath God commanded you, that you should not eate of euerie tree of Paradise? insinuating by these words, and withal internally suggesting, that God dealt hardly with them, abridging their libertie without cause. And when he had got so much of her, that she was displeased with the precept, which she shewed by adding of her owne (to make it seeme more grievous) that they were forbidden to touch the tree, & againe by reporting the punishment as doubtful, saying, Lest perhaps we dye; then the tempter anouched boldly, and falsly, that they should not dye, and charged God to be envious of the benefit they should get by eating of that tree, saying their eyes should be opened, and they should be as Gods, knowing good and euil upon which perswasion and liking also she had to the fruit, she did take and eate, and perswaded Adam also to eate. And forthwith they saw that they would not have seen, knew euil which they had better not to have known, were ashamed, and endcauoured to couer and hide themselves. Even thus the diuel dealeth with men ever since, assaulting the weaker persons, and weaker part, as the flesh and sensualitie, and by them setteth upon the stronger and superiour part, to get consent of free wil, without which there is no sinne; according to that famous saying of Augustin: Peccatum adeo est voluntarium, ut nullo modo sit peccatum, si non voluntarium. Sinne is so voluntary, that in no wise it can be sinne, if it be not voluntarie.	scan-pdf
Gn	3:15	She shal bruise ] Protestants wil not admit this reading, ipsa conteret, she shal bruise, lest our Blessed Ladies should be said anie way to bruise the serpents head. And Kemnisius amongst others faith, that al ancient Fathers read, ipsum, not ipsa. But he is conuinced of lying by Claudius Marius Victor lib. 1. in Gen. Alcimus Auitus lib. 3. carm. c. 6. S. Chrisostom hom. 17. in Genes. S. Ambrose lib. de fuga saeculi cap. 7. S. Augustin l. 2. de Genesi contra Manichaeos, cap. 18. & lib. 11. de Genesi ad literam chap. 16. S. Gregorie lib. 1. Moralium cap. 18. And after them S. Bede, Eucherius, Rabanus, Rupertus, Strabus, and Lyra vpon this place, S Bernard ser. 2. super Missus est, and manie others, who read ipsa, as the Latin text now hath. Both readings yeald the same: But whether we read, She shal bruise, or, her seede, that is her sonne Christ shal bruise the serpents head, we attribute no more nor no lesse to Christ nor to our Ladie by the one reading then by the other: for by the text, I wil put enmities between thee and the woman, between thy seed and her seed; it is cleere, that this enmitie and battle pertained to the woman & her seed on the one partie, and to the duel, that spake by the serpent, & al the wicked, on the other partie, & that the victorie should happen to mankind. Which being captiue by Adams sinne, occasioned by a woman, should be redeemed, both sexes, though in farre different sort, concurring therto. And so it is most true, that Christ by his owne proper power, and his Blessed Mother by her most immediate cooperating to his Incarnation did bruise the serpents head, breake & vanquish his power. As manie ancient Fathers doe excellently discourse: namely S. Bernard, writing vpon these wordes in the Apocalyps c. 12: A great signe appeared in heauen, a woman clothed with the sunne: Albeit (faith he) by one man and one woman we were greatly damaged, yet (God be thanked) by one man & one woman al losses are repaired, and that not without great increase of graces. For the benefit doth farre exceed the losse. Our merciful father giving vs for a terrestrial Adam Christ our Redeemer, & for old Eue Gods owne Mother. Moreover as the same S. Bernard sheweth, this Blessed Virgin in singular sort bruised the serpents head, in that she quite vanquished al manner suggestions of the wicked serpent, never yealding to, nor taking delight in anie euil moued by him.	scan-pdf
Gn	3:19	Dust thou art.] By these wordes Adam was admonished to humble himselfe, considering the matter wherof his bodie was made, & into which he should be resolued againe. Wherupon it came to be a ceremonie amongst penitents to cast ashes on their heads, as appeareth in holy Scriptures. For which cause the Church now also vseth this ceremonie the first day of Lent, putting ashes on her childrens heads: willing them to remember, that dust they are, & to dust they shal returne, to moue vs by this meditation to more serious penance.	scan-pdf
Gn	3:22	Lest perhaps ] Notwithstanding Gods eternal decree in disposing al things, and his omnipotence which nothing can resist, yet he produceth good, and either auoideth or disposeth of euil which he suffereth, by ordinarie meanes, as appeareth Act. 27, v. 31. and that because man hath free wil, with which God concurreth, & destroyeth not nor forceth, as S. Augustin teacheth.	scan-pdf
Gn	3:24	Placed Cherubins.] Man being cast out of Paradise, the same is defended with double guard: with Angels, that are watchful, wise, & potent; and with fire & sword, most terrible armour to man. Wherby againe we see that God vseth ordinarie meanes in his providence, as the ministerie of Angels & humane terrour, & would neither destroy the tree, nor depriue it of the vertue to prolong life, nor because man of free wil, by which he might desire to returne: but conferuing nature in al creatures, preuenteth inconueniences otherwise. These Angels also hinder the diuel, that he can not enter Paradise, lest he should take of the fruit of the tree, and giue it to men to prolong their liues, and thereby draw them to his seruice.	scan-pdf
Gn	5:4	Begat sonnes and daughters.] Moyses in this genealogie reciteth not alwayes the first-begotten, nor the whole progenie by their names for then he should haue repeated Cain and Abel, and haue named many others, but those only by whom the Church of God continued, signifying the rest in general, whose succession was cut off by the floud.	scan-pdf
Gn	5:5	And he died.] By this Gods word is verified faying, that Adam should dye, if he should eate of the forbidden tree. And the diuel is proued a lyer, faying, they should not dye. It is also most true that Adam dyed that day in which he did eate. For he began that very day to decline to death; and so doth al mankind euer since as truly said the woman of Thecua to King Dauid: we doe al die, and as waters that returne not, we fal downe on the earth. And what else (fayth S Gregorie) is this daylie decaying of our corruption, but a lingring death? And none of al these that liued longest reaching to a thousand yeares (which with God is as one day) escaped; man dyed in that day in which he transgressed.	scan-pdf
Gn	5:24	Was seen no more.] That Enoch and Elias are yet aliue is a constant knowne truth in the harts and mouths of the faithful, faith S Augustin in his first booke de pec. cat. meri. & remiss. c. 3. and confirmeth the same in diuers other places. And it is testified by very many both Greeke and Latin Doctours: S Ireneus li. 5. S. Iustinus Martyr, q. 85. ad Orthodoxos, S. Hippolitus li. de Antichrifte, S Damascen. li. 4. de Orthodoxa fide, S. Hierom. epist. 61. ad Pamach. c. 11. S. Ambrofe in Psalm. 45. S. Chrysoftom. ho. 11. in Gen. ho. 58. in Mat. ho. 4. in Epist. 1. ad Thess. ho. 12. in ep. ad Heb. S. Greg. li. 14. Moral c. 11. ho 12. in Ezech. S. Profp. li. vlt. de promis. S. Bede in c. 9. Marc. Theophilact and Oecumenius in cap. 17. Mat. and others innumerable. Touching Elias it is manifest in Scriptures, that he shal come, and preach, & be slaine with another witnes of Christ, before the terrible day of Iudgement. Of Enoch Moyses maketh the matter more then probable, faying of euery one of the rest, he dyed, only of Enoch faith not fo, but that he appeared or was seen no more. For which the seuenty two Interpreters fay, And he was not found, for God translated him. Which can not signifie death, but transporting or remouing to an other place. Whereto agreeth the Authour of Ecclesiasticus, faying: Enoch pleased God, and was translated. But most cleerely S. Paul faith: Enoch was translated, that he should not see death, and he was not found, for God translated him. S. Chrysoftom affirmeth that The holy Scriptures say that God translated him, & that he translated him aliue, that he felt not death. And S. Augustin as expressly faith, Non mortuus, sed vivus translatus est. He (to wit Enoch) is translated, not dead but aliue. Diuers reasons are alleaged why God would reserue these two aliue: First to shew by example that mortal bodies can be conserued from corrupting; Secondly to giue vs an argument of immortalitie; Thirdly, these two (one of the law of nature, the other of the law of Moyses) are preferued aliue, to come amongst men againe towards the end of the world, to teach, testifie, and defend the true faith and doctrine of Christ against Antichrist.	scan-pdf
Gn	7:16	Shut him in.] God who by his only wil could in a moment haue drowned al the rest of the world, fauing whom he pleased, not needing in any thing the help of his creatures, yet would vse both natural and supernatural meanes, as the labour of Noe to build the arke, new fountaines springing, and the heauens powring downe water fourtie dayes together, afterwards the wind to dry vp the earth, and because the dore (being great for Elephants to enter in) and was to be framed without (as S. Ambrose noteth) for better induring the forcible waters, could not commodiously be closed by Noe, Our Lord (by the ministrie of Angels) shut him in on the out side, to teach vs by al this and the like disposition of things, that albeit his Diuine omnipotecie can doe what he wil al alone, yet he wil haue his creatures to concurre and cooperate as secundarie causes, sometimes naturally, sometimes supernaturally or miraculously, as it pleaseth his goodnes to impart to them power and vertue.	scan-pdf
Gn	7:23	But only Noe.] As there is not anie thing in al the old Testament, from the creation of the world til the comming of Christ, more notable, more admirable, or of greater importance, then this historie of the general floud; so was there nothing that euer more aptly, more luely, or more exactly prefigured Christ and his Church, then did Noe & the arke, & the drowning of the rest of the world in that deluge. Which S. Augustin declareth in many places, but most especially & of purpose in his twelfth booke against Faustus the Manichee, from the 14. chapter to the 21. and in his fifteenth booke of the citie of God. In summe the Doctours teach, that Noe, signifying rest, was a figure of Christ, the very rest of mans soule. Whom whosoeuer followeth shal find rest for their soules. The arke signifieth the Church, the forme therof being six times so long as broad, and ten times so long as high, resembleth the proportion of mans bodie. The dore in the side representeth the wound in Christs side, from whence flowed the holy Sacraments, by which the faithful enter into the Church, & are sanctified. The timber wherof the arke is made, & the water baring it vp, signified the Crosse of Christ & Baptisme. Likewise the squarenes of the timber signified such men in the Church, as be constant and stand firmely in al sorts of tentations: especially godly and learned Doctours and Pastours, who by word and example vphold and confirme the faithful people in al afflictions within, and withstand & conuince al Heretikes and other Infidels that oppugne the Church without. The most strong kind of glew called bitumen, signified the permanent or euerlasting stabilitie, and vnseparable connexion of the Church, by the grace and continual assistance of the Holie Ghost. The consummation of the arke in one cubit signified the vnitie of the same Church, which is one in al times and places. Neither would God haue manie arkes, nor manie chiefe Rulers, but one only arke, and one chiefe Gouernour therof, and that al without the same should corporally dye, to signifie that al which dye without the Church doe perish, and are eternally damned. Wherupon S. Hierom sheweth that al within the Church, that communicate with the See Apostolike are as those in the arke of Noe, and al Schismatikes, Heretikes, and other Infidels are in like case with the rest of the world, that were drowned with the floud.	scan-pdf
Gn	8:20	Built an Altar.] Noe without expresse commandment, and without delay, offereth Sacrifice to God, for the benefit receiued in his and his families conseruation, with the other liuing creatures, in that general deluge of the world. Wel knowing (faith S. Ambrofe) that to be true thankes-giuing, which is performed, not commanded: therfore he made no delay. For the vertue of a gratefull mind excludeth doubtful deliberation, and he that expediteth til the debt of thankes be exacted, is an ungracefull person. For more solemnitie, he dedicated an apt and permanent place, for this peculiar diuine seruice, Building an Altar to our Lord. The Hebrew word Mizbeach (of the verbe Zabach, to kil, or make sacrifice) and the Greeke Thysiastirion, signifie an Altar to sacrifice on, not a common table for meate. He offered of the cleane and best things; because pure and deuout Sacrifice is due to God. Moreouer, it was large and bountiful, for he offered of al the kinds of cleane beasts and foules. Finally, he offered them in Holocaustes, where al was burned and consumed in the honour of God. How grateful al this was to God, Moyses signifieth saying: Our Lord smelled a sweet fauour: not that either anie sweet corporal fauour could of it-selfe delight God, who is the most spiritual substance, or that the burning of flesh, bones, and bowels of beasts could yeald sweet fauour; but the deuout mind declared by such external dutie greatly pleased God. For God requireth both, but specially a sincere hart. It were a grieuons thing (faith Plato writing of sacrifices) if God had respect rather to the guifts and sacrifices of men, then to their mind.	scan-pdf
Gn	10:8	Nemrod.] To this Nemrod the sonne of Chus, first builder and King of Babylon, Iosephus, S. Epiphanius, S. Hierom, S. Augustin, and generally al ancient writers ascribe the first tyrannie, and first setting vp of an earthlie citie of Babylon, opposite to the Citie of God after the flood. He was a Valiant, or rather a Violent and cruel hunter, a giant hunter (faith S. Augustin, according to the Septuagint Interpreters) who by falshood and force brought manie vnder his dominion. For he stirred vp pride (faith Iosephus) and contempt of God in men, auouching that they were not beholding to God for present felicitie, but to their owne vertue; and so supposing men would fall from God to him, if he offered himselfe a leader and helper against a new flood, by litle and litle drew al to tyrannie. He was otherwise called Saturnus, and was at length amongst others accounted a God. After him his sonne Belus Iupiter raigned 65 yeares, and then succeeded Ninus the first King of the Assirians.	scan-pdf
Gn	10:11	Assur builded Niniue.] Here is great difficultie and much dispute amongst writers, who this Assur is. Briefly, we may either say with Iosephus and S. Augustin, that Assur the sonne of Sem built a citie, which afterwards Ninus of Chams race enlarged, enriched, and changing the name called it Ninum: or els that this word Assur here signifieth (as 4. Reg. 15. Psal. 81. Esaie 10. & 31.) the King of Assirians, to wit Ninus the sonne of Belus, who as al histories greeke and barbarous report (faith S. Hierom) was the first that raigned ouer al Asia, and among the Assirians built Ninum a citie of his owne name, which the Hebrewes cal Niniue. He set vp the Monarchie of the Assirians, called the golden Kingdom, which stood 1240. yeares: and made his father Belus to be honoured for a God. To whom the Babylonians, as Pilate testifieth, first erected statuas, altars, and temples. Of this Belus or Bel of Babylon were also deriued other false Gods, as Belial the God of Libertines, Beelphegor God of the Moabites, Beelzebub of the Acharonites, Baal in Samaria, Baalim amongst the Philistims, and the like in other nations.	scan-pdf
Gn	10:31	The Nations.] How manie Nations & tongs were in the world immediately after the towre of Babylon, is more commonly supposed then cleerly shewed by old or late writers. Only it seemeth certaine and euident, that there were iust as manie tongs as Nations. But to find precisely (as the common opinion holdeth) 72, is hard. For in this chapter, where they would count this number, are not mentioned so manie. Neuertheles, if we adde certaine that began distinct Nations afterwards, til Iacob with his children went into Aegypt; in whom only the Hebrew Nation and tong continued to Christs time, the number wil come right. Of Iapheth were borne 7 sonnes chiefe of Nations. Of Cham by his first sonne Chus were 6 nephewes Princes of Nations. And Nemrod, besides his Kingdom of Babylon, raised vp other 6. By his second sonne Mesraim came 8 nations, Chams third sonne Phut made only one nation. And Chanaan his sonnes made 11 more. Of Sem came the chiefe and principal Nation the Hebrewes. These are al that are named in this place: to wit, of Iapheth 2, of Cham 33, and of Sem 21, which make in al 66, whereunto if we adioyne Nachor (Abrahams brother) Moab, and Ammon (Lots sonnes) also Ismael (Abrahams eldest sonne) and his issue by Cetura, and finally Esau (Iacobs brother) who made 6 more distinct nations, the whole number is 72.	scan-pdf
Gn	14:18	Bringing forth.] Seeing the Royal Prophet David, and S. Paul say Christ is a Priest for ever according to the Order of Melchisedech, we demand of Protestants, if Christ fulfilled not Melchisedechs figurative Sacrifice offered in bread and wine, by offering his owne bodie and bloud at his last supper in formes of bread & wine, and by instituting the same to be offered by his Priests til the end of the world, what other figurative sacrifice of Melchisedech they can find performed by Christ. Kemnifius complayneth that the Latin text hath Obtulit, for Protulit, Offered, for Brought forth. But al Latin Editions haue Proferens, bringing forth. The question therfore in controversie is, to what end and vse Melchisedech brought forth bread and wine? Caluin and Kemnifius say it was only to refresh or feed Abraham and his men, and not for sacrifice. But the Hebrew word Hotsi, brought forth, is a word pertayning to Sacrifice, as in the 6. chap. of Iudges and importeth that the bread and wine were first offered in Sacrifice. Againe, the words following For he was the Priest of God most High, can haue no other sense, but that he offered sacrifice and did the function of a Priest in the bread and wine which he brought. S. Clemens Alexandrinus li. 4. Strom. writeth thus: Melchisedech King of Salem, Priest of God most High, gave wine & bread sanctified nutriment in type of the Eucharist. S. Cyprian Epist. 63. ad Caecilium: Christ is Priest for ever according to the Order of Melchisedech, which Order is this comming from that Sacrifice, and thence descending, that Melchisedech was Priest of God most High, that he offered bread and wine, that he blessed Abraham. For who is more a Priest of God most High, then our Lord Iesus Christ, who offered Sacrifice to God the Father, and offered the same which Melchisedech had offered, bread and wine, to wit, his owne bodie and bloud. S. Augustin Epist. 95: Melchisedech bringing forth the Sacrament of our Lords table, knew how to figurate his eternal Priesthood. Idem li. 16. c. 22. ciuit: There first appeared that Sacrifice, which is now offered to God by Christians in the whole world.	scan-pdf
Gn	14:19	Blessed him.] Caluin and some other Protestants, to auoid the connexion of Melchisedechs Priesthood and bringing forth of bread and wine, wil needs haue these words, He was a Priest, referred only to that which followeth, he blessed Abraham. But Melchisedech did not blesse Abram because he was a Priest, for Abram was also a Priest, but because he was a greater Priest then Abram; which S. Paul vrgeth saying: Without al contradiction that which is lesse, is blessed of the better, concluding therupon that Melchisedech was greater then Abraham.	scan-pdf
Gn	14:20	Gave tithes.] This is an other prerogative of Melchisedech, that Abram payed tithes to him, which S. Paul likewise explicateth (Heb. 7.) and proveth thereby that Christs Priesthood is greater then the Leuitical. Moreover this paying of tithes by Abraham sheweth the antiquitie of this tradition, being practised in Abrahams time, that the spiritual Superiours received tithes of their inferiours.	scan-pdf
