BookAbbrev	Chapter:Verse	Annotation	Source
Gn	15:6	Belieued God.] S. Hilarie (li. 9. de Trin.) and S. Ambrose (li. 1. de Abraham. c. 3.) by this example teach vs, what manner of faith is reputed to iustice, to wit, such a faith as without tergiuersation, or requiring of proofe or reason, doth simply belieue that which God once faith, because he is omnipotent, how farre soeuer the thing that is said surmounteth our vnderstanding. For so heroical was the act of Abrahams faith, promptly belieuing Gods word in a matter most hard to his former conceit, that for the same he receiued singular prayse; and for the like afterwards was called The father of manie Nations (c. 17. v. 5.) and by S. Paul The father of al that belieue (Ro. 4. v. 11.) where the Apostle teacheth that Abraham had no iustice, nor estimation of iustice before God, vntil he belieued in Christ (v. 18. 19. 29.) because al workes before that faith are insufficient. Neither was this a sole faith, but had other necessarie vertues of hope, and charitie, humilitie, reuerence, obedience, and the like ioyned with it. Wherfore S Iames testifieth that Abraham was iustified by workes (that is by workes following faith, not going before faith.) For Faith (faith he) if it haue not workes, is dead in it-self, (c. 2. v. 17.) And by workes Abrahams faith was consummate (v. 22.) And concludeth thus: Doe yee see, that by workes a man is iustified, and not by faith only. v. 24.	scan-pdf
Gn	16:3	To wife.] The Manichees did calumniate holie Abraham and other Patriarchs for hauing manie wiues, condemning them of incontinencie and adulterie for the same. Luther in the contrarie extreme held it not vnlawful, but indifferent now in the law of grace, for a man to haue more wiues then one at once. But the Catholike doctrine distinguishing times and causes, sheweth how pluralitie of wiues was lawful sometimes, and at other times, especially since Christ, altogether vnlawful and vndispensable. By the first institution of Mariage in the state of innocencie, and law of nature, and by the law of Christ, it is vnlawful for anie man to haue more wiues then one. Notwithstanding God sometimes dispensed in this for the case of scarcitie of people after the flood. Which appeareth sufficiently by that Sarai perswaded her owne husband to marie an other wife, and he a true seruant of God agreed thereto, not as a new thing, but as a lawful practise of those times. Yet this dispensation either ceased before Christs time, the cause ceasing when the world was replenished; or at least our Sauiour tooke it away, restoring Matrimonie to the first institution of two in one flesh.	scan-pdf
Gn	17:5	Manie nations.] Abram signifying High or Noble father, changed into Abraham, which signifieth Father of manie (Nations) import great Mysteries intended by God: For by this changing of names was declared and confirmed, that Abraham by the issue that he should haue of Sara, should be the father of manie Nations, which S. Paul expresly applieth to his spiritual children, those especially that should belieue in Christ, of the Gentiles, prefigured by Isaac borne of the freewoman, by the promise, as the Iewes were prefigured by Ismael borne of the bondwoman according to the flesh, concluding with the prophet Esay, that Manie are the children of the desolate, that before was barren. For albeit Abraham was natural father of foure Nations, the Ismaelites, Madianites, Idumeans, and the Israelites, yet he was spiritual father of manie more, to wit, of al Nations that belieue in Christ from his owne time to the end of the world. Wherby it is cleer, that the Church of Christ doth alwayes consist of manie Nations, not as Donatistes and Protestants absurdly say, sometimes of few inuisible or vnknowen persons, for so Abraham should sometimes be father of few or no Nations, which derogateth either from Gods omnipotencie if he could not, or from his fidelitie if he should not maintaine his promise made to Abraham for euer.	scan-pdf
Gn	17:10	Shal be circumcised.] The Sacrament of Circumcision here first instituted, about 400. yeares before the Law of Moyses, is a perfect figure of Baptisme, resembling it in foure things. First, by both these Sacraments the faithful are distinguished from infidels. Secondly, profession of faith is made in them both either by those that receiue the same, if they be of discretion, or by others for them, if they be infants. Thirdly, by both these Sacraments entrance is made into the Church and to the participation of other Sacraments and spiritual rites. Fourthly, both these Sacraments induce subiection to the iurisdiction and lawes of the Church. But Baptisme doth farre excel Circumcision in that it is more easie, more vniuersal, for it pertaineth to al Nations, and both sexes: and especially in vertue and efficacie, for Baptisme as an instrumental cause remitteth sinne and iustifieth, Circumcision was only a signe that grace was giuen & sinne remitted. Againe, Baptisme imprinteth a character in the soule, the other leaueth a marke only in the flesh. Finally, Baptisme openeth the gate of heauen, in vertue of Christs passion now past, which circumcision could not before Christ suffered death.	scan-pdf
Gn	17:14	Shal be destroyed.] This punishment pertained to those by whose negligence themselues, or others of their charge, were not circumcised. But S. Augustin (li. 3. c. 18. cont. Iulian. li. 16. c. 17. ciuit.) proueth that this commination pertained also to infants, not for that they could transgresse this precept, or commit a new sinne, but for lack of circumcision. The reason whereof is, for that God now determined this only remedie for original sinne, in the male sex of Abrahams seed, in place of sacrifice, or other profession of faith vsed before. S. Augustin vnderstandeth this threatning not only of temporal punishment, but also of eternal separation from God, and the societie of Saints. That also infants are so secluded only for lack of this remedie, as now some children which dye without Baptisme, committing no new fault are depriued of the vision of God, for their original sinne not remitted.	scan-pdf
Gn	19:1	Abraham and Lot by hospitalitie merited to receiue Angels instead of men. (Heb. 13.)	scan-pdf
Gn	19:13	This sinne crieth to heauenge, for which God sent the Angels to destroy them.	scan-pdf
Gn	19:26	Lots wife turned into salt, admonisheth the seruants of God to proceed in vertue, & not to looke back to vice. (Luc.17. S. Aug. li.16. c. 30. ciuit.)	scan-pdf
Gn	19:30	Lot neither perfect nor very wicked was deliuered for Abrahams sake. (S. Aug. q. 45. in Gen.)	scan-pdf
Gn	19:37	Moabites & Ammonites were two distinct Nations, perhaps of the 72.	scan-pdf
Gn	21:12	Let it not.] It seemed so hard, inhumane, and vniust to cast Agar and Ismael out of the house, that Abraham would not haue done it, vnles God had commanded him in this to heare the voice of Sara. But when he knew Gods wil therin, not respecting flesh and bloud, nor disputing further of the lawfulnes of the fact, sent them both away, commending them to Gods protection: and so by this separation the familie was made quiet. It represented also a notable Mysterie of the Synagogue of the Iewes and Church of Christ. As S. Augustin doth excellently expound the same, according to S. Paul (Gal. 4.) That Ismaels playing with Isaac was persecution, because it tended to peruert him, shewing it to be a greater iniurie to delude and deceiue anie, in drawing them to new and particular companies, then corporally to persecute them: and that the Church and Catholike Princes punish heretikes for their good, to make them returne to the truth, or finally to cease from seducing others.	scan-pdf
Gn	25:23	The elder shal serue the yonger.] As before (c. 17. v. 21. and c. 21. v. 12.) the couenant and great promises made to Abrahams seed, are declared to pertaine only to Isaac, and not to Ismael, nor to the other brothers; so the same belong not to Esau the elder, but only to Iacob the yonger sonne of Isaac, the Holie Ghost saying, The elder shal serue the yonger. And withal signifieth (faith S. Augustin) that the elder people of the Iewes shal serue the yonger Christian people. An other great document of grace S. Paul gathereth vpon this Mysterie: that the twinnes being not yet borne, nor hauing done any thing good or euil, without anie good merits the yonger is elected, the elder reprobate. For doubtles (faith S. Augustin) touching original sinne they were both equal, and concerning proper sinne, neither of them had anie at al. By which example he sheweth Gods mere mercie in the elect, and iustice in the reprobate.	scan-pdf
Gn	25:31	Sel me thy first-birth right.] Iacob instructed by his mother, that God had chosen him in place of his brother Esau (for to her God had reuealed that the elder should serue the yonger) did lawfully vse this oportunitie to get Esaus grant of the right pertaining to the first-borne, but Esau in selling it sinned, shewing himselfe an intemperate prophane man. (Heb. 12.)	scan-pdf
Gn	28:18	Iacob erected a stone and powred oyle thereon.] What Iacob did in this place, is now vsed in the Catholike Church. For so Rabanus, a diligent obseruer and writer of Ecclesiastical Rites, Ceremonies, and Customes, touching the vse of holie oyle witnesseth (li. 1. c. 45. Institut. cleric.) that the Altar being first sprinkled with water, is annointed with Chrisme, to the example of the Patriarch Iacob, who after that dreadful vision, erected a stone for a title powring oyle theron, and calling that place The house of God. S. Cyprian also writing of Chrisme mentioneth the two sorts of holie oyle vsed in the Church; one of simple oyle consecrated by a Bishop, which is vsed for Catechumens before Baptisme, persons possessed, and the sick; the other is made of oyle and balme, also consecrated by a Bishop, and this is vsed in Baptisme, Confirmation, and in consecrating Altars, Kings, and Priests.	scan-pdf
Gn	28:20	Vowed.] It can not be vnderstood that Iacob heer vowed or promised only to serue God, as the Soueraigne Lord of al creatures, for to that he was bound, whether he should prosper temporally or no; but that he vowed particular godlie works, to which he was not otherwise obliged. As heer he expresseth two things. First, And this stone, which I haue erected for a title, shal be called the house of God. Wherby he promised the building of a Church, performed at his returne (chap. 35.) Secondly, he added, And of al things which thou shalt giue me I wil offer tithes to thee. And this likewise was of free deuotion. For tithes also in the law of nature were due to Priests, and by inferiour Priests to the chiefe Priest, as Abraham gaue tithes to Melchisedech.	scan-pdf
Gn	31:19	Idols.] Images of false Gods (as these were) are most properly called idols. And so the hebrew word Teraphim is heer rightly translated idols: which in other places signifieth other things. As the statua which Michol put in Dauids bed was not an idol. Againe, the Prophet fortelling the lamentable state of the Israelites, faith they shal be long without Kings, Prince, Sacrifice, Altar, Ephod, and Teraphim, which last word in the Protestant English Bibles remaineth vntranslated. Where if they had translated images (as here they doe) it would proue, that some images pertaine to true religion, the want wherof is lamented among other principal things. These idols Rachel stole from her father, to withdraw him from idolatrie, as S. Basil, S. Gregorie Nazianzen, and Theodoret expound it. And in this, faith Theodoret, she was a right figure of the Catholike Church, which depriueth idolaters of their idols.	scan-pdf
Gn	32:24	A man wrestled.] This wrestling with an Angel assuming a bodie in forme of a man was corporal, as the effect shewed in Iacobs sinow shrunke vp, which made him to halt. It was also spiritual, as appeareth by his earnest prayer, vrging and at last obtayning the Angels blessing. S. Dion. c. 4. cel. Hier. S. Greg. prefat. in Iob. Theodoret q. 91. in Gen.	scan-pdf
Gn	33:10	Iacob seeing Gods hand in this change of his brothers mind, not of flatterie, but sincerely acknowledged his benignitie, as Gods countenance towards him.	scan-pdf
Gn	34:0	No formal annotations found for this chapter in the PDF scan.	scan-pdf
Gn	37:3	In his old age.] This being one cause why Iacob loued Ioseph aboue al his other sonnes, for that he was the yongest of the eleuen; it is alleadged in holy Scripture (faith S. Chrisostom) as least offensiue to his brethren. For a more special cause was for his mother Rachels sake, but most principal cause of al was, for his great vertues and mature iudgement; for which God also preferred him aboue them al, and now foreshewed the same by visions in sleep. Which they enuying and meaning to preuent, did indeed vnwitting cooperate therto, Gods prouidence turning their euil worke to infinite good.	scan-pdf
Gn	37:35	Into hel mourning.] Protestants denying more places for soules after this life, then Heauen for the iust, & Hel for the wicked, translate the Hebrew word Sheol, graue, for hel. Because if they should grant that Iacob or other holy fathers of the old Testament descended into hel, they must confesse some other hel, then where the damned are tormented, whither no Christian wil say that those fathers went. As for the sense, it can not be that Iacob ment the graue: for when he said he would goe to his sonne, he supposed him to be deuoured by a wild beast, and not buried in a graue. And therfore must necessarily meane, that he would goe where he thought the soule of his sonne to be. Which was neither in heauen, for then he would rather haue ascended thither ioyful, then descended to any place mourning; neither did he meane the hel of the damned, for that had been desperation; but to a low place, where the iust soules then remained in rest, which was called Limbus Patrum, or Abrahams bosome. That is, faith S. Augustin, secreta cuiusdam quietis habitatio: The habitation of certaine secret rest.	scan-pdf
Gn	38:8	Raise seed to thy brother.] By this it appeareth, that in the law of nature, when a maried man died without issue, his brother might lawfully marie the widow; whose first sonne should be counted and called the sonne and heyre of his vncle dead before. The same was established by the law of Moyses (Deut.25) Which being now abrogated, it remaineth in the Churches power to constitute a law in this behalf, and consequently to dispence in the same, so farre as is agreeable with the law of nature.	scan-pdf
Gn	47:22	Sauing the Land of the Priests.] Let them heare which now liue (faith S. Chrysostom ho. 65. in Gen.) what great care men had in times past of the Priests of idols; & let them learne at least to yeald like honour to true Priests, to whom the ministerie of al diuine offices is committed. For if the AEgyptians in their errours had so great care of Idols, thinking them to be more honoured if their Ministers were respected, how great condemnation doe they deserue, that now diminish that which pertaineth to the prouision of Priests? Doe yee not know that the honour pertaineth to God himself? And he that so bestoweth, shal not only receiue like retribution, but manifold greater; our merciful God alwayes of the aboundance of his mercie exceeding the things which are done by vs. Let vs not therfore be worse then infidels.	scan-pdf
Gn	47:30	I wil sleepe with my fathers.] Albeit neither the lack of burial, nor anie crueltie nor contumelie vsed against dead bodies, can annoy the iust, yet it is both a lawful natural desire, and a spiritual comfort and profit, to be buried in special places, where their owne freinds, or holie persons are buried, or where God is more specially serued, Sacrifice and other prayers offered. And so both Iacob and Ioseph desired to rest in the land of Chanaan, where their parents were buried, and where Christ should be borne and redeeme mankind. But worldlie pomp and honour of funerals are rather the comfort of the liuing, then the reliefe of the departed, as S Augustin teacheth.	scan-pdf
Gn	50:20	You thought euil.] This plaine distinction sheweth, that sinne is wholly of the sinner; and that God hath no part therin, but turneth it to good. For those things which Iosephs brethren did against him, were occasions of his aduancement in AEgypt, through the omnipotent wisdome of God. Whose propertie is, out of euerie euil to draw good. S. Chrisost. ho. 67. in Gen. S. Aug. Enchirid. c. 11.	scan-pdf
Gn	50:25	Carie my bones with you.] For the same reasons Ioseph would be finally buried in Chanaan, for which Iacob desired to be there buried (chap. 47.) but Ioseph would not presently be caried thither, lest it might haue giuen offence to the AEgyptians, or at least haue diminished their fauour towards his brethren: & withal he would confirme his brethren in their hope of returning, seeing he was content, that his bodie should expect in AEgypt, til the whole Nation should returne into Chanaan.	scan-pdf
Gn	24:14	Obseruation of speaches called ominous, which are interpreted to signifie good or euil luck, are sometimes superstitious & suggested by euil spirits, who now & then telling or insinuating some truth, get credit, & so allure men to attend to such vaine, vncertaine, and vnlawful signes, as S. Augustine testifieth li. 2. de Gen. ad lit. c. 17. & li 12. c. 12. Neuertheles such signes are sometimes lawfully obserued, & desired from God, as the same Doctour disputeth (li. quest. super Gen. q. 53) & S. Chrisostome teacheth more clerly (ho. 47. in Gen.) likewise S. Theodoret q. 73. in Gen. But whosoeuer wil not erre in particular cases, must follow either expresse Scripture, or the iudgement of the Church, which is alwayes directed by the spirit of truth. And touching this prayer of Abrahams seruant, & his desire of this determinate signe to know the maid, whom God had prouided to be Isaacs wife, the fathers generally hold that it was religious, deuout, and discrete. For he being careful of his Masters busines, and not trusting his owne iudgement, but relying vpon that Abraham had said, Our Lord shal send his Angel before thee, commended so weightie a cause to God by prayer, the Angel suggesting both to him to desire, & to the maid to performe (as the euent sheweth) such qualities and vertues in her, as were most agreable to the great charitie and hospitalitie dayly practized in Abrahams house, most conuenient and necessarie (as he discretely considered) for that familie, and good of manie. The like obseruations were approued in Gedeon, and Ionathas. And to pray for such signes in some case, or for manifest miracles is also approued by the Apostles example praying God To shew by lot which of the two he had chosen to the Apostleship, in place of Iudas. And that he would extend his hand to cures, and signes, and wonders, to be done by the name of his holy sonne IESVS.	scan-pdf
Ex	2:2	Iofephus writeth that Amram Moyfes father, being folicitous, when his wife was great, how to saue the infant if it were a man-child, God reuealed to him, that she had conceiued a sonne, who should not only be saued from Pharaos furie, but also be the deliuerer of the whole Hebrew nation from thraldome and seruitude of the AEgyptians. Wherupon they assuredly trusted that God would protect and prosper him, yet so, if they did their owne endeuour, which S. Augustin teacheth to be alwayes necessarie.	scan-pdf
Ex	2:3	When she could not conceale him.] These godlie and prudent parents, considering that when the Ægyptians should perceiue such an infant to be borne, and not drowned according to the Kings Edict, they would destroy both the child and whole familie; to auoid the greater danger, chose the lesse: To bring him to the water side, not omitting their owne industrie, as wel by closing him in a basket, that would draw no water, as by setting his sister to watch what became of him.	scan-pdf
Ex	2:11	He strucke the AEgyptian.] Moyfes not of carnal loue towards his brethren, nor of priuate passion, but by diuine inspiration killed the AEgyptian, as S. Augustin proueth (li. qq. in Exod. q. 2.) by the testimonie of S. Steuen faying: Moyses thought his brethren had vnderstood, that God by his hand would saue them. (Act. 7.) Wherby appeareth that Moyfes himselfe knew it was Gods pleasure he should kil that AEgyptian inuading an Hebrew. Yet others may not imitate such particular examples.	scan-pdf
Ex	2:23	Oppression of innocents crieth to heauen for reuenge.	scan-pdf
Ex	3:2	Our Lord appeared.] S. Steuen reciting this vision faith, an Angel appeared to Moyses: and so it is in the Hebrew text, in the Chaldee Paraphrasis, and in the Septuagint Interpreters. Neither is the Latin Edition (reading Lord) contrarie to the other which read Angel, for holy Scripture sometimes attributes the same apparitions and other workes to God, as the author and principal Agent, and sometimes to Angels, the next and immediate ministers of God. For so S Steuen and also S. Paul faith plainly (Gal.3.) that the Law was delivered by Angels. And in his Epistle to the Hebrewes, proueth the excellencie of Christs Law aboue the old law, by the difference of the persons by whom both were giuen: affirming that the former was spoken by Angels, the other declared by our Lord Iesus Christ. S. Cyril, S. Dionyse, S. Iustinus Martyr, S. Augustin, S. Gregorie, and other Fathers al teach that Angels appeared in Gods place to the ancient fathers.	scan-pdf
Ex	3:14	I am who I am.] Al other things, besides God, once were not; and being are limited in nature; neither could persist vnles God conferued them. Only God eternally is without beginning, ending, limitation, dependance, or mutation; consisting only of himselfe, & al other things are of him. Therefore this name, QVI EST, HE WHICH IS, is most proper name of God, not determining anie manner, but indeterminately signifying al manners of being, for so it importeth the very infinit immensitie of Gods substance. S. Damascen. li. 1. c. 12. Orthodoxae fidei. S. Tho. p. 1. q. 13. a. 11.	scan-pdf
Ex	4:1	They wil not belieue me.] Moyfes wisely considering that the children of Israel, much lesse Pharao, would hardly belieue his bare word, affirming that he was sent to them by God, proposed this difficultie before he tooke the Embacie vpon him. For without good proofe both the Israelites and AEgyptians might haue reiected him, as seeming to come of his owne priuate spirit. Therfore God gaue him power of working miracles to proue his extraordinarie mission true and lawful. Which sufficed to make euen Pharao himselfe to know, that he was sent from God Almightie, though it mollified not his stubborne hart. For this cause our Sauiour himselfe confirming his doctrine by miracles, sayd to the Iewes: If you wil not belieue me, belieue by workes. And conformably sending his Apostles to preach the Ghospel, gaue them power to worke miracles in his name.	scan-pdf
Ex	5:4	Worldie men thinke Gods people increase most by rest, but indeed they multiply more when they are oppressed. S. Cyprian de exhort. Mart. c. 10.	scan-pdf
Gn	25:6	S. Augustin sheweth that both Agar and Cetura, being Abrahams lawful wiues (for so they are called in holie Scripture) are also called concubines, because they had not like priuiledges to Sara, whose sonne was sole heyre to his father, and the children of the others had only guifts (or moueable goods) not attayning to the promised Kingdom. And al this for mysterie sake. For Ismael signified the carnal people before Christ, the children of Cetura prefigured Heretikes, who suppose themselues to pertaine to the new Testament, but are separated no lesse then the Iewes from Christs Kingdom. And albeit there was also an other particular reason why Agar was called concubine, because she was a second wife the first then liuing, yet this learned father faith, he did not see why Cetura, being maried after the death of Sara, should be called concubine, but only for this Mysterie.	scan-pdf
Gn	25:21	Notwithstanding Gods assured promise, that Isaac should haue issue (Gen. 21. v. 12.) yet he prayeth instantly for the same. And Moyses here attributeth Rebeccas conceiuing to Isaacs prayer. Wherby we see that Gods foreseeing, predestinating, and promising, exclude not, but indeed include secondarie causes, and ordinarie meanes, by which his eternal wil and pleasure is fulfilled.	scan-pdf
Gn	25:23	As before (c. 17, v. 21, and c. 21, v. 12.) the couenant and great promises made to Abrahams seed, are declared to pertaine only to Isaac, and not to Ismael, nor to the other brothers; so the same belong not to Efau the elder, but only to Iacob the yonger sonne of Isaac, the Holie Ghost saying, The elder shall serue the yonger. And withal signifieth (faith S. Augustin) that the elder people of the Iewes shal serue the yonger Christian people. For although it may be vnderstood literally to be fulfilled, in that the Idumeans comming of Efau were subdued by King Dauid comming of Iacob; yet it is more conueniently belieued, that this prophecie tended to a greater thing. And what is this, but that which is euidently fulfilled in the Iewes and Christians? An other great document of grace S. Paul gathereth vpon this Mysterie: that the twinnes being not yet borne, nor hauing done any thing good or euil, without anie good merits the yonger is elected, the elder reprobate. For doubtles (faith S. Augustin) touching original sinne they were both equal, and concerning proper sinne, neither of them had anie at al. By which example he sheweth Gods mere mercie in the elect, and iustice in the reprobate.	scan-pdf
Gn	25:31	Iacob instructed by his mother, that God had chosen him in place of his brother Efau (for to her God had reuealed that the elder should serue the yonger) did lawfully vse this oportunitie to get Efaus grant of the right pertaining to the first-borne, but Efau in felling it sinned, shewing himselfe an intemperate prophane man.	scan-pdf
