book	chapter	verse	latin_incipit	english_translation
2Sm	22	51		Who giveth great salvation to his king, and sheweth mercy to David his anointed, and to his seed for ever. Lapide: the final verse of the canticle points directly to the eternal covenant — \"his seed for ever\" is ultimately Christ, of whom Solomon was only the proximate type. The \"anointed\" (christum) recalls the Messianic promise of chapter 7.
2Sm	23	1		These are the last words of David. David the son of Isai said: The man to whom it was appointed concerning the Christ of the God of Jacob, the excellent psalmist of Israel said. Lapide: three interpretations — (1) plainly of Christ, to whom the promise was made; (2) of David himself as the anointed of God; (3) Hebrews: \"a ladder was set up for the Christ of the God of Jacob,\" referring to the ladder of Jacob (Gen. 28) as a symbol of penance and the Messiah's descent. The first sense is the plainest.
2Sm	23	2		The Spirit of the Lord hath spoken by me, and his word by my tongue. Lapide: this is David's explicit claim to prophetic inspiration — \"I am not speaking from my own mind or genius, but breathed upon by the divine Spirit; God dictated the Psalms and I was His instrument.\" My tongue was \"the pen of a ready writer\" (Ps. 44:2).
2Sm	23	3		The God of Israel said to me, the Strong One of Israel spoke, the Ruler of men, the just Ruler in the fear of God. Lapide explains three senses: (1) Chaldaeus — \"He constituted me a king; He is the Messiah who shall arise and rule in the fear of God\"; (2) Vatablus — \"God foretold that I would be a just ruler fearing God\"; (3) allegorically of Christ who rules justly in the fear of the Lord.
2Sm	23	4		As the light of the morning, when the sun riseth, shineth in the morning without clouds; and as the grass springeth out of the earth by rain. Lapide: literally of David's kingdom; allegorically of Christ — \"His rising was from the heavenly grace of the Holy Spirit by whom the Blessed Virgin conceived; 'the Orient from on high hath visited us'\" (Luke 1:78). Angelomus: \"The dawn is the Church, which shines without clouds of unbelief at the rising of Christ from the dead.\"
2Sm	23	5		For my house is not so with God, that he should make with me an eternal covenant. Lapide explains the antithesis: David and his house are not of such intrinsic merit that God should enter an eternal covenant with them; it was by pure grace and liberality that God chose David to serve the generation of Christ. \"All my salvation and all my will\" are fulfilled in this covenant.
2Sm	23	6		But transgressors shall all of them be taken away as thorns, which are not handled with hands. Lapide: thorns need to be cut with iron or burned with fire — the impious must be corrected firmly, not softly; evil cannot be removed by gentle hands alone. Allegorically: God will cut down the houses of the wicked; the house of the just will flourish like grass watered by rain.
2Sm	24	1		And the anger of the Lord was again kindled against Israel, and he stirred up David among them, saying: Go, number Israel and Juda. Lapide: God did not directly incite David — He permitted Satan to do so (1 Par. 21:1: \"Satan rose up against Israel and moved David to number Israel\"). The attribution to God denotes a just permissive will used for the punishment of the people's sins.
2Sm	24	10		And David's heart struck him, after the people were numbered; and David said to the Lord: I have sinned very much in what I have done; but I pray thee, O Lord, to take away the iniquity of thy servant, because I have done very foolishly. Lapide: David's sin was pride — glorying in the multitude of his subjects. The census was not wrong per se (the Romans took censuses lawfully), but David did it from vanity and arrogance. S. Augustine: \"God diminished by the death of many the number in which the king had gloried.\"
2Sm	24	14		And David said to Gad: I am in a great strait; but it is better that I should fall into the hands of the Lord (for his mercies are many) than into the hands of men. Lapide: David chose the plague over famine and war because the plague is directly from God, whose mercy is greater than man's; and Chrysostom praises him as a good shepherd who hoped that the plague would take him before others, and so \"placed his soul for his sheep.\"
2Sm	24	16		And when the angel stretched out his hand over Jerusalem to destroy it, the Lord had pity on the affliction, and said to the angel that slew the people: It is enough. Lapide notes this is the same pattern as with Sodom (Gen. 19) and Sennacherib — a good angel (not evil) inflicted the plague by divine command; his sword was seen drawn by David. The plague ceased miraculously at Mount Moriah.
2Sm	24	17		And David said to the Lord, when he saw the angel striking the people: It is I that have sinned; I have done wickedly. These that are the sheep, what have they done? Let thy hand, I beseech thee, be turned against me and against my father's house. Lapide: \"How admirable! He who was unworthy of absolution was judged worthy of sacrifice by this act\" (S. Ambrose). David as the good shepherd offering himself for his flock — a type of Christ the Good Shepherd.
2Sm	24	18		And Gad came to David that day, and said to him: Go up, and build an altar to the Lord in the thrashing floor of Areuna the Jebusite. Mount Moriah — the same place Abraham offered Isaac (Gen. 22). Lapide: God chose this place to indicate where Solomon would build the Temple; and allegorically, the altar built here by David as expiation of his sin is a type of the Altar of the Cross on Calvary, where Christ by His sacrifice atoned for the sins of all mankind.
2Sm	24	25		And David built there an altar to the Lord, and offered holocausts and peace offerings; and the Lord became merciful to the land, and the plague was stayed from Israel. Lapide: fire came down from heaven to consume David's sacrifice (1 Par. 21:26) — a sign of divine acceptance. God indicated thereby that He willed the Temple to be built on this spot; and David proclaimed to all the people: \"This is the house of the Lord God, and this the altar for the burnt offering of Israel\" (1 Par. 22:1).
