book	chapter	verse	latin_incipit	english_translation
1Kings	1	1		David in old age could not grow warm: Lapide notes natural and medical causes (bodily heat failing), but notes the deeper theological significance — Abisag the Sunamite (whose name means "father of error overcome") typifies the Church, or divine Wisdom, brought to minister to the aged king. Lapide also sees in her virginity preserved with David a foreshadowing of the Blessed Virgin.
1Kings	1	5		Adonias exalts himself: Lapide notes Adonias' conspiracy against Solomon as a type of those who seize the Church's goods through schism and ambition, like Absalom before him. Joab's support of Adonias is political cunning without true faith — the prototypical political man who uses religion to serve power.
1Kings	1	39		Solomon anointed by Sadoc and Nathan: Lapide notes that Solomon was anointed with oil from the tabernacle, fitting for the type of Christ the true Anointed One. Sadoc (= "just") and Nathan (= "gift") together represent the priestly and prophetic offices united in the anointing of Christ.
1Kings	2	3		David's charge to Solomon — observe the custodies of the Lord thy God: Lapide: "Custodies" means the precepts which God commands to be kept. He who acts prudently, acts prosperously: prudence is the mother of prosperity and of happiness, just as imprudence is the mother of misfortune.
1Kings	2	6		David commands Solomon to punish Joab: Joab treacherously shed the blood of two just men, Abner and Amasa, in time of peace, staining his garment with their blood. The law of retaliation, established by the law of nature and divine law, requires that he who kills another be put to death.
1Kings	2	36		David's epitaph (Josephus): "David was a man most excellent and endowed with all virtues befitting a king set over so many peoples: for he was brave beyond all others, and in battles undertaken for the safety of his subjects he was the first to expose himself to dangers, encouraging his soldiers by his example to great deeds. He was also most prudent in counsel, and excellently skilled in knowing what was to be done for the present and the future."
1Kings	3	1		Solomon's marriage to Pharaoh's daughter: Lapide notes this was lawful if she converted to the faith, as did Ruth, Rahab, and others. He notes the Canticle of Canticles alludes to this marriage: "I have compared thee to my company of horsemen in Pharaoh's chariots" — but its mystical sense is the union of Christ with the Church.
1Kings	3	2		The high places: Lapide gives a learned discussion of "excelsa" — groves and high places used for sacrifice. Those used for false gods were manifestly illicit. Those used for the true God were tolerated before the Temple was built, but after its completion, kings who permitted them fell short of full obedience to God.
1Kings	3	4		Solomon goes to Gabaon to sacrifice: Lapide: "Note the piety of Solomon, who begins his reign with the worship and invocation of God; he offered a thousand holocausts, and therefore obtained from God a wisdom so great that God granted the like to no one else."
1Kings	3	5		God appears to Solomon in a dream — "Ask what thou wilt that I should give thee": Lapide gives an extended discussion of whether Solomon had full use of reason in this dream. He concludes, following Suarez and many Fathers, that this was a prophetic vision, not a mere natural dream — God raised Solomon's intellect and phantasy to full rational use even in sleep, as with other prophets.
1Kings	3	7		Solomon: "I am but a child, and know not how to go out and come in": Lapide: "I am very young, rude, and inexperienced, therefore like a child for the burden of governing so great a people." Solomon was about twenty years old. The Hebrew phrase means "I do not know how to conduct myself in the administration of so great a kingdom."
1Kings	3	9		"Give therefore to thy servant an understanding heart": Lapide: By wisdom Solomon properly sought prudence — the practical and ethical wisdom by which he might govern himself and the people. He sought, as Wisdom ix says, "the assistant of Thy throne, that she may be with me and labour with me." Wisdom in the Sapiential books chiefly signifies practical wisdom teaching us to live justly and holily.
1Kings	3	12		"I have given thee a wise and understanding heart, so that there hath been no one like thee before thee": Lapide explains the multiple kinds of wisdom given: first, ethical and political; second, natural philosophy, medicine, logic, rhetoric, mathematics, architecture; third, supernatural theological wisdom and the gift of prophecy. All this wisdom was infused directly by God on that night.
1Kings	3	13		"And the things also which thou didst not ask, I have given thee: riches and glory": Lapide: "Learn here how great a good and gift of God is wisdom, how much it is to be preferred above all other things, and that it draws all things else along with it. For wisdom is to be obtained by prayer more than by study. The author and giver of wisdom is God, who is the Father of lights."
1Kings	3	15		"Solomon awoke and understood it was a dream": Lapide: not a common natural dream, but a divine prophetic vision — for God truly infused wisdom into him at that moment, and the Scriptures recount all that followed as truly done, not merely dreamed. The parallel in 2 Chronicles says simply "God appeared to him."
1Kings	3	26		The judgment of Solomon: The true mother's compassion — "her bowels were moved" — reveals the true mother. Lapide applies this morally and mystically. The Church like the true mother would rather give up the child than see it destroyed by division.
1Kings	4	20		"Juda and Israel innumerable as the sand of the sea": Lapide: "At the time of Solomon the tribe of Juda and the eleven tribes of Israel increased to an innumerable multitude, and there was then the greatest abundance of all things." Allegorically, the felicity of Solomon's kingdom represents the supreme happiness of Christ's kingdom in the Church by grace, and in heaven by glory.
1Kings	4	30		Solomon's wisdom exceeded that of Egypt and the East: Lapide notes Solomon surpassed not only Trismegistus, Orpheus, Homer, Plato, Solon, Lycurgus, and Aristotle — whose wisdom was acquired by study — but also Abraham, Moses, and David, since Solomon's was infused directly by God. Only Christ is excepted.
1Kings	5	5		Solomon prepares to build the Temple for the Name of the Lord: Lapide sees in this preparation the type of the Church's building. God wished Solomon to erect the Temple so that in one temple the unity of religion and of Judaism would be preserved, and the Jews would be utterly kept from the profane and high-place sacrifices of the Gentiles.
1Kings	6	1		The Temple begun in the 480th year from the Exodus: Lapide gives a careful chronological discussion. The Temple was begun in the 4th year of Solomon's reign and completed in the 11th year, taking 7 years and 7 months to build. He dates it to year 2933 of the world, 1017 years before the birth of Christ.
1Kings	6	2		Dimensions of the Temple — sixty cubits length, twenty breadth, thirty height: Lapide: Allegorically (following Angelomus), the length signifies the long-suffering of the Church, which patiently bears all adversity in the exile of her pilgrimage. The breadth signifies charity, which loves enemies as well as friends for God's sake. The height signifies hope of future retribution.
1Kings	6	4		The Temple windows oblique: Lapide: Allegorically, these oblique windows represent the holy Doctors, through whom God teaches and illumines the faithful — they admit wide light from a narrow opening, sending it far through the house, as the rays of the sun entering through a pyramid inverted.
1Kings	6	7		The Temple built in silence — no sound of hammer or axe: Lapide notes this miracle of construction: the stones were fitted in silence, signifying the spiritual Temple of souls fitted together without the noise of external coercion, by the interior work of grace.
1Kings	6	29		The walls carved with cherubim, palms, and various figures: Lapide: The entire Temple was a catechism in images — cherubim representing the angelic orders, palms the just, the vine the Church. The allegorical interpretation follows Bede, Eucherius, Angelomus, Rupertus, and Francis Ribera.
1Kings	6	38		The Temple completed in seven years: Lapide: "Allegorically, the Temple represents the Church Militant; anagogically, the Church Triumphant in heaven; tropologically, the holy soul which through faith in this life, and through sight in the next, contemplates God face to face, and is beatified by this contemplation."
1Kings	7	13		Hiram of Tyre, the master craftsman: Lapide notes that Hiram (born of a widow of Naphtali and a father from Tyre) is a type of Christ born of a widow-type Church, uniting in himself Gentile and Jewish craftmanship to build the spiritual Temple — the Church.
1Kings	8	2		Dedication in the month Ethanim, the seventh month: Lapide notes the dedication of the Temple signified allegorically the dedication of the Church; tropologically, the dedication of the holy soul — especially of the Blessed Virgin, whom Peter Damian compares to Solomon's Temple in his sermon for the Nativity.
1Kings	8	4		The Ark brought into the Temple — the Tabernacle of Moses also transferred: Lapide argues from Josephus, Ribera, Abulensis, Serarius, and Vilalpandus that both the Tabernacle of Moses from Gabaon and the Tabernacle of David from Sion were transferred into the Temple, so that no other place of divine worship would remain — a wise provision against superstition and idolatry.
1Kings	8	10		"A cloud filled the house of the Lord": God represented and simultaneously veiled His glory through the cloud. Lapide: "Darkness is the veil of the Deity, just as a sacrament is. For it signifies that God is invisible and inaccessible to men." The priests could not stand to minister before the cloud — overcome by the divine majesty.
1Kings	8	11		"For the glory of the Lord had filled the house of the Lord": Lapide: "The cloud is called 'glory of the Lord' because it was the sign and symbol of God's glory. It was therefore luminous and splendid — a luminous darkness, if it may be so said — light in form of a dark cloud."
1Kings	8	13		Solomon: "I have built thee a house to dwell in, a settled place for thy throne for ever": Lapide (following Cajetanus): The proper office of the Temple is not to provide God with a dwelling, but to provide men a direction of mind toward the eternal divine throne which is in the heavens. The Temple was built to direct men toward God who created heaven and earth and governs all.
1Kings	8	22		Solomon stands before the altar with hands extended to heaven: Lapide notes Solomon prayed standing with both knees bent and both hands extended, as an example to all who pray: "Let nobles and the glory-seeking note that Solomon, king of kings, prayed with both knees to the ground and both hands extended, and remained in this posture of supplication throughout his long prayer."
1Kings	8	27		"For heaven and the heaven of heavens cannot contain thee; how much less this house which I have built?": Lapide: God is immense, therefore He is everywhere and fills all things, and extends beyond all things through immeasurable spaces of void, wherein He could create thousands of millions of new worlds. Even pagan philosophers acknowledged this: Aratus wrote, "Jupiter is whatever you see; all things are full of Jove."
1Kings	8	30		"And hear thou in the place of thy dwelling in heaven; and when thou hearest, be merciful": Solomon's prayer covers seven cases of supplication — oath-adjuration, military defeat, drought, famine and pestilence, the prayers of foreigners, war abroad, captivity. Lapide notes this comprehensive intercession as the model of all priestly and kingly prayer.
1Kings	8	41		"Moreover the stranger who is not of thy people Israel": Lapide: Solomon's prayer explicitly includes the Gentiles who come to pray in the Temple, that God may hear them so "all peoples of the earth may learn to fear thy name." This is a type of the universal scope of the Church's intercession for all nations.
1Kings	8	54		Solomon rises from prayer — "for he had fixed both knees on the ground": Lapide applies this to all Christians: Solomon king of kings kneeled on both knees; those who pray on one knee, leaving the other raised as if to challenge God, should take note and be ashamed.
1Kings	9	3		God appears to Solomon a second time — "I have heard thy prayer": Lapide: This second appearance confirms the divine promise — God's name will be in the Temple forever. But conditional on obedience: if Solomon walks in God's ways the kingdom is secure; if not, the Temple itself will become a byword and a hissing among the nations.
1Kings	10	1		"And the queen of Saba, having heard of the fame of Solomon in the name of the Lord, came to try him with hard questions": Lapide discusses at length whether the Queen came from Arabia or Ethiopia. He follows the majority of Fathers (Josephus, Origen, Augustine, Ambrose, Gregory, Basil, etc.) in holding she came from Ethiopia. She is the "queen of the South" who came from the ends of the earth.
1Kings	10	1		Queen of Saba — allegorical sense: Lapide: "Allegorically, just as the queen of Saba came from Ethiopia to Solomon to learn wisdom, so the Church from the Gentiles came to Christ to draw the knowledge of salvation." Christ himself says: "The queen of the South shall rise in judgment against this generation...and behold, a greater than Solomon is here." (Matt. 12:42)
1Kings	10	5		"She had no longer any spirit in her" — overwhelmed by Solomon's wisdom: Lapide: Allegorically (S. Gregory on Psalm vi): "The Church of the elect, gathered from the Gentiles, having come to know the grace of Christ and having found the masters of evangelical doctrine, laying aside the proud spirit and all the arrogance of elation, learned to distrust herself and to hope greatly in the mercy of her King."
1Kings	10	8		"Blessed are thy men and blessed are thy servants who stand before thee always": Lapide: "This is more truly verified in Christ, the antitype of Solomon, as He Himself teaches (Luke xi:31). Anagogically, this will be most perfectly true in heaven, where we shall see the God of gods in Sion and shall have no more spirit from sheer wonder at the glory which eye hath not seen, nor ear heard, nor hath it entered into the heart of man."
1Kings	10	23		"King Solomon exceeded all the kings of the earth in riches and wisdom": Lapide: The entire earth desired to see the face of Solomon, to hear the wisdom which God had placed in his heart. He is the supreme type of Christ: as all peoples came to Solomon to hear wisdom, so all nations come to Christ, the Wisdom of God incarnate.
1Kings	11	1		Solomon's fall through foreign wives: Lapide (citing Augustine, Aquinas, Jerome): Solomon did not fall into actual belief in idols, but yielded to the love of his wives, performing external worship to please them. Augustine: "It was not that he believed there was any benefit in the worship of idols, but he could not resist the deadly delights of the women he madly loved." Learn here how dangerous it is to marry unbelievers or heretics.
1Kings	11	4		"His wives turned away his heart": Lapide's moral: "Learn here how much we must beware of women. The love of them is invincible and extorts anything, however precious or however wicked, from those who love them. Flee from them, for you are not wiser than Solomon, nor stronger than Samson, nor holier than David — all of whom fell through women."
1Kings	11	11		God tears the kingdom from Solomon's hand: Lapide: "Miserable was this fall of Solomon, the wisest and holiest of men, by which he fell into six great crimes." He lists them: marrying the alien idolatresses; marrying too many; permitting them to worship their idols; worshipping those idols himself; drawing many Hebrews to idolatry by his example; imposing immense tribute on the people to maintain the royal women.
1Kings	11	41		"The rest of the words of Solomon, and all that he did, and his wisdom — are they not written in the book of the words of the days of Solomon?": Lapide quotes Josephus's epitaph: "Solomon died, the most fortunate, most opulent, and most prudent of all kings, excepting the sin into which he was drawn by women in his old age." He had proclaimed "Vanity of vanities" — and yet the vanity of women's beauty finally besotted him.
1Kings	12	16		Israel's revolt against Roboam — "What portion have we in David?": Lapide: Here begins the great schism of the ten tribes. The cause was Roboam's foolish rejection of wise counsel in favour of rash youth. Lapide draws the lesson: wise princes must listen to experienced counsellors; pride and folly in rulers destroy kingdoms.
1Kings	12	28		Jeroboam erects the golden calves: "Behold thy gods, O Israel, who brought thee out of the land of Egypt": Lapide: Jeroboam, fearing that if the people went up to Jerusalem to the Temple they would return to Roboam, made this schism of religion to support his political schism. The Donatists did the same — setting bishop against bishop, altar against altar, as Augustine noted.
1Kings	12	33		Jeroboam's false priesthood: "Whosoever would, he filled his hand and made himself priest of the high places": Lapide notes the contrast with the true Aaronite priesthood — Jeroboam expelled the Levites and ordained any volunteer. This is the type of heretical and schismatic sects who invent their own priesthood without apostolic succession.
1Kings	13	2		Prophecy against Jeroboam's altar — "Josias by name shall be born": Lapide: This prophecy, given 300 years before Josias' birth, and naming him by name, is one of the most remarkable in all Scripture — comparable to Isaias naming Cyrus two hundred years before him. Such precision of prophetic naming demonstrates the divine origin of biblical prophecy.
1Kings	14	6		Ahijah the prophet recognizes Jeroboam's wife: Lapide notes that Ahijah, though blind with extreme old age, recognized her by a divine interior light, as the Lord had foretold her coming. This is the prophetic charism by which God instructs His servants even when bodily senses fail.
1Kings	15	14		Asa's heart was perfect with the Lord: Lapide: "Perfect" means in faith and in the worship of the one true God and in rooting out idolatry. In many other things Asa sinned — as when sick he trusted in physicians rather than in God, and when afraid he sent the treasure of the Temple to Ben-hadad. True imperfection does not destroy true faith.
1Kings	16	32		Ahab serves Baal: Lapide identifies "Baal" as the name given to Nemrod, founder of idolatry, about 300 years after the Flood. From him all other false gods of the nations received the name Baal. Ahab added the Baal of the Sidonians to the golden calves of Jeroboam, encouraged by his wife Jezebel, daughter of the Baal-priest Ethbaal, king of Sidon.
1Kings	17	1		Elijah the Tishbite announces the drought: Lapide (quoting S. Bernard's letter): Elijah was "the form of justice, the mirror of holiness, the example of piety, the asserter of truth, the defender of faith, the teacher of Israel, the master of the ignorant, the refuge of the oppressed, the advocate of the poor, the judge of widows, the rod of the powerful, the hammer of tyrants, the father of kings, the salt of the earth, the light of the world, the prophet of the Most High, the forerunner of Christ."
1Kings	17	1		"As the Lord God of Israel liveth, before whom I stand, there shall not be dew nor rain these years but according to the word of my mouth": Lapide: Elijah having first admonished Ahab to abandon Baal, and finding him deaf, moved from words to blows, and struck the whole land with sterility, that Ahab and the idolaters might learn it is not Baal but the true God who gives rain and harvest.
1Kings	17	6		"And the ravens brought him bread and flesh in the morning, likewise bread and flesh in the evening": Lapide: God used a voracious and inhuman bird to feed Elijah, to show that He commands all animals and can change their nature. The Angels prepared these loaves and meats — hence they were better and more nourishing than ordinary food. S. Basil: "The ravens, forgetful of their own nature, in bringing bread and meat to the holy man were ministers of the Lord's command."
1Kings	17	9		"Arise, and go to Sarepta of the Sidonians": Lapide: God commands Elijah to leave the borders of Israel and go into the territory of the Sidonians, to dwell there safely and quietly under a Gentile king. Allegorically (S. Augustine), Elijah signifies Christ who, persecuted by the Jews, transferred His Gospel to the Gentiles — as Christ himself explained (Luke iv:25-26).
1Kings	17	12		The widow of Sarepta: "I have not bread, but a handful of meal in a pot and a little oil in a cruse": Lapide: She was a Gentile woman, but religious and devout. Her faith, obedience, and generosity in giving her last handful of meal to the prophet who had brought the famine were heroic. Eucherius: "Great was the soul of the woman, great her unchanged purpose of mind, great and truly venerable her deed through the ages!"
1Kings	17	14		"Thus saith the Lord God of Israel: The pot of meal shall not waste, nor the cruse of oil be diminished, until the day wherein the Lord will give rain upon the face of the earth": Lapide: The flour was multiplied not by rarefaction but by continual addition of new flour and oil from divine power. This is the reward of the widow's faith, obedience, and almsgiving — she gave her last means of subsistence to Elijah.
1Kings	17	14		Eucharistic typology of the oil and flour: Lapide (citing Lanfranc, Algerus, Rupertus, and others writing against Berengar): "The pot of flour signifies the bread of the Eucharist, which is daily eaten by the faithful and yet is never consumed or fails." The miracle of the inexhaustible flour and oil is a figure of the inexhaustible Body of Christ in the Blessed Sacrament.
1Kings	17	16		"The pot of meal wasted not, and the cruse of oil was not diminished, according to the word of the Lord": S. Prosper: "Thus the soul lends to God; thus while she gives in necessity she provides for herself unto salvation." S. Eucherius: "The hand of the widow became a perpetual winepress and a mill ever pouring forth. In the word of the prophet, the whole house of the widow became the storehouse of the pious."
1Kings	17	19		The son of the widow dies and is raised by Elijah: Lapide: "God permitted or sent this illness so that, the boy being raised by Elijah, the faith and virtue of Elijah might shine forth before Ahab and the Baalites." The first resurrection from death since the creation of the world. Traditional opinion holds this boy to have been the prophet Jonah — a tradition Lapide notes but disputes.
1Kings	17	21		Elijah stretches himself upon the child three times: Lapide gives five reasons — ethical (showing his great love), physical (warming the dead body to dispose it for the soul), symbolic (showing how arduous it is to raise the dead), theological (commending the body through the contact of his holy flesh), and tropological (showing the apostolic man must conform himself to sinners he would convert, as Paul: "I became all things to all men").
1Kings	18	1		Elijah shows himself to Ahab in the third year of the drought: Lapide: "Just as when Pharaoh oppressed the faithful Hebrews God raised up Moses to oppose him, so against the idolatry of Jeroboam He set up Ahijah the prophet; against Manasses, Isaiah; against Antiochus, the Maccabees — so against the universal Arian heresy He set up Athanasius; against the Pelagians, Augustine; against the Lutherans and Calvinists, Ignatius and like men."
1Kings	18	4		Abdias hides a hundred prophets in caves: Lapide identifies these prophets with men of religion who, having given up worldly cares, lived together and devoted themselves to the divine praises — just as coenobites do today. The choir of prophets in Samuel's time praised God with vocal chant and musical instruments. These hidden prophets are martyrs-in-waiting, and Jezebel is the type of persecution.
1Kings	18	19		Elijah: "Gather unto me all Israel unto mount Carmel, and the prophets of Baal four hundred and fifty": Lapide: In all there were 850 false prophets — antistites, teachers and authors of idolatry and heresy, whom Elijah (partly by himself, partly through the people) put to death. They were blasphemers against God, whom Moses' law commanded to be put to death.
1Kings	18	21		"How long do you halt between two sides? If the Lord be God, follow him: but if Baal, then follow him": Lapide: This is the great question of the spiritual life — one cannot serve two masters. The people answered not a word, for their conscience convicted them. Elijah's boldness in confronting the king and 850 false prophets alone is a model of prophetic courage.
1Kings	18	24		"The God that shall answer by fire, let him be God": Lapide: God frequently appeared in fire and consumed sacrifices through fire from heaven — at the sacrifice of Abel, Aaron, Solomon, David, Gideon, Manoah, and others. Fire represents the majesty of God: "The Lord thy God is a consuming fire" (Deut. iv:24). The Holy Ghost descended in fire at Pentecost for the same reason.
1Kings	18	32		Elijah pours twelve pitchers of water on the sacrifice: Lapide (quoting S. Chrysostom): Elijah did this so no one could suspect him of having hidden fire beneath the altar, as pagan priests were known to do through secret holes to ignite their sacrifices. The water overflowing proves the fire that comes cannot be earthly — it must be from heaven.
