book	chapter	verse	latin_incipit	english_translation
1Kings	18	38		"And the fire of the Lord fell and consumed the holocaust": Lapide: Josephus records that the mark left by this divine fire endured until his own time. This miracle — fire consuming not only the victim and the wood but the stones, dust, and water — surpasses all natural explanation and compels the acknowledgment: "The Lord he is God."
1Kings	18	39		"And when all the people saw this, they fell on their faces, and they said: The Lord he is God, the Lord he is God": Lapide: The Hebrew is "Jehova himself is Elohim, Jehova himself is Elohim." This cry of the people is also the etymology of Elijah's very name: El (= Elohim) + ia (= Jehova) + hu (= himself) = "God, the Lord, is he." The very name of Elijah was a prophetic proclamation of this truth.
1Kings	18	40		"Take the prophets of Baal, and let not one of them escape": Lapide: Elijah commanded them to be killed — all 850 — because they were antistites, teachers, and authors of idolatry, and blasphemers of God, whom the Law of Moses commanded to be put to death. He cites S. Basil: "He who uses anger rightly is not condemned by the Lord — Phinehas, Moses, Samuel, and Elijah all used just anger as the minister of good actions."
1Kings	18	44		The cloud like a man's footstep rising from the sea: Lapide (S. Augustine, serm. 201): "The cloud like a footstep of a man figured the flesh of Christ, which was to be born in the sea of this world. As Elijah prayed after three years and six months the rain came from heaven — so in the Advent of the Saviour in the three and a half years of His preaching, the rain of the Word of God irrigated the whole world."
1Kings	18	46		"And the hand of the Lord was upon Elijah, and he girded up his loins and ran before Ahab": Lapide: God gave Elijah strength and agility to run before the king's chariot, though he was fasting and exhausted from the long contest with the Baalites. He ran to show that the rain was given through his prayers; and also to render the ceremonial honour of a royal escort to King Ahab.
1Kings	19	4		Elijah under the juniper tree: Lapide: "Appropriately did Elijah rest under the shade of the juniper, for the berries of the juniper, burning like pepper, represent the ardour and zeal of Elijah — but this must be tempered by the shade of patience and humility; for the juniper, being small, gives a small and humble shade."
1Kings	19	5		The Angel touches Elijah: "Arise and eat": Lapide: "The Angels have singular care for hermits, such as Elijah was, since they have abandoned all things and are abandoned by all things. The food prepared by an Angel was therefore better and more nourishing than ordinary food." God sends His minister even to the despairing prophet — not with reproach, but with food and rest.
1Kings	19	8		Elijah walks forty days on the strength of that food to Mount Horeb: Lapide: "Note that Elijah fasted forty days, as Moses also did, and afterwards Christ — and in imitation of both, the Church instituted the fast of Lent." The bread of the Angel is a type of the Eucharist, by whose power through the forty days (= our whole life, a time of fast and penance) we walk toward the mountain of God.
1Kings	19	11		"And behold the Lord passeth, and a great and strong wind before the Lord... and after the wind an earthquake... and after the earthquake a fire... and after the fire a still small voice": Lapide: God shows Elijah that wind, earthquake, and fire — all instruments of divine power — are not the ordinary and proper mode of His providence. The still small voice (Hebrew: "voice of thin air") is the symbol of God's patience, clemency, and longaninity.
1Kings	19	12		"And after the fire a still small voice": Lapide: The lenis spiritus (gentle breath) is simultaneously subtle and sharp — God works "strongly and sweetly." He wished to moderate Elijah's zeal of vengeance, not to destroy it — but to direct it so that it might proceed from gentleness and love of justice, not from anger and disturbance of soul. God teaches the apostolic man to be patient as well as zealous.
1Kings	19	13		Elijah covers his face with his mantle and stands at the door of the cave: Lapide (S. Gregory II in Ezech.): "He who stands at the door of the cave and hears the words of God speaking to him must veil his face — for the more we are raised by grace toward higher things to be understood, the more always we must press ourselves down through humility, lest we strive to know more than it is fitting to know."
1Kings	19	18		"And I will leave me seven thousand in Israel whose knees have not been bowed before Baal": Lapide: This consolation to Elijah — that he is not alone — becomes the text of Paul's argument in Romans xi about the remnant of Israel. There are always more faithful than the prophet in his desolation perceives. The zeal of the solitary prophet must be tempered by trust in God's hidden providential preservation of His remnant.
1Kings	19	19		Elijah casts his mantle upon Elisha: Lapide: By this symbolic act Elijah transfers his spirit and prophetic office to Elisha — as a master clothes his disciple in his own authority and way of life. Elisha asks to bid farewell to his parents; Elijah's response is enigmatic but gracious. Elisha then burns his plough, feeds the people from the oxen, and follows Elijah without return.
1Kings	20	13		A prophet promises Ahab victory over Ben-hadad: Lapide: Even the wicked Ahab receives divine assistance when he acts rightly, for God vindicates his own honour against Ben-hadad's blasphemy. The victory is entirely God's — "You shall know that I am the Lord." Divine mercy even to sinners is conditioned on their at least external compliance with God's word through the prophet.
1Kings	21	1		Naboth's vineyard: Lapide quotes S. Ambrose's treatise De Nabuthe at length: "O rich man, you do not know how poor you are, how indigent you appear to yourself, who call yourself rich! The more you have, the more you need: and however much you acquire, you still lack. Avarice is inflamed by gain, not extinguished."
1Kings	21	3		Naboth: "The Lord be merciful to me and not give thee the inheritance of my fathers": Lapide: S. Ambrose: "The inheritance given to me by my parents is to be preserved, not as mine alone, but as theirs — for a son owes this reverence to his parents: to guard their goods and transmit them to posterity." Tropologically: "The vineyard is the soul, which is our entire inheritance; beware lest you sell it cheaply for pleasure or honour to the devil."
1Kings	21	7		Jezebel to Ahab: "Arise and be of good cheer, I will give thee the vineyard of Naboth the Jezrahelite": Lapide: "Jezebel was more impious than her impious husband, more avaricious than the avaricious, more cruel than the cruel, more rapacious than the rapacious. She was the torch and incendiary of idolatry and all evils in Israel, like a fury of hell, as appears from verse 25."
1Kings	21	13		Naboth stoned on false accusation: Lapide draws the parallel between Naboth and S. John Chrysostom: "In a similar manner Eudoxia, wife of the Emperor Arcadius, coveting the vineyard of the widow Callitropé, drove S. Chrysostom (who argued the widow's cause) into exile, and through a thousand trials — hunger, thirst, soldiers tormenting him — brought him to death. So that S. Chrysostom is not merely Confessor but Martyr."
1Kings	21	13		Allegorical sense: Lapide: "Allegorically, Naboth was a type of Christ, who was accused of blasphemy by false witnesses — on the charge that He called Himself the Son of God — and was therefore slain." The voice of the Scribes is in Matthew xxi:38: "This is the heir; come, let us kill him, and we shall have his inheritance." The dogs (= Gentiles) who licked Naboth's blood figure the Romans under Titus who avenged Christ's death.
1Kings	21	20		Elijah to Ahab: "Thou hast sold thyself to do evil in the sight of the Lord": Lapide: "Thou, O Ahab, art truly not a king nor an Israelite (i.e. a free man of noble condition), but a slave of Baal and Jezebel; for you have totally given yourself and enslaved yourself to them, to obey them in everything." Note the boldness of Elijah: he says to the king's face that he is the slave of sin.
1Kings	21	27		Ahab rent his garments and did penance in sackcloth: Lapide discusses whether this was true contrition or servile attrition. He concludes with the most probable view: it was true attrition (sorrow from fear of punishment), but did not rise to contrition formed by charity (sorrow from love of God). Hence God remitted the temporal punishment but deferred it to Ahab's son, without justifying Ahab himself.
1Kings	22	14		Micheas son of Jemla: "As the Lord liveth, whatsoever the Lord shall say to me, that will I speak": Lapide: Here is the perfect model of the true prophet — fearless, faithful to God's word alone, willing to suffer imprisonment and the bread and water of tribulation rather than prophesy pleasant falsehoods to a king who prefers sycophancy. Contrast the 400 false prophets who unanimously promise victory.
1Kings	22	19		Micheas' vision — "I saw the Lord sitting on his throne, and all the host of heaven standing by him on the right hand and on the left": Lapide: This was an imaginary prophetic vision, not a literal council of God with angels and demons. By it God shows Ahab that he is being deceived by his false prophets, and that this deception is permitted by God as a just punishment for his impiety.
1Kings	22	22		The spirit of lying in the mouth of the false prophets: Lapide (S. Gregory II Moral.): "It is not right to believe that a good spirit was willing to serve falsehood... but because Ahab from his preceding sins was worthy to be condemned by such deception, permitting license was given to the malignant spirits, that those whom they had strangled willingly in the snare of sin, they might now draw unwillingly to the punishment of sin."
1Kings	22	34		"A certain man bent his bow strongly shooting at a venture, and chanced to strike the king of Israel between the lungs and the stomach": Lapide: "This was accidental with respect to the Syrian soldier, but not with respect to God, who through His Angels directed the arrow so that it would strike no one but the impious Ahab." He draws the parallel with Julian the Apostate, who likewise perished by what appeared a random blow in battle.
1Kings	22	38		"And the dogs licked his blood...according to the word of the Lord": The prophecy of Elijah exactly fulfilled. Lapide: "At the last hour the blood of Ahab was licked by dogs in Samaria — but the prophecy was more completely fulfilled in the killing of his son Joram, whose body Jehu commanded thrown into the field of Naboth, that this prophecy might be fulfilled (IV Kings ix:25-26)."
