book	chapter	verse	latin_incipit	english_translation
Bar	1	0		Synopsis: The opening chapter is the letter of the Jews in Babylon (read in Jerusalem) acknowledging their just punishment and requesting prayers and sacrifices for themselves and for Nabuchodonosor and Baltassar. They send back the Temple vessels and the book of Baruch. Lapide: this act of prayer for the pagan king (v.11-12) is one of the earliest examples of the command to pray for rulers — fulfilled in the Church's prayer for civil authorities (1 Tim.2:1-2).
Bar	1	1		And these are the words of the book, which Baruch the son of Nerias wrote in Babylon. Lapide's introduction to Baruch: the book is canonical (Council of Trent), though Jerome expressed some reservations. Author = Baruch, Jeremiah's scribe, writing in Babylon after the destruction. The letter was publicly read in Jerusalem and occasioned weeping and fasting. Historical context carefully established from 4 Kgs.24-25 and Jeremiah.
Bar	1	11		And pray for the life of Nabuchodonosor the king of Babylon, and for the life of Baltassar his son, that their days may be as the days of heaven above the earth. Prayer for the pagan king's long life — a remarkable act of submission and charity toward the enemy. Lapide: the Jews pray for their captors because their own welfare depends on the kingdom's stability (Jer.29:7: 'Seek the peace of the city to which I have sent you, and pray to the Lord for it'). Applied to the Christian obligation to pray for civil rulers, even unjust ones.
Bar	1	15		And you shall say: To the Lord our God belongeth justice, but to us confusion of our face: as it is this day to all Juda, and to the inhabitants of Jerusalem. The confession of divine justice and human guilt — the moral center of the book. 'To God belongs justice; to us the shame of face.' This is the proper disposition before God's judgment: acknowledging that all His punishments are deserved.
Bar	2	0		Synopsis: Continuation of confession: God has fulfilled the curses of Deuteronomy 28 upon Israel for her sins. Prayer for mercy: God should act for the sake of His holy Name (that it not be profaned among the nations), and because He has promised to restore those who return to Him with all their heart. God will be incarnate to teach wisdom to mankind.
Bar	2	11		And now, O Lord God of Israel, who hast brought thy people out of the land of Egypt with a strong hand, and with signs, and with wonders, and with thy great power, and with a mighty arm. Baruch's prayer appeals to the great Exodus as the ground of confidence in a new liberation. Lapide: the pattern of prayer in Scripture: appeal to God's past acts of salvation as the basis for petitioning His present mercy.
Bar	2	34		I will bring them back into the land which I promised to their fathers Abraham, Isaac, and Jacob, and they shall be masters thereof: and I will multiply them, and they shall not be diminished. God's promise of restoration — the covenant with the Patriarchs is invoked as the unshakeable ground of hope even in exile. Lapide: the covenant promises are permanent; exile is temporary.
Bar	3	0		Synopsis: Wisdom is the theme: God alone possesses wisdom and teaches it to His elect. No great king, no philosopher, no warrior of history was saved without wisdom. The revelation: wisdom is the Book of the Commandments of God, which was given to Israel; ultimately wisdom is the Word made flesh, the Incarnate Son of God.
Bar	3	14		Learn where is wisdom, where is strength, where is understanding: that thou mayest know also where is length of days and life, where is the light of the eyes, and peace. The invitation to seek wisdom: all the components of the good life (long days, sight, peace) are found only in wisdom = the knowledge and love of God. Lapide: this verse is the positive counterpart to the negative warnings against trusting human wisdom. The list of failed wise men (vv.15-23) = Greek philosophers, Persian sages, Canaanite wise men — all perished because they sought natural wisdom without God.
Bar	3	22		Her way hath not been heard of in Chanaan, neither hath she been seen in Theman. The wisdom of the Chaldeans, Canaanites, and Thamanites (Edom's wise men, mocked by Eliphaz in Job) failed because it was merely human. Lapide: natural reason without revelation cannot reach true wisdom; even Aristotle and Plato, the greatest of pagan philosophers, did not attain full wisdom because they lacked supernatural faith.
Bar	3	29		Who hath gone up into heaven, and taken her, and brought her down from the clouds? The transcendence of wisdom — it cannot be reached by human effort. Paul quotes almost identical language in Rom.10:6-8 ('Who shall go up into heaven?'). The answer: God Himself descended to bring wisdom down in the Incarnation.
Bar	3	35		This is our God, and there shall no other be accounted of in comparison of him. He found out all the way of knowledge, and gave it to Jacob his servant, and to Israel his beloved. The climax of the wisdom section: God alone found all the ways of wisdom. He gave it to Jacob = to the Chosen People through the Law, and ultimately to all humanity through Christ.
Bar	3	38		Afterwards he was seen upon earth, and conversed with men. The great Incarnation verse of Baruch — applied by all Fathers to the Incarnation of the Eternal Word: 'Afterwards he was seen upon earth and conversed with men' = Christ, the Wisdom of God, appeared visibly in human form. Lapide cites this as one of the clearest Old Testament prophecies of the Incarnation, alongside Is.7:14 and Mic.5:2. Tertullian, Jerome, Origen, and Chrysostom all apply this verse directly to Christ.
Bar	4	0		Synopsis: Jerusalem is personified as a mourning mother consoling her captive children with the promise of return; she counsels them to pray, confess, and trust in God. The prophet then consoles Jerusalem herself: her children will return, Babylon will be destroyed, God will conduct His people back with joy.
Bar	4	1		This is the book of the commandments of God, and the law, that is for ever: all they that keep it, shall come to life: but they that have forsaken it, to death. The Law as the Book of Life vs. death: keeping it = life; forsaking it = death. Lapide: in its fullest sense, this 'law' is the New Law given by Christ — 'the book of the commandments of God' is the New Testament perfecting the Old.
Bar	4	5		Be of good comfort, my people, the memorial of Israel. Despite the exile, Israel must take courage: they are God's memorial — His chosen witness in the world. Lapide: the Church, like Israel, is a 'memorial' of God's saving acts, continuously proclaiming His covenant through liturgy and sacrament.
Bar	4	21		Be of good cheer, my children, cry to the Lord, and he will deliver you out of the hand of the princes your enemies. Jerusalem's counsel to her children in exile: pray, and deliverance will come. Lapide: prayer is the first and principal weapon of the afflicted. The 'princes' who enslaved them will themselves be enslaved (v.25: 'he that led you away shall be led away').
Bar	4	30		Be of good cheer, O Jerusalem: for he that gave thee this name, will comfort thee. God who named Jerusalem (= 'city of peace' / 'vision of peace') will fulfill the name He gave it — restoring peace after desolation. Lapide: the name of the city contains the promise of its ultimate destiny; allegorically, the heavenly Jerusalem (named 'vision of peace') will receive all her exiled children.
Bar	5	0		Synopsis: Jerusalem is commanded to put on the vestments of glory and beauty: God will level the mountains and fill the valleys to make a smooth royal road for the return of her children from the east. Allegorically (Lyranus and Hugo): the glory, liberation, and honor obtained by Christ for the Church.
Bar	5	1		Put off, O Jerusalem, the garment of thy mourning and affliction, and put on the beauty of the glory that thou hast from God for ever. The exchange of mourning garments for glory-vestments = the transition from exile to restoration. Lapide: allegorically, this is the soul's exchange of the garment of sin for the garment of baptismal grace; the Church's exchange of her age-long persecution for the glory of the final triumph.
Bar	5	4		For God hath shewn thy splendour to every nation that is under heaven. For the name of God shall be named to thee for evermore: the peace of justice, and honour of piety. The glorification of the new Jerusalem as the home of justice and piety — the Church named with God's own peace and honor. Lapide: the name 'peace of justice' = God's peace through Christ's justice (redemption), given to the Church.
Bar	5	5		Arise, O Jerusalem, and stand on high: and look about towards the east, and behold thy children gathered together from the rising to the setting sun, by the word of the Holy One. Jerusalem standing on a high hill to see her children returning from all directions = the Church's vision of the universal gathering of the elect. 'The word of the Holy One' (jussio Sancti) = the prophetic command that gathers all nations to the Church.
Bar	5	7		For God hath brought down the high mountains, and the long hills, and hath filled up the valleys to make the ground level: that Israel may walk diligently to the honour of God. The leveling of mountains and filling of valleys for the return = echoing Is.40:4 (John the Baptist's preparatory work). Lapide: the mountains of pride and the valleys of humility are both leveled to create the royal road of the Gospel; applied to baptism which removes all obstacles to God's approach.
Bar	6	0		Synopsis: The Epistle of Jeremy (traditionally ch.6 of Baruch in Catholic canon). Jeremiah's anti-idolatry letter to the Jews about to be taken to Babylon: 'you will see gods of gold, silver, and wood, carried on shoulders.' A satirical proof that idols are not gods: their material, craftsmanship, shameful treatment, impotence, and utter uselessness demonstrate their nothingness. Daniel 3 and the Three Youths (who refused to worship Nabuchodonosor's statue) are said by Tertullian to have been strengthened by this very letter.
Bar	6	3		And when you shall see in Babylon a multitude adoring them, say you in your hearts: thou oughtest to be adored, O Lord. The right response to witnessing idolatry: interior adoration of the true God. Lapide: the Christian surrounded by false worship must maintain interior worship and, when possible, bear witness by refusal to participate.
Bar	6	17		As a vessel that a man useth is worth nothing when it is broken: even so are their gods, when they are set up in their temples. The idol as a broken vessel: once cracked or fallen, it is thrown away — proving it has no real divinity. A divine being cannot be damaged, sold, looted, or replaced. Lapide cites numerous historical examples of idols being looted and destroyed, none of which ever defended itself.
Bar	6	26		Women with cords about them, sit in the ways, burning bran for perfume: but if any of them, drawn by some passenger, sleep with him, she upbraideth her neighbour, that she was not thought as worthy as herself, and was not girt with a cord as she was. The temple prostitutes of Babylon — one of the most vivid descriptions of pagan degradation in the canonical books. Lapide gives a careful anthropological treatment: the custom of Babylon's sacred prostitution (documented by Herodotus, Strabo) as the extreme of religious degradation. Applied as a warning against confusing sacred and profane love.
Bar	6	36		For fire sent from the Chaldeans burning the house of their gods, they themselves fly away, and escape from the midst of them, but the gods remain in the fire as beams. When the idols' own temples burn, the priests flee to save themselves — the idols do nothing. Lapide: the ultimate test of divinity is the ability to protect oneself and one's worshippers; the idols fail spectacularly.
Bar	6	43		They cannot verify their own promise: let them not be taken for gods. The idol cannot fulfill a vow made to it, cannot give an oracle, cannot communicate in any way — the test of divine personality. Lapide: the living God speaks, fulfills promises, and communicates personally through prophecy, Scripture, and grace; the idols are definitively mute.
Bar	6	65		For fire, and wind, and swift air, and the circle of stars, and great water, and the sun and moon, are good, if one think that they are gods, they will obey him not. Even the natural elements are better servants of God than the idols are servants of their worshippers: at least fire warms, water refreshes, wind blows — but idols do nothing at all. Lapide: the 'worship' of natural forces (Stoic pantheism) is at least partially comprehensible; the worship of man-made statues is utterly irrational.
Bar	6	72		By what reason therefore is it to be thought, or to be said, that they are gods? The rhetorical conclusion of the Epistle: no rational ground exists for calling idols gods. Lapide summarizes the eight arguments of the Epistle against idolatry: (1) material nature, (2) craftsmanship, (3) shameful treatment, (4) need for guards, (5) fear of thieves, (6) impotence, (7) helplessness in fire, (8) uselessness in agriculture and judgment. The Epistle serves as the model for all subsequent Christian apologetics against polytheism.
