book	chapter	verse	latin_incipit	english_translation
2Mc	12	37	Judas vero linguis	And Judas, with the Hebrew tongue, calling upon the war-cry with hymns, and putting Gorgias's men to flight, took the spoils. This prayer in Hebrew is noted by Lapide as significant: Judas raised his battle-cry not in Greek or any other language but in the sacred tongue of Moses and the prophets, invoking God in the covenant language.
2Mc	12	38	Et assumpta inde Judas	And Judas, gathering together his army, came to the city of Odollam. There the soldiers observed the Sabbath — their rest and purification day. On the following day, collecting the bodies of the fallen, they discovered under their garments sacred idols of the Jamnians, forbidden by the law (Deuteronomy 7:25). This violation of the law was clearly the cause of their death, as Judas and all the people recognized.
2Mc	12	39	Altera autem die	But the day following, Judas came with his company, to take up the bodies of them that were slain. The bodies were taken up with honour and buried in the sepulchres of their fathers. Then Judas and all the people made prayers, beseeching that the sin that had been committed might be wholly blotted out.
2Mc	12	40	Invenerunt autem sub tunicis	And they found under the coats of the slain some of the donaries of the idols of Jamnia, which the law forbids to the Jews. The idols were votive offerings or tokens of the idol-worship which these soldiers had secretly practised — a violation of the first commandment, for which they had died in battle. Lapide draws the moral: the hidden sins of individuals bring ruin not only on themselves but on their companions and their cause.
2Mc	12	42	Et conversionem in bonum	And so betaking themselves to prayers, they besought the Lord that the sin committed might be forgotten. The community prayed that God would forgive the sin committed and blot it out from his memory. Lapide notes: this is the entire community taking responsibility for the sins of individual members — the corporate nature of the covenant community, in which the sins of members affect the whole.
2Mc	12	43	Collecta autem pecunia	And making a gathering, he sent twelve thousand drachmas of silver to Jerusalem for sacrifice to be offered for the sins of the dead. This is one of the most important passages in the entire Bible for the doctrine of Purgatory and prayers for the dead. Judas — acting as a faithful leader and pious Israelite — collected money and sent it to Jerusalem to have expiatory sacrifices offered for the souls of the fallen soldiers. This presupposes: (1) that the dead had sinned; (2) that their souls still exist and can be helped by the prayers and sacrifices of the living; (3) that God can remit punishment due to sins even after death. These three propositions together constitute the doctrine of Purgatory.
2Mc	12	44	Si enim non speraret	For if he had not hoped that they that were slain should rise again, it would have seemed superfluous and vain to pray for the dead. Lapide develops this argument for the resurrection at great length. The argument from Judas's practice is: if the dead do not rise again, prayers and sacrifices for them are superfluous; but Judas (who firmly believed in the resurrection) offered sacrifices for them; therefore he expected that, through this expiation, when they rise again they will be purified and will receive a glorious resurrection rather than a shameful one.
2Mc	12	45	Et quia considerabat	And because he considered that they who had fallen asleep with godliness had great grace laid up for them. Lapide addresses the Protestant objection: these men died in mortal sin (because they were secretly worshipping idols), so how can they be in the state of grace necessary to benefit from prayers? Lapide responds: they may have repented in their final moments and obtained forgiveness of the mortal sin, while still owing temporal punishment for it — which is exactly what Purgatory is. Alternatively, their sin of having the forbidden idols may not have been mortal (since they may not have worshipped them, but merely kept them as lucky charms through ignorance or superstition), so they died in a state of grace but with venial sin or temporal punishment still due. Either way, Judas's prayer for them is efficacious through the doctrine of Purgatory.
2Mc	12	46	Sancta ergo et salubris est	It is therefore a holy and wholesome thought to pray for the dead, that they may be loosed from sins. This verse is the key locus classicus for the Catholic doctrine of Purgatory and prayers for the dead. Lapide gives it the fullest possible treatment. The authority of this verse for the dogma of Purgatory is supreme: (1) it is Holy Scripture, therefore certainly true; (2) it affirms the practice of praying for the dead; (3) it affirms this practice is holy and wholesome; (4) it affirms the purpose of such prayer is the remission of sins of the dead. Against this, the Protestant objection (that the book is not canonical) is refuted: it is canonical by the Council of Trent and had been received as such in the Church from the earliest times, as Lapide documents with citations from Origen, Tertullian, Cyprian, Ambrose, Augustine, Jerome, Chrysostom, Gregory the Great, and many later Fathers and councils. The Council of Trent (Session XXV, De Purgatorio) explicitly cited this verse as one of the scriptural foundations of the doctrine of Purgatory.
2Mc	13	1	Anno centesimo quadragesimo nono	In the year one hundred and forty-nine, Judas was informed that Antiochus Eupator was coming with a great multitude against Judea. This chapter (notes Lapide) should be collocated in the chronological order alongside Book I, chapter 6, verse 28, since both accounts narrate the same campaign. The difference in narration between the two books shows that they had different authors, as is evident from their different styles and emphases.
2Mc	13	2	Peditum centum decem millia	A hundred and ten thousand footmen and five thousand horsemen and twenty-two elephants. Lapide notes the discrepancy with 1 Maccabees 6:30 which gives one hundred thousand footmen and twenty thousand horsemen and thirty-two elephants. He explains: on various days the number of forces varied — some arrived, others were dismissed; hence at different times the numbers were different, and both accounts are truthful.
2Mc	13	3	Commiscuit autem se illis	But with these also joined Menelaus, who promised the king many good things. Menelaus, the pseudopontifex appointed by Antiochus Epiphanes, joined Eupator's campaign against Judas, petitioning the king to confirm his pontificate. See what was said at chapter 4:23 and the last verse of that chapter.
2Mc	13	4	Sed rex regum suscitavit	But the King of kings stirred up the mind of Antiochus against the sinner, and upon Lysias suggesting that Menelaus was the cause of all evils, he commanded him to be apprehended and put to death. God the King of kings — who rules the hearts of kings (Proverbs 21:1: \"The heart of the king is in the hand of the Lord; whithersoever he will he shall turn it\") — inflamed Antiochus Eupator against Menelaus the apostate and traitor, so that in his anger he punished him as he deserved. Lysias had explained to the king that all the seditions and wars which the Jews waged against Antiochus were caused by Menelaus the pseudopontifex, whom the Jews, unable to tolerate his insolence and sacrilege, refused to accept (so Josephus).
2Mc	13	5	Erat autem in eodem loco turris	But there was in that place a tower fifty cubits high, full of ashes, and it had a round machine on all sides hanging steeply down into the ashes. This mechanism for execution by suffocation in ashes was invented by Darius Ochus king of the Persians as a way of punishing conspirators without breaking the oath he had sworn not to kill them with the sword (Valerius Maximus IX, iii; Ovid, Ibis). Thus Menelaus, who deserved to be plunged and buried in the ashes of the desecrated altar of God because he had scattered and contaminated its sacred ashes with his sacrileges (as is expressly stated at verse 8), was by the just retribution of divine providence condemned to be suffocated and buried in profane ashes.
2Mc	13	6	Inde in cinerem dejici jussit	The sacrilegious man he commanded to be thrown down into the ashes. See here the just and fitting penalty of retaliation inflicted on Menelaus by God the avenger: he was buried and smothered in profane ashes, because he had scattered and contaminated the sacred ashes of God's altar with his sacrileges. Thus divine justice makes the instrument of the crime also the instrument of the punishment.
2Mc	13	9	Sed rex mente effrenatus	But the king, his mind being full of rage, was coming on against the Jews with the purpose of showing himself more cruel than his father (Antiochus Epiphanes, most cruel of all). Lapide notes: Eupator threatened to surpass even his father in cruelty against the Jews — but was thwarted by Judas's victories and by divine intervention.
2Mc	13	10	Quibus Judas cognitis praecepit	Judas, knowing of this, commanded the people to call upon the Lord day and night; that as always he had helped them, so now also he would help them. Three days and nights of continuous public litany — a triduanum of prayer and fasting. Lapide: here is the origin and prototype of the public litany and continuous prayer, day and night, for forty or even seventy-two hours. These were the spiritual weapons of Judas, with which he always triumphed over his enemies.
2Mc	13	14	Dans itaque potestatem omnium Deo	Therefore giving all power to God, and exhorting his men to fight manfully, and to give their lives for their laws and their country, he fell upon the camp of Antiochus by night. Judas committed himself and his people to God as to the Lord of all, resigning themselves to his good pleasure, and then attacked Antiochus's camp at night — either to conquer or to die as God willed. The watchword he gave his men was \"God the victor\" or \"God the helper\" — as was his custom (cf. chapter 8:23; 15:17).
2Mc	13	18	Et dato signo suis Dei victurus	Giving his men the watchword, God will give the victory. Judas gave his soldiers this military watchword or tessera: \"God the victor,\" or \"God's victory,\" or \"God the helper.\" This was his customary sign before battle, serving both as an omen and as the cause of victory — as is evident from chapter 8, verse 23. Under this sign, leading God, Judas immediately cut down four thousand enemies and terrified the rest with dread of death.
2Mc	13	19	Bethsurae, etc., castra admovebat	He moved his camp against Bethsura; but it was being forced back, it was diminished. Vatablus translates: he was being worn down, both by famine and by diseases and by the arms of the besieged Jews and those of Judas who kept falling upon him unexpectedly. Bethsura was the most strongly fortified stronghold in all of Judea (Josephus XIII, ix: \"Bethsura was the most fortified place in all of Judea\"), situated on a rock to the south of Jerusalem, five stadia away, to defend against the incursions of the Idumaeans and other enemies.
2Mc	13	21	Enuntiavit autem mysteria hostibus Rhodocus	But Rhodocus, from the army of the Jews, disclosed their secrets to the enemies. Salianus plausibly surmises that these \"mysteries\" (secrets) were the hidden paths by which provisions were secretly conveyed to the garrison of Bethsura — which the perfidious Rhodocus revealed to the enemies, intending to defect to them. When this was discovered, he was sought out, found, and cast into prison. This is inferred from the following verse.
2Mc	13	22	Iterum rex sermonem habuit	The king again held parley with them that were in Bethsura; he gave them his right hand, received theirs, departed. The king first addressed the soldiers of Bethsura to persuade them to surrender; being repulsed (since Judas was supplying the besieged through secret paths), he tried again after Rhodocus the traitor had revealed and blocked those paths; and this time the soldiers, already suffering from famine, were induced to surrender.
2Mc	13	23	Commisit cum Juda; superatus est	He engaged in combat with Judas; he was overcome. Antiochus, having taken Bethsura, proceeded to neighbouring Jerusalem; but there he was repulsed and defeated by Judas (see 1 Maccabees 6:54). Thus Sanchez, though Salianus refers this to the four thousand cut down in Antiochus's camp by Judas at night (verse 15).
2Mc	13	24	Machabium amplexatus est	He embraced Maccabeus and made him commander and chief from Ptolemais as far as the Gerrenians. The Greek says: \"He left Judas as military commander from Ptolemais as far as the principality of the Gerrheni, that he should administer those regions in Antiochus's name as a kind of viceroy.\" Lapide notes: this is a remarkable outcome — Judas, who had been hunted as a rebel, now received from the king himself a formal commission as commander and viceroy over a vast territory.
2Mc	13	25	Ut autem venit Ptolemaidam	When he came to Ptolemais, the people of Ptolemais were indignant at the treaties, being very angry, and wishing that the terms might be broken. The people of Ptolemais were angry at Antiochus's concessions to the Jews, fearing either that the now-stronger Jews would become insolent, break the peace treaty, and attack them and neighbouring regions as former subjects of Judas; or that the Ptolemaeans themselves, as subjects now of Judas the viceroy, would be compelled to join his rebellion against the king. For the Ptolemaeans were ancient enemies of the Jews, as is evident from the fact that they had treacherously captured and killed Jonathan, Judas's brother (1 Maccabees 12:48).
2Mc	13	26	Tunc ascendit Lysias tribunal	Then Lysias mounted the tribunal, and made the best defence he could, and having persuaded them, returned to Antioch. Lysias mounted the tribunal — a raised platform from which he could be seen and heard by all — and explained why the peace treaty had been concluded with Judas and the Jews (namely, because it was expedient for the king and for the Ptolemaeans themselves to cultivate peace with the Jews as very brave, most fortunate, most just, and most faithful men), thus calming the tumultuous crowd. So the expedition of the king proceeded and returned in this manner.
2Mc	14	1	Post triennii vero spatium	After the space of three years, Judas and they that were with him received information that Demetrius the son of Seleucus, entering by the port of Tripoli with a powerful army and a fleet. Demetrius I Soter, son of Seleucus IV Philopator, was the rightful heir to the Syrian throne; his uncle Antiochus Epiphanes had seized the kingdom while Demetrius was held hostage at Rome (see 1 Maccabees 7:1). He escaped from Rome, landed at Tripoli in Syria, and seized the kingdom, killing both Eupator and Lysias. Lapide narrates the political history at length, explaining how Demetrius was the nephew-claimant and why the Romans had refused him permission to leave Rome.
2Mc	14	3	Alcimus autem qui fuerat summus sacerdos	But Alcimus, who had been the high priest, and had voluntarily defiled himself in the time of mixing with the Gentiles. On this Alcimus the pseudopontifex and traitor, Lapide refers to Book I, chapter 7, verse 7. He had voluntarily been contaminated in the time of the commingling (when Antiochus Epiphanes commanded the Jews to mingle with the Gentiles and apostatize from Judaism to Gentilism), and at that time Alcimus apostatized. Consequently, he was excluded from the temple by the Jews as an apostate, and Judas Maccabeus functioning as pontiff and ruler would not in any way tolerate Alcimus as a rival. Alcimus therefore petitioned Demetrius to send Nicanor against Judas and confer the pontificate upon himself.
2Mc	14	4	Offerens ei coronam auream	Bringing to him (Demetrius) a golden crown and a palm. The golden crown was with which he congratulated the new king Demetrius on his new kingdom. The palm was with which he wished him victory against Judas and other enemies. And branches from the olive tree, with which he was begging for peace — for the olive is the symbol of peace; but this sacrilegious man had taken these branches from the temple.
2Mc	14	6	Ipsi qui dicuntur Assidaei	Those who are called Assideans, whose leader is Judas Maccabeus. Hence it is clear that Judas was by religion and piety an Assidaean — indeed the chief and leader of the Assidaeans. On who the Assidaeans were, Lapide refers to his treatment in Book I, chapter 7, verse 13.
2Mc	14	18	Nicanor tamen audiens virtutem	Nicanor, however, hearing of the courage of the men of Judas, and the great bravery they had shown in fighting for their country, was afraid to try the matter by the sword. He feared to fight Judas in pitched battle and be defeated and cut down; therefore he sent ambassadors for the purpose of making peace, and made peace with him.
2Mc	14	24	Habebat autem Judam semper	But he always had Judas in high estimation, and was inclined towards the man. The Greek says ἐκ προσώπου, \"in the face,\" meaning Nicanor always had Judas before his eyes as a friend and familiar. Others interpret the Greek contrarily: Nicanor outwardly simulated friendship for Judas, but inwardly hated him as a most formidable military leader whom he could not equal; therefore he persuaded him to take a wife so that through her he might become effeminate and lay down his martial spirit — as Samson was effeminated and deprived of his strength by his Delilah. But this contrary sense conflicts with the Vulgate, which says: \"He had Judas dear from his heart.\"
2Mc	14	25	Rogavitque eum uxorem ducere	And he requested him to take a wife, and to have children. So that he might beget offspring like himself, and transfuse his strength and martial virtue into them; for as the lyric poet (Horace, IV Carm. ode iv) says: \"The brave are born of the brave and good. / In steers and steeds is found the blood / of sires; the fierce eagle does not breed / the unwarlike dove.\" Gorionides adds that Judas from his wife fathered a male son; but he seems to have died soon, like Judas himself who fell in battle the following year; for no mention of his son appears in Scripture.
2Mc	14	26	Alcimus autem videns	But Alcimus, seeing the favour shown to Judas, and the covenant that had been made, came to Demetrius, and told him that Nicanor was designing things against the state, for he had appointed Judas, a traitor to his kingdom, to be his successor. Alcimus, envious of the friendship between Judas and Nicanor, accused Nicanor to King Demetrius. The king, angered, commanded Nicanor to capture Judas and send him to him as a prisoner. Demetrius then sent Nicanor a harsh letter commanding him to take Judas captive; Nicanor, upon receiving this letter, was troubled and grieved to violate the treaty he had made with Judas.
2Mc	14	31	Fortiter a viro preventum	Generously anticipated by the man (Judas). The Greek has \"generously\" — for it is the mark of a noble man prudently to foresee future plots and perils, to guard against them, and to place himself and his affairs in safety, as Judas did here.
2Mc	14	37	Razias autem quidam de senioribus	But one Razias, one of the ancients of Jerusalem (that is, one of the senators and chief men of Jerusalem), who for his great affection towards them was called the father of the Jews. On this verse Lapide begins one of his longest discussions in the commentary on 2 Maccabees — concerning the suicide of Razias and its moral evaluation.
2Mc	14	38	Hic multis temporibus continentiae	This man, in the times of the commingling, had kept his purpose of continency in Judaism. \"Continency\" means either continence in the strict sense (celibacy), or more probably continency in the true faith and worship of God — that is, Razias always maintained himself in Judaism and ancestral religion, and had not commixed with the many who apostatized under Epiphanes. This is the meaning of the Greek ἁγνισμοῦ (incommixtionis) — persevering constancy even unto death in Judaism.
2Mc	14	40	Putabat enim si illum decepisset	For he thought, if he had seized him, he would have inflicted great punishment on him. Salianus considers we should read \"cepisset\" (had captured him); for the Greek says εἰ αὐτόν, meaning \"if he had captured him.\"
2Mc	14	42	Eligens nobiliter mori potius	Choosing rather to die nobly, than to fall into the hands of the wicked, and to suffer abuses unworthy of his noble birth — for Razias was born of noble parents. The Greek says: \"And be treated with unworthy indignities, contrary to his own nobility.\" This was the intention of Razias, as it was that of other nobles of this world, who consider it more noble to die than to suffer unworthy mockery. But the sense of the faithful and Christians — especially Apostles and martyrs — is different: \"They went from the presence of the council, rejoicing that they were counted worthy to suffer reproach for the name of Jesus\" (Acts 5:41).
2Mc	14	44	Venit per mediam cervicem	He fell through the middle of his neck. The Greek says through the middle of his belly — that is, he fell upon the ground not headlong but on his belly, so that the middle of his neck struck the ground. Thus Razias killed himself three times: first he stabbed himself with a sword; second, he threw himself from the wall; third, he cast his bowels with both hands into the crowd.
2Mc	15	1	Nicanor autem ut comperit	Nicanor, having received intelligence that Judas was in the places of Samaria, thought to set on him in perfect security upon the Sabbath day. Nicanor presumed that the Jews by reason of the religious repose of the Sabbath commanded by God would not fight on that day, but would allow themselves to be slaughtered.
2Mc	15	5	At ille ait et ego potens sum	But he said: And I am mighty upon the earth, who command arms to be taken up, and affairs of the king to be dispatched. Nevertheless he did not accomplish his purpose. Lapide comments: see here the blasphemous act of Nicanor, by which he equates himself with God — as if to say: God rules in his heaven; but I rule on earth, and command you, O Jews whom I have forced to follow my camp, to fight on the Sabbath against Judas and the Jews your kinsmen. His blasphemous self-assertion stirred the anger both of the Jews in his camp (who refused to obey) and of God, who inflamed Nicanor's anger so that he was cut down, decapitated, and hanged by Judas. Similar arrogance is displayed by Mezentius the atheist in Virgil (Aeneid X): \"My right hand is my God, and the spear I hurl\" — and by Capeneus in Statius (Thebaid II and X).
2Mc	15	9	Et allocutus eos de Lege et Prophetis	And allocuting them from the Law and the Prophets, and putting them in mind of the battles they had fought before, he made them more prompt. That is, citing sentences from Sacred Scripture by which God promises certain triumph to those who rightly worship and invoke him (Deuteronomy 26 and elsewhere). Bringing to their mind the victories God had already given them, Judas both established in them the firm hope of victory and increased their military ardour.
2Mc	15	11	Singulos autem illorum armavit	But he armed each one of them, not with protection of shield and lance, but with the best speeches and exhortations, and the telling of a trustworthy dream, through which he made all glad. \"A trustworthy dream\" — the Greek has ὅναρ (somnium = a dream) but another reading has ὅρασις (= true vision, which was not so much a dream as truth itself). So Homer (Iliad XV) writes: \"not an empty and false dream but a solid and true one.\" This allows the opinion that Judas truly saw with his eyes Onias and Jeremias, and truly received from him the golden sword — but Lapide regards this as untrue; it was an imaginary vision during sleep, signified by the word ὄναρ (somnium); and if he had truly received a real sword, he would have shown it to his companions to animate them, which Scripture does not record. Thus Sanchez.
2Mc	15	12	Erat autem hujuscemodi visus	Now the vision was in this manner: Onias, who had been high priest, a good and virtuous man, modest in his looks, gentle in his manners, beautiful in speech, and who from a child was exercised in virtues, stretching forth his hands, prayed for all the people of the Jews. Onias, who was known to Judas from his face and appearance, is seen in his dream praying with extended hands. Onias had been high priest eleven years before, extruded by his brother Jason who purchased the pontificate from Antiochus Epiphanes, and later murdered by Andronicus at the instigation of Menelaus (chapter 4:34). Question: do the souls in Purgatory pray for us? Lapide cites those who affirm (Richardus, Gabriel, Medina) and those who deny (St. Thomas, Alensis, Abulensis, St. Antoninus, Sylvester, Navarrus). He concludes with Suarez (De Oratione in communi I, cap. x, near end): if anyone invokes souls in Purgatory, piously believing they hear him, he does not sin, because he acts from pious credulity and affection, and exposes himself to no danger; because if perhaps it is otherwise and those souls do not receive such prayers, nonetheless his prayer will return into his own bosom. And perhaps it is even true that those souls, at least when they become blessed, know all the prayers directed to them throughout the whole time they were in Purgatory, and are moved thereby to intercede for those who prayed for them.
2Mc	15	13	Post hoc apparuisse et alium	After this there appeared also another man, admirable for age and glory, and surrounded by great beauty and majesty. Judas did not recognise Jeremias, since the prophet had died four hundred years before; he therefore asked Onias (known to him) who that august and venerable man was; and Onias answered.
