book	chapter	verse	latin_incipit	english_translation
2Mc	1	1	[OCR-FAIL — opening]	[OCR-FAIL] Commentary on vv. 1–11 is unrecoverable. Only two garbled lines precede verse 12; Lapide's exposition on the two letters (vv. 1–9 and 10–11) has not survived legibly in this OCR transcription. The file begins directly at the commentary on verse 12.
2Mc	1	12	Ipse enim ebullire fecit	God made those who fought against us and the holy city to boil forth from Persia. This verse is difficult; the words \"from Persia\" do not appear at this point in the Greek but at the end: \"He made those who fought against us boil forth into Persia.\" Salianus proposes reading \"into Persia,\" meaning God caused Sidetes to rush into Persia with vast armies — but this does not fit well with what follows. Lapide therefore explains \"ebullire\" (Greek ekballein) with three meanings: (1) the vast numbers and ardour of Sidetes' troops who boiled forth like mushrooms from the waters of Syria and Persia; (2) that they were killed in Persia in great numbers, like flies and frogs born from water and drowned in the same; (3) that Persia expelled their corpses as the sea spews cadavers upon the shore.
2Mc	1	13	Nam cum in Perside esset	For when the leader himself was in Persia, and with him an immense army, they fell in the temple of Nanea. Secular historians disagree about the death of Antiochus Sidetes: Josephus and Justin say he was killed in battle by the Parthians; Appian says he killed himself after defeat; Aelian says he threw himself headlong; Eusebius says Arsaces the Parthian killed him; others say his brother Demetrius did it. Their very disagreement shows they had no certain knowledge and trusted false rumours. We must believe Holy Scripture, which here asserts that Sidetes, wishing to plunder the temple of Nanea, was stoned by the priests and killed. Scaliger's claim that Antiochus escaped and returned safely to Antioch must be rejected.
2Mc	1	14	Etenim cum ea habitaturus	Antiochus came to the place of Nanea, as if to dwell with her, and with his companions, in order to receive a great sum of money as a dowry. He feigned to contract a marriage with the goddess Nanea to plunder her temple under the pretext of receiving a dowry. But the priests, scenting the fraud, gave him a dowry not of money but of stones — that is, they stoned and killed him. Certain ancient kings boasted of contracting marriages with goddesses: Antony was said to have betrothed Minerva; Antiochus Gryphus called himself husband of the moon; Numa claimed Egeria; Anchises Venus; Heliogabalus Urania; Peleus Thetis (Seneca, Justin, Plutarch, Suetonius).
2Mc	1	15	Cumque proposuissent sacerdotes	When the priests of Nanea had offered to give him the money as a dowry, and he himself with a few had entered within the precinct of the temple — as though to celebrate the sacred nuptial rites — they shut the temple. The priests lured Antiochus inside, then locked the doors and took their vengeance from a hidden opening.
2Mc	1	16	Cum intrasset Antiochus	When Antiochus had entered, and a secret opening of the temple had been opened, they cast stones and struck down the leader, cut him limb from limb, and having cut off his head, threw him outside. The hidden opening was in the upper panelled ceiling or in the temple walls. The priests scattered Sidetes' body parts among his soldiers, claiming that some rival god had struck him down, so that they themselves would not be slain by his troops as the authors of his death — which also explains why so many varying accounts of his death circulated in the world.
2Mc	1	18	Facturi igitur quinta et	As we are about to celebrate the purification of the temple on the twenty-fifth day of Casleu, we thought it necessary to inform you, that you too may celebrate the feast of Scenopegia, and of the fire given by God. The feast of Encaenia (Hanukkah) on 25 Casleu was in memory of the purification and new dedication of the temple by Judas Maccabeus (1 Maccabees 4:52). On that same day, when sacrifices were offered, a sacred fire was sent by God from heaven to consume them; so a feast of the \"given fire\" was established, celebrated either on 25 Casleu or the following day. Without this fire, Judas could not sacrifice, since the Law forbade common fire (Leviticus 6:12); God therefore had to restore it.
2Mc	1	20	Ut mitteretur Nehemias	When Nehemiah was sent by the king of Persia. Nehemiah was sent three times to Judea: first by Cyrus, with Zerubbabel (1 Esdras 2:2); second by Artaxerxes Longimanus in his twentieth year (Nehemiah 2:1); third by the same Artaxerxes in his thirty-second year (Nehemiah, last chapter). Ribera (De Templo V, xvii) plausibly applies the fire to the second mission; but more probably it occurred at the first mission, in the sixth year of Darius Hystaspis on the third of Adar (Esdras 6:15–16), when the new temple was completed and solemnly dedicated with many victims. At that time the heavenly sacred fire was given to consume the victims, as commanded by Leviticus 6:12. Nehemiah rather than Zerubbabel or Ezra is credited with this on account of his pre-eminent religious zeal, his nobility as leader of the returning exiles, and his great honour before Artaxerxes.
2Mc	1	21	Et sacrificia quae imposita	Nehemiah commanded the sacrifices placed on them to be sprinkled with the same water — the aqua crassa, the thick condensed liquid found in the pit where the priests had hidden the sacred fire during the Babylonian captivity. He had it sprinkled over the sacrifices, partly to kindle them, and partly to ignite the stones for future use. Thus Sanchez.
2Mc	1	22	Tempus affuit quo sol	When the sun, which had been clouded, shone out, a great fire was kindled. God appears to have used the sun's rays to draw vapours from the aqua crassa, inflaming them continuously to produce fire — just as comets, wandering stars, will-o'-the-wisps, halos, and fiery dragons are produced in the air by the sun. Tropologically, this fire represents the Holy Spirit, who descended in fire upon the Apostles at Pentecost and inflamed them to set the world ablaze with divine love. St. Ambrose (De Officiis I, xiv): \"That fire was a type of the Holy Spirit, who was to descend after the Lord's Ascension and remit sins, who as fire inflames the faithful soul.\" St. Chrysostom (Hom. 14 in Hebr.): \"Does not fire descend now, far more wonderful than that, raising to heaven what is offered?\"
2Mc	1	23	Jonatha inchoante	Jonathan began — this Jonathan was not the high priest, as some suppose, but a Levite and cantor, the prefect of the choirs, whose turn it then was. So Lyranus and Serarius.
2Mc	1	31	Cum autem consumptum esset	When the sacrifice was consumed — cremated by the fire that flashed from the water in the stones — \"Nehemiah commanded the remaining water to be poured upon the larger stones.\" This was done to ignite those larger stones and infuse them with the power of kindling for later use, as indeed they were used by Judas Maccabeus at the purification of the temple (2 Maccabees 10:3). Thus Sanchez.
2Mc	1	32	Quod ut factum est	When this was done, a flame was kindled from the stones; but it was consumed by the light that shone from the altar. The bright flame that had cremated the victims on the altar, leaping from it, absorbed the flame kindled from the water in the larger stones. Four reasons: (1) a greater light extinguishes and absorbs a lesser; (2) by Leviticus 6:12 the sacred fire must remain on the altar alone; (3) to signify that the fire came forth not by the sun alone but by God, whose symbol was the altar, using the sun as instrument; (4) to infuse in the stones not physical but moral power to produce fire in time of need — which they did at the purification of the temple under Judas Maccabeus. Thus Sanchez.
2Mc	1	33	Renuntiatum est regi Persarum	This was reported to the king of Persia — namely Darius Hystaspis, in whose sixth year these events occurred; or as others hold, Artaxerxes Longimanus, whose cupbearer Nehemiah was.
2Mc	1	34	Considerans autem rex	The king, taking note... Serarius proposes reading \"enclosing\" or \"surrounding\" (conserans); for the Greek is \"surrounding it, he built a temple for it.\" Four interpretations: (1) St. Ambrose: the king built a temple at the spot where the thick water was found and turned to fire, since the Persians worshipped fire as God (Brisson, De regno Persarum II); (2) Genebrard and Bede: the king made some sacred structure, making the formerly profane site sacred; (3) Lyranus: Darius ordered the reconstruction of the Jerusalem temple; (4) Artaxerxes adorned the temple already built by Darius. Lapide favours Ambrose's reading as most natural, since the Persians built fire-temples, and fire as the noblest element is an apt symbol of God: \"Our God is a consuming fire\" (Hebrews 12:29).
2Mc	1	36	Appellavit autem Nehemias	Nehemiah called this place Nephtar, which is interpreted 'purification.' The name derives from the Hebrew/Chaldee/Syriac root pathar = to free, emit, dismiss. Nephtar alludes to naphtha, a kind of bitumen (Pliny, NH II, ccv) which has great kinship with fire and ignites spontaneously on contact — just as the fires leapt into the thick water here for the purification of the temple. Among the ancients, lustration was performed through sulphur and fire. The Syriac text reads \"Genephar, which means cleanliness\"; the Arabic has \"Techeptha, which means purity.\"
2Mc	2	1	Invenitur autem in descriptionibus	It is found in the records of Jeremias the prophet, that he commanded those who were being carried away to take fire. Lapide confirms what was said about the hidden fire from the actual writings of Jeremiah. \"Descriptions\" refers to the journal or commentary in which Jeremiah recorded what he said and did when Jerusalem fell to the Chaldeans — namely: (1) he commanded that the temple fire be hidden in a pit; (2) he exhorted the captives not to be drawn into error by idols; and (3) he took the ark, tabernacle, and altar of incense and hid them in a cave on Mount Nebo. This book of Jeremiah has perished through the ravages of time, along with several others he composed (see Prologue in Jeremiam).
2Mc	2	2	Et dedit illis legem	He gave them the law, that they should not forget the commandments of the Lord, and should not err in their minds, seeing the idols of gold and silver. He gave them a copy of Deuteronomy or the whole Pentateuch to read continually in Babylon, to console themselves, and confirm themselves in the true worship of God. The command \"not to err in minds\" means not to be deceived by the brilliance of gold on idols into thinking there is something of divine majesty in them.
2Mc	2	4	Erat autem in ipsa scriptura	It was in the same writing, how the prophet, warned by God's oracle, commanded that the tabernacle and the ark should accompany him to the mountain where Moses went up and saw God's inheritance. Mount Nebo, where Moses died. Serarius thinks Angels carried the ark after Jeremiah, just as they transported the house of the Blessed Virgin from Palestine to Loreto. St. Epiphanius gives a detailed account: \"Jeremias prayed and caused the rock to swallow up the ark; then marking the rock with his finger he imprinted God's name upon it. The very Lord's name was hidden by cloud so that neither the place can be known nor the name read until the end; by night fire and cloud often appear there, because the glory of the Lord does not cease from his law.\" The ark cannot be found until the resurrection, when Moses the elect prophet will produce it (Epiphanius, Dorotheus).
2Mc	2	7	Quod ignotus erit locus	That the place should be unknown, until God gather together the congregation of the people. Some hold this was fulfilled under Nehemiah, when the people returned. But the stronger and more common view is that the ark, tabernacle, and altar of incense will be revealed at the end of the world when God converts the Jews through Elias and Enoch and gathers them into one Church with the Gentiles. Evidence: (1) if they had been found with the fire, the author would have narrated this as he narrated the fire — he narrates nothing of the kind; (2) the congregation under Nehemiah was incomplete; (3) when the second temple was plundered by Titus, the ark does not appear among the spoils in Josephus, who even states that the Holy of Holies then contained absolutely nothing (Jewish War VI, vi); (4) the universal tradition of Hebrews and of the Fathers (Epiphanius, Dorotheus, Thomas, Lyranus, Dionysius, Bellarmine, Abulensis) affirms the ark was absent from the second temple. The Fathers explain mystically that the ark's absence was because Christ himself — the true ark of the New Testament — was to appear and teach in the temple. See Exodus 25:10.
2Mc	2	8	Et apparebit majestas Domini	The majesty of the Lord will appear, and there will be a cloud. When God reveals the ark, he will simultaneously show his glory in a shining cloud, as he manifested it to Moses and Solomon at the dedication of altar and temple. Mystically, St. Ambrose and Rupert hold Jeremiah's prophecy was fulfilled when Christ — the true ark containing the tablets of the evangelical law and the manna of the Eucharist — showed himself in the temple to the assembled people.
2Mc	2	9	Magnifice enim sapientiam tractabat	Solomon, the wisest of mortals, magnificently exercised wisdom, and as one having wisdom offered the sacrifice of the dedication and completion of the temple. Solomon, most wise, imitated Moses and by prayer obtained that God show his majesty in a glorious cloud in the temple he had built and dedicated (1 Kings 8:10), and so the descent of heavenly fire followed.
2Mc	2	10	Sicut et Moyses orabat	Just as Moses prayed to the Lord and fire came down from heaven and consumed the burnt offering (Leviticus 9:24), so also Solomon prayed and fire came down and consumed the burnt offering. In the same way the heavenly fire descended at the dedications of Nehemiah and of Judas Maccabeus — to which celebration we Jerusalem Jews exhort you Jews in Egypt.
2Mc	2	11	Et dixit Moyses eo quod	Moses said: because it was not eaten, the sin-offering was consumed. Since the sacrifice for sin was unclean (as sin itself is), and had not been eaten by the priests, it was accordingly consumed by the fire. These words are from Leviticus 10:16, continuous with the preceding argument: just as fire consumed the other victims, so also the sin-offerings were consumed. Thus Serarius, Sanchez.
2Mc	2	13	Inferebantur autem in descriptionibus	These same things were also recorded in the descriptions and commentaries of Nehemiah — written in another commentary of Nehemiah now lost through the ravages of time, not in the canonical Book of Esdras-Nehemiah. \"And as he built a library.\" This is the first celebrated Jewish library built by Nehemiah — preceding Alexander the Great, Aristotle, and Ptolemy Philadelphus (who built the famous Alexandrian library) by more than a hundred years. The Jerusalem Jews cite this to compare Nehemiah's library favourably with the Alexandrian library of which the Egyptian Jews were proud: \"You have secular books; we alone have sacred books and the histories of our nation.\"
2Mc	2	14	Similiter autem et Judas	In like manner Judas gathered together all those things that had perished by reason of the war. By \"Judas\" — not Judas Maccabeus (who was occupied in constant wars), but Judas the Essene, the author of this letter and book. Writing in the name of the whole Senate and people, he here speaks of himself in the third person, assuming the persona of the people and Senate.
2Mc	2	17	Deus autem qui liberavit	God who has delivered his people, and has restored the inheritance to all, and the kingdom, and the priesthood, and the sanctuary. God brought it about that all Jews possess the kingdom of Judaea as an inheritance, each recovering his hereditary portion seized by the Antiochi. The priesthood: Jerusalem has its own pontiff and priests. The \"sanctification\": the holy temple with the holy worship of the one true God, purified by Judas Maccabeus (1 Maccabees 4:52).
2Mc	2	20	De Juda vero Machabaeo	Now concerning Judas Maccabeus and his brothers. The narrative of Book II begins here; its argument is the same as Book I (the deeds of Judas and his brothers), but narrated more fully and with many things omitted from Book I added.
2Mc	2	22	Et de illuminationibus quae	And of the illuminations that were made from heaven to those who fought bravely for the Jews. \"Illuminations from heaven\" refers to heavenly signs given on behalf of Judas and his companions who fought for the Jews aided by angels, overthrowing Antiochus's great armies.
2Mc	2	23	Domino cum omni tranquillitate	The Lord being propitious to them with all clemency. God calming the disturbances and tumults which Antiochus had stirred up against the Jews, and restoring their former peace.
2Mc	2	24	Itemque ab Jasone Cyrenaeo	These things which Jason of Cyrene set forth in five books, we have tried to abridge into one volume. Calvin and the innovators object that Jason was a Gentile and so this book is not canonical. Lapide responds: Jason was a Jew living in Cyrene (Jews were scattered throughout the world, Acts 6:9; 11:20). Moreover, even if Jason had been a Gentile, Judas the author — who selected, arranged, and condensed Jason's writings always aided by the Holy Spirit — made this book canonical. The Canon holds: when a canonical author cites and approves sayings of a profane author, by that act he makes them canonical. So St. Paul (Titus 1:12) citing Epimenides: \"The Cretans are always liars,\" and adding \"This testimony is true,\" granted it canonical authority.
2Mc	2	27	Negotium plenum vigiliarum	A task full of watching and sweat. Great labour and industry is required to read many things and compress them all in few words. Lapide cites the man who wrote the Iliad in letters so minute as to fit in a nut-shell (Pliny VII, xxi), and Archimedes who fitted the motions of sun, moon, and five planets into a sphere (Cicero, Tusculanae I). He cites Plutarch at length on the virtue of brevity and laconism.
2Mc	2	29	Veritatem quidem de singulis	Granting the truth of individual things to the authors — that is, to Jason of Cyrene. I Judas set about only to abridge Jason; I therefore ascribe the full truth of details to Jason as a good and exact writer. The Holy Spirit who used me as instrument directed me so that I wrote nothing except what was true, pious, and holy, and omitted or corrected whatever needed correcting in Jason.
2Mc	2	30	Sicut enim novae domus	For as the master builder of a new house must be concerned with the whole building. From the same modesty, Judas compares Jason to the architect of a great building, and himself to a painter who adorns the completed building. It is the historian's work to construct the fabric of history; the abbreviator's work is to adorn it with a brief and well-ordered style.
2Mc	2	31	Etenim intellectum colligere	For indeed to collect the understanding. \"Understanding\" (intellectum) = the argument or subject matter which the historian gathers and sets before the reader to understand. The historian's task is to gather it curiously and narrate each detail minutely.
2Mc	2	32	Exsecutiones rerum vitare	But to avoid the full treatment of things must be left to the abbreviator. The historian investigates and narrates everything minutely; the abbreviator may omit many details and compress much into little. To compress many things into few words is the mark of a great man and a deep intellect.
2Mc	3	1	Igitur cum sancta civitas	When the holy city was inhabited in all peace, and the laws were still well observed, because of the godliness of Onias the high priest and his hatred of wickedness. Onias here is the third of that name, surnamed \"the Holy,\" who held the pontificate immediately before Mattathias (the father of Judas Maccabeus). He was remarkable for piety, peace, and the observance of the divine law. By just divine judgment he was later deprived of the pontificate by his own brother Jesus-Jason the Apostate, who bought it from Antiochus Epiphanes; and Jason in turn was expelled by Menelaus; Menelaus by Lysimachus; Lysimachus by Alcimus; after which Mattathias, elected by the people, legitimately held the pontificate and principate.
2Mc	3	3	Ita ut Seleucus Asiae rex	So that Seleucus king of Asia contributed from his own revenues all the charges belonging to the ministry of the sacrifices. Seleucus Philopator, the elder brother of Antiochus Epiphanes, at the beginning of his reign provided contributions to the temple, but afterwards hearing of the immense treasures in it, overcome by avarice, sent Heliodorus to plunder it — and by just divine judgment was killed by this same Heliodorus. Similar munificence toward the temple was shown by Cyrus, Darius, and Artaxerxes (Esdras 1 and 6; Nehemiah 1), and by Antiochus the Great (Josephus XII, iii).
2Mc	3	4	Simon autem de tribu Benjamin	Simon of the tribe of Benjamin, who was overseer of the temple, strove — the chief priest withstanding him — to effect something evil in the city. Simon was not of the tribe of Levi, and therefore not a priest; only priests presided over sacred affairs. Simon (from the tribe of Benjamin) was appointed overseer of the temple for civil matters — temple estates, revenues, or the soldiers assigned to guard it (1 Maccabees 4:14). \"Something evil\" seems to indicate that Simon was ambitious for the principate or pontificate of Jerusalem — as his brother Menelaus later sought.
2Mc	3	5	Venit ad Apollonium	He went to Apollonius son of Tharseas, who at that time was governor of Celosyria and Phenicia. Simon through Apollonius betrayed to Seleucus the temple treasures; Seleucus promptly sent Heliodorus to seize them. This is the same Apollonius who later battled Jonathan and was defeated by him (1 Maccabees 10:69 ff).
2Mc	3	10	Tunc summus sacerdos ostendit	The high priest told him that there were deposits belonging to widows and orphans. It was customary among Jews, Christians, and pagans alike to deposit precious things in temples as an inviolable and secure asylum. Josephus (Antiquities XIV, vii), Suetonius (Vita Julii Caesaris), and Cicero (De legibus I) all attest this practice. Cicero writes: \"The Athenian Clisthenes entrusted two shrines as a citizen going into exile.\" Ambrose (De Officiis II, xxix) relates his own counsel to the church of Ticinum to preserve a widow's deposit against the Emperor's rescript. Pompey, taking Jerusalem, found two thousand talents deposited in the temple and took nothing; Marcus Crassus took a golden beam.
2Mc	3	11	Quidam vero esse Hircani	But some of the money was Hircanus son of Tobias, a man of great dignity — in dignity and authority; St. Ambrose adds \"and in sanctity.\" This Tobias had married the sister of the high priest Simon II (Josephus XII, iv); his sons later transferred themselves to Antiochus Epiphanes. Total: four hundred silver talents and two hundred gold talents.
2Mc	3	12	Decipi vero eos	But it was altogether impossible that those who had trusted in the sanctity of the place should be deceived. To despoil those who had deposited their funds in the temple trusting its sanctity is entirely illicit and sacrilegious — therefore morally impossible. Such robbery would gravely injure the temple, commit injustice against the depositors, and violate the right of asylum and the wealth of widows and orphans.
2Mc	3	19	Accinctaeque mulieres ciliciis	Women girded with haircloth flocked through the streets; and the virgins who were shut up came forth. Some virgins lived in the temple (among whom the Blessed Virgin lived like an angel after her Presentation until she married Joseph); others were kept at home by their parents for the sake of modesty. Both groups ran to Onias the Pontiff to seek counsel and aid, especially since many had their dowry deposited in the temple — if Heliodorus carried it off, he would take away their food and life.
2Mc	3	25	Apparuit enim illis quidam equus	There appeared to them a horse with a terrible rider, adorned with a very rich covering, and he ran fiercely and struck Heliodorus with his forefeet. This was an angel who assumed the form of a horse and rider so as to oppose Heliodorus the horseman and overthrow him as in a duel. The Greek reads: \"He drove the forefeet against Heliodorus.\" This was not an imaginary vision seen by Heliodorus alone, but a real action before all present — for it says \"appeared to them,\" that is, to all. Similarly, angels appeared to Zechariah (chapter 1) as horses and horsemen, and to St. John (Apocalypse 6). Note: if God so punished Heliodorus who merely attempted to steal temple deposits, how will he punish those who plunder churches, monasteries, and pious foundations and divert their revenues to secular uses?
2Mc	3	26	Alii etiam apparuerunt duo	There appeared also two other young men, beautiful and strong, glorious in comely attire, who stood on either side and scourged him without ceasing with many stripes. The first angel on horseback was as a praetor; the two young men were as officers executing the sentence, scourging the sacrilegious Heliodorus most severely. Hence God does not always punish sinners through demons, but sometimes through good angels. Josephus-Gorionides (VII, i) elaborates: Heliodorus walking through the Holy of Holies heard a violent commotion that could break mountains; all his satellite fled and hid; Heliodorus alone remained, lifted his eyes, and saw a man of most terrible aspect clothed in gold with shining gems, rushing and leaping toward him.
