book	chapter	verse	latin_incipit	english_translation
2Mc	3	32	Considerans autem summus sacerdos	The high priest, fearing lest the king should suspect some mischief had been done to Heliodorus by the Jews, offered a sacrifice of salvation for the recovery of the man. The victim offered was a peace-offering (hostia salutaris), offered by law for the peace and salvation of a person (Leviticus 3).
2Mc	3	35	Heliodorus autem hostia Deo	Heliodorus, after he had offered a sacrifice to God, and made great vows to him who had granted him life, gave thanks to Onias and returned with his army to the king. Gorionides adds that Heliodorus threw himself at the feet of Onias and humbly gave thanks — impelled by gratitude for the life received through Onias.
2Mc	3	36	Testabatur autem omnibus	He testified to all men the works of the great God, which he had seen with his own eyes. Hence it appears that Heliodorus acknowledged the true God of Israel and worshipped him alone. Gorionides asserts that all his soldiers (Macedonians) did likewise. Heliodorus later, seeking the kingdom, treacherously killed Seleucus and made himself king — but was expelled by Antiochus Epiphanes aided by Attalus and Eumenes; hence Antiochus was called Epiphanes (\"illustrious\") because \"he shone out as the champion of the paternal dominion against those who were usurping the kingdom\" (Appian, Syriaca).
2Mc	4	1	Simon ille qui prodiderat	But Simon, who had been the betrayer of the money and his country, spoke ill of Onias, as if he had terrified Heliodorus, and had been the promoter of these evils. The audacity of sycophants and traitors: they dare to accuse innocent men of the very crimes they themselves committed, covering their own villainy with another's guilt. Simon, who had betrayed the treasury to Apollonius and thereby brought Heliodorus and danger upon the city, now accused the innocent Onias of being the real instigator of the trouble.
2Mc	4	3	Pertingente autem simultate	But when the contention grew so violent, that even murders were committed by some of the partisans of Simon… The rivalry between Simon and Onias escalated to bloodshed. Lapide notes: rivalry for ecclesiastical office and honour has always been a root of violence and murder. The history of the pseudo-pontificate of Jason and Menelaus is a supreme example of simony in its most destructive form.
2Mc	4	7	Post hujus mortem cum	After the death of Seleucus, Antiochus, who was called the Noble (Epiphanes), took possession of the kingdom. Antiochus Epiphanes is called \"Nobilis\" (Greek Epiphanes = illustrious) by the Gentiles on account of his deeds, but more truly is called by Polybius and others Epimanes (= mad and insane), as was noted in Book I. His reign brings the great persecution of the Jews.
2Mc	4	8	Promittens Antiocho trecentos	Having promised to the king three hundred and sixty talents of silver, and from some other revenues eighty talents, and besides this, a hundred and fifty if he might have authority to set him up a place for exercise. Jason purchased the high priesthood from Antiochus Epiphanes with a great sum of money — thereby becoming a simoniac pseudopontifex. By just divine judgment he himself was expelled from the pontificate in the same manner: as he had purchased it with money, so Menelaus outbid him, and Jason lost both pontificate and homeland.
2Mc	4	10	Quibus positis more Graecanico	Having obtained these things, and gotten authority over his countrymen, Jason immediately converted his fellow citizens to the manner of the heathens. Jason was the first to introduce Greek customs into Jerusalem — the gymnasium, the ephebate (school for youths), the Greek petasus (hat), and Greek dress. The priesthood and the sacred ministry were then contemned and neglected, while all the young men ran to wrestling-exercises. The petasus was the wide-brimmed hat worn by Greek athletes, here becoming a symbol of apostasy from Jewish customs. This is what the innovators of every age do: under pretence of culture, they introduce pagan customs and cast off the sacred rites and discipline of religion.
2Mc	4	11	Dissolvebatque legitimas civium	And he made void the lawful ordinances of the citizens, and abolished the institutions established according to the law. Jason abolished the privileges granted to the Jews by Antiochus the Great, preserved by John the father of Eupolemus who had conducted the great embassy to Rome for friendship and alliance (1 Maccabees 8:17). One impious man overthrew in a moment what had been gained through long labour and public service.
2Mc	4	13	Tanta autem erat graecizandi	There was such an eager desire of a foreign and Greek mode of life, and an admission of foreign customs. The youth were so inflamed with desire for Greek customs that even the priests neglected their duties at the altar, despised the divine ministry, and hastened to the wrestling-floor. Lapide warns: when the guardians of religion are themselves corrupted by worldly fashions and pleasures, the whole people follow into ruin.
2Mc	4	23	Post triennii vero spatium	After the space of three years, Jason sent Menelaus…to carry the money to the king and to conduct the negotiations about necessary affairs. Menelaus, sent by Jason to pay tribute money to Antiochus, used the opportunity to outbid Jason and purchase the high priesthood for himself with a larger sum — thus driving out Jason. This is the classic pattern of simony: one simoniac displaced by a greater simoniac. Menelaus was not even of the priestly tribe (he was of the tribe of Benjamin like his brother Simon), making him doubly sacrilegious — both in the manner of obtaining the office and in his personal unworthiness.
2Mc	4	30	Accidit autem per idem tempus	But it happened that the Tarsians and the Mallotas raised a sedition, because they were given as a present to Antiochis, the king's concubine. The justice of God is displayed throughout this chapter: those who pursue ambition and gain by sacrilegious means are beset by revolts, conspiracies, and violent ends. The sedition provided the occasion for Antiochus to leave Andronicus in charge at Antioch — the very Andronicus who would murder Onias.
2Mc	4	34	Quam ob causam Menelaus	For which cause Menelaus, taking Andronicus apart, requested him to kill Onias. Onias had rebuked Menelaus publicly for stealing the sacred vessels, so Menelaus conspired to have him murdered. Andronicus, bribed with gifts, treacherously lured Onias out from the right of asylum he had taken at the sanctuary of Daphne near Antioch — renowned for its grove of Apollo and Artemis and for its absolutely inviolable asylum — and killed him there. The right of asylum in holy places was universally recognised even by pagans; to violate it was considered an unparalleled impiety.
2Mc	4	35	Propter quod non solum Judaei	For this cause even the Jews and Greeks were sore displeased, and were indignant at the unjust murder of the man. The universality of the moral outrage — felt even by pagans — proves both the eminence of Onias and the impiety of the crime. Even those outside the faith recognised a manifest injustice.
2Mc	4	38	Ita Deus per eum qui occiderat	God therefore repaid him with the punishment he deserved. By a most just divine judgment, Antiochus with his own hand struck Andronicus and put him to death — leading him first naked through the city stripped of his purple, and executing him in the very spot where Onias had been murdered. The execution in the place of the crime was an eloquent sign of divine retribution.
2Mc	4	39	Post haec autem plurima	But after many sacrileges were committed by Menelaus in the city…Lysimachus committed many acts of sacrilege. Menelaus used his brother Lysimachus to steal and sell the golden vessels of the temple. When the people of Jerusalem rose in anger at the repeated sacrileges, Lysimachus armed three thousand men against them; the people, using whatever came to hand (dust, stones, sticks), put the sacrilegious forces to flight and killed Lysimachus himself near the treasury.
2Mc	4	43	Contra Menelaum autem accusatio	Now when complaint was made against Menelaus before Antiochus. The elders of Jerusalem brought formal accusation against Menelaus before Antiochus at Tyre. Antiochus, bribed by Menelaus with money taken from the temple vessels, set aside the charges and condemned the innocent elders to death. Thus is the judgment of tyrants corrupted by money. Lapide notes: Ptolemaeus son of Dorymenes, who brought about this perverse judgment, is later punished by God's justice (chapter 10).
2Mc	4	47	Eos qui scelus perpetrassent	Accordingly he released those that were the cause of all the evil; even those wicked men he freed. The innocent are condemned, the guilty acquitted — the very inversion of justice. Lapide develops the moral on the corrupting power of bribery upon judicial authority, citing the Roman jurists on the duties of a just judge.
2Mc	4	48	Propter hoc etiam Tyrii	For this cause, even the Tyrians were indignant at this, and provided nobly for the burial of those who had been put to death. The men condemned by Antiochus at Menelaus's instigation — entirely innocent — were buried with honour by the citizens of Tyre. This act of decency by pagans stands as a rebuke to the impious Antiochus.
2Mc	5	1	Per idem tempus Antiochus	At the same time Antiochus prepared his second expedition into Egypt. This second expedition leads to the terrible consequences for Jerusalem that immediately follow. The chronological connection is important: the events that destroy Jerusalem flow directly from Antiochus's imperial ambitions, which in turn flow from the simony and apostasy of Jason and Menelaus.
2Mc	5	2	Contigit autem per universum	Throughout the city of Jerusalem, for the space of forty days, there appeared in the air horsemen running, in gilded raiment, and companies of spearmen armed with lances, and arrays of shields, and multitudes of men in helmets, with drawn swords. This aerial vision of armies is a prodigious heavenly sign of the imminent calamities about to fall through Antiochus. Such aerial prodigies are frequently mentioned by ancient historians (Josephus, Jewish War VI, v; Dio Cassius; Tacitus) as preceding great disasters. God sometimes permits such images — by natural causes (vapours, clouds, optical effects) or supernaturally — to warn people and move them to repentance.
2Mc	5	4	Omnes itaque rogabant	Wherefore every man prayed that the apparition might turn to good. Note the instinctive piety of the people: when faced with an ominous sign, they turned immediately to prayer. So the Christian threatened by signs of coming evils must run to prayer, fasting, and almsgiving — the three weapons with which Nineveh turned away divine wrath.
2Mc	5	5	Pervulgato autem falso rumore	When a false rumour was spread that Antiochus was dead…Jason took no less than a thousand men and by surprise attacked the city. Jason's opportunistic return shows his character: a traitor who had betrayed his country for the high priesthood now tried to reclaim it by violence. The bitter irony: Jason who had opened Jerusalem to Greek impiety now attacked it with Greek mercenaries in the name of recovering his own position.
2Mc	5	7	Non tamen habebat	But he did not gain the mastery of the government; the end of his treachery was disgrace, and he was again forced to flee. Jason's life ends in ignominy: he fled from country to country, died in exile without burial, \"unlamented, unburied, and without a country\" (v. 9–10). The universal moral: ambition and treachery destroy those who practise them.
2Mc	5	11	Hac de causa Antiochus	For this cause Antiochus moved out of Egypt in a rage, and took the city by force of arms. Antiochus interpreted Jason's brief seizure of Jerusalem as a revolt and used it as a pretext to attack. Thus the sins of individuals — the ambition of Jason, the treachery of Menelaus — brought catastrophe upon the whole people. This is a perpetual principle of divine providence: the sins of leaders and priests bring God's punishment upon the nation.
2Mc	5	17	Antiochus ergo inflatus mente	But Antiochus was puffed up in mind. He thought himself victorious by his own power, not recognising that God permitted the Jews to be punished through him on account of their sins. Scripture teaches throughout: when God's people are punished by foreign enemies, it is God who wills it as a chastisement, while the enemy is merely his instrument. This does not excuse Antiochus from guilt, since he acted out of malice and impiety.
2Mc	5	19	Non propter locum gentem	But the Lord had not chosen the people for the sake of the place; but the place for the sake of the people. Places are holy because of the people who worship God there and the divine mysteries celebrated in them; if the people sin, the holiness of the place does not protect them and may even aggravate their guilt, since they sin against greater light and more abundant grace.
2Mc	5	22	Linquebat autem et Philarchos	He left also governors to afflict the people. Philip the Phrygian, more barbarous by nature than his appointer, and Andronicus, were left in charge of Jerusalem to oppress the people; Gorgias was made governor of Idumaea. Note the ironical justice: a barbarian appointed to rule a people who had chosen barbarous customs over their own divine law; they received in their governor what they had chosen in their manner of life.
2Mc	5	24	Misit autem et Apollonium	He sent also Apollonius the captain of the Mysians with an army of two and twenty thousand men. Apollonius came to Jerusalem feigning peace, then waited until the Sabbath when the Jews were at rest and suddenly attacked and massacred great numbers. Lapide notes the particular wickedness of attacking on the Sabbath, when the Jews were defenceless by reason of religious observance.
2Mc	5	26	Consecravitque templum	He dedicated the temple in Jerusalem to Jupiter Olympius, and that in Garizim to Jupiter Hospitis. The dedication of the Jerusalem temple to Zeus/Jupiter Olympius — placing a Greek idol in the holy place — is the \"abomination of desolation\" foretold by Daniel (9:27; 11:31; 12:11) and referred to by Christ (Matthew 24:15). Jupiter Olympius was the chief deity of Greece, enthroned on Olympus, whose great gold-and-ivory statue by Pheidias at Elis was counted one of the Seven Wonders of the ancient world.
2Mc	5	27	Judas vero Machabaeus	But Judas Maccabeus, the tenth of the number, and the rest of his company, withdrew into the deserts, and lived in the mountains after the manner of wild beasts. This is the providential beginning of the Maccabean revolt — Judas with nine companions withdrew to the mountains rather than defile themselves with the king's impurity. From this small band of ten faithful men, God would raise up the great Maccabean army. Application: the saints, when the world is corrupted around them, withdraw into their interior desert of prayer and mortification, from which they emerge as instruments of God's justice.
2Mc	6	1	Non post multum tempus	Not long after, the king sent a certain old man of Antioch to compel the Jews to depart from the laws of their fathers. Antiochus's campaign to extirpate the Jewish religion is here described systematically. Lapide calls this the most dreadful persecution the Jewish people had endured — worse than the Egyptian slavery, worse than the Babylonian captivity — because it was directed not merely at the body but at the soul and the very existence of the true religion.
2Mc	6	2	Et contaminare templum	And to pollute the temple in Jerusalem, and to call it the temple of Jupiter Olympius. Heathen sacrifices, prostitution in the holy courts, and forbidden offerings were introduced. The violation of a sacred place is the gravest act of impiety in Lapide's theological framework — an injury to God himself who chose to dwell there. The examples of Heliodorus (chapter 3) and Antiochus himself (chapter 9) demonstrate that God does not permit such outrages to pass unpunished.
2Mc	6	7	Cogebantur etiam in die natali	On the birthday of the king they were forced to go about with garlands of ivy, in honour of Bacchus. Not only was the temple polluted, but Jews were compelled to participate in pagan feasts — forced to crown themselves with ivy (sacred to Bacchus) and walk in procession at pagan festivals. This compelled apostasy shows the diabolic thoroughness of Antiochus's persecution: he wished not merely to kill Jews, but to make them apostates.
2Mc	6	8	Per civitates autem Graecias	There went out a decree by the neighbouring cities of the heathens. The persecution was extended to all Jews in the Greek cities near Judea, who were also compelled to participate in pagan sacrifices. Lapide calls this a type and foreshadowing of the future persecution of Antichrist.
2Mc	6	11	Qui etiam in speluncis latitabant	And those who had gone to hide in dens and caves to keep the seventh day secretly, were discovered by Philip, and were all burnt together, because they did not defend themselves through fear of breaking the glory of the most holy day. These Jews allowed themselves to be burned alive rather than break the Sabbath by fighting — an act that Judas Maccabeus would later forbid (1 Maccabees 2:41). Lapide: this is an example of misguided zeal exceeding what the law requires; but also of astonishing fidelity to the divine commandment, which shames Christians who break God's law for the slightest worldly advantage.
2Mc	6	18	Eleazarum quemdam de primis	Eleazar, one of the principal scribes, a man advanced in years and of a comely countenance, was pressed to open his mouth and eat swine's flesh. The martyrdom of Eleazar the elderly scribe: a man of distinguished learning, advanced age, and noble appearance, he was pressed to eat swine's flesh (absolutely forbidden by the Law) and so apostatize. He refused with complete clarity. Lapide praises Eleazar as the perfect type of the learned elder: not only knowing the law but keeping it unto death. His martyrdom preceded and inspired the seven brothers and their mother.
2Mc	6	20	Praesumendo eo quod porcina	Choosing a glorious death rather than a hateful life. Eleazar chose death, because a life preserved by apostasy is not life but a living death — the death of the soul is far worse than the death of the body. Lapide develops this theme at length, citing the Fathers on the proper hierarchy of goods: soul before body, virtue before life, God before all created things.
2Mc	6	23	Pro aetate autem et senio	Making answer according to his age and the dignity of his excellent life…he said straightway. Eleazar's response is a masterpiece of dignified courage: he refuses the king's command on the grounds that the divine law is absolutely binding, and that no human authority can dispense from it. This is the proper response of the Christian martyr who recognises the absolute priority of God's authority: \"We must obey God rather than men\" (Acts 5:29).
2Mc	6	26	Nunc autem iram legis	But now, being ready to suffer, I will endure the bitterness of pains, and not permit those wicked pains to prevail against my soul. Eleazar's declaration: he knows his torture will be severe, but chooses it freely, with full understanding — not driven by passion but from a rational and free choice of the greatest good. Lapide calls this \"martyrdom of the will\" — the inner consent that makes suffering meritorious before God.
2Mc	6	28	Relinquens exemplum virtutis	Leaving an example of virtue and fortitude to the young. Eleazar's death is explicitly for the instruction and strengthening of the young. This pedagogical function of martyrdom is emphasised by Lapide: the witness of those who die for God teaches the living that the faith is worth dying for, sustaining the community through persecution.
2Mc	6	30	In doloribus autem constitutus	Thus he died, leaving his death for an example of noble courage and a memorial of virtue. Eleazar's death is the foundation of a tradition of martyrdom. Lapide compares it to the death of Socrates (who died for philosophy) and finds it far superior, since Eleazar died for divine truth rather than mere human wisdom.
2Mc	7	1	Contigit autem septem fratres	It came to pass also that seven brethren together with their mother were apprehended, and compelled by the king to eat swine's flesh in violation of God's law. The narrative of the seven Maccabean brothers and their mother is the theological and literary climax of the whole book. All the Church Fathers celebrate this martyrdom with extraordinary praise; these martyrs are commemorated in the Roman Martyrology on the first of August. The seven brothers are types of the Christian martyrs who resist the tyrant Antichrist. Lapide assembles the tributes of St. Gregory Nazianzen (Oration 22), St. Ambrose (De Jacob II, xii), St. Augustine (Serm. 109–110), St. Cyprian (Ep. VI), St. Chrysostom (Hom. De Nativit. Machab.), Prudentius (Hymn De Romano Mart.), Gaudentius of Brescia, St. Leo, St. Ephrem, Victorinus Afer, St. Prosper, St. Bernard (Ep. 98), and Theophilus of Alexandria.
2Mc	7	2	Unus autem ex eis qui	But one of them, who was the eldest, said thus: What wouldst thou ask, or learn of us? The first brother's defiance is immediately confident: he answers the tyrant's question directly, without fear. Lapide notes the courage required to speak first — not only to face one's own death, but to do so publicly and without hesitation, setting an example for his brothers.
2Mc	7	3	Tunc rex in iracundiam	Then the king being angry commanded frying pans and brazen caldrons to be made hot. The instruments of torture — frying pans and heated cauldrons — are designed for maximum pain and terror. Antiochus's tactics were calibrated to break the will of victims: public humiliation, then the most frightening instruments, then the prolonged spectacle of suffering, intended to make the younger brothers recant when they saw their elders die.
2Mc	7	4	Et quem prius arripi jussit	And him that had been the leader being instantly seized, they cut off his tongue, and having scalped him, they cut off also the extremities of his hands and feet, the rest of his brethren and his mother beholding. The tongue was cut out first because it was the instrument by which the brother defied the king; the hands and feet because they are the principal instruments of bodily action. Yet the brother endured all in silence. The power of God's grace is demonstrated precisely here: the human body, incapable of such endurance by nature, is sustained by supernatural strength.
2Mc	7	5	Adhuc autem eo spirante	While he was yet breathing, and the fire was applied to him, the rest together with their mother exhorted one another to die manfully. Lapide emphasises the mother's role: present throughout all her sons' deaths, she does not faint or plead but exhorts them to die bravely. This reversal of the natural maternal instinct — a mother rejoicing in her children's deaths — is the sign of supernatural grace operating powerfully. St. Ambrose (De Jacob II, xii): \"Not thus does the moon shine among the stars as this mother shines among her sons; and as she led them to martyrdom to enlighten them, she gleamed, and as she lay embraced among her victorious sons she gleamed. O truly a mother stronger than adamant, sweeter than honey, more fragrant than a flower!\"
2Mc	7	6	Dominus Deus aspicit	The Lord God looketh upon us, and in truth hath comfort in us: as Moses declared in the profession of the canticle: And in his servants he shall take comfort. The dying martyr cites Scripture as the grounds of his hope. God sees and will be comforted in (i.e., will vindicate) his servants. Lapide explains: this is the faith of martyrdom — not merely hope of personal resurrection, but the conviction that God's honour demands the vindication of those who died for him.
2Mc	7	8	Mutua autem increpationis	In like manner the second suffered the torments of the first. Lapide notes the structural pattern of the narrative: each brother's martyrdom recapitulates the essential elements of the first, with the additions of each brother's specific words. This pattern serves both literary and theological purposes: literary, in creating cumulative drama; theological, in demonstrating that grace is given anew to each soul that freely chooses to suffer for God.
2Mc	7	10	Proximus autem ille	After him the third was made a mocking-stock, and when he was required, he quickly put forth his tongue and courageously stretched out his hands. The third brother's act of voluntarily stretching out his hands for mutilation — without waiting to be seized — is a supreme act of free will. Lapide: here the will entirely transcends the fear of suffering; the martyr anticipates and embraces the pain, showing that his suffering is wholly voluntary and therefore maximally meritorious.
2Mc	7	11	Et constantem animum	And stood undaunted and said: These I had from heaven, but for the laws of God I now despise them, and from him I hope to receive them again. The third brother's declaration is the first explicit statement of the resurrection of the body in this narrative. Lapide gives it extensive treatment: the resurrection of the body was taught by the Mosaic law at least implicitly and more explicitly by the later prophets; the Maccabean martyrs understood it clearly enough to give up their bodies in the hope of recovering them glorified.
2Mc	7	13	Et hic similiter tractatus	After him the fourth was also tormented. The pattern continues; with the fourth brother, the theme of divine retribution is introduced: \"thou shalt have no resurrection unto life.\" This is a curse, not a promise — Antiochus will rise, but only to be judged, not to life.
